sourceurl,sqldate,title,scrape_status,in_zambia_confidence,mining_related_confidence,impact_confidence,impact_evidence,mine_name,region,mineral_type,mining_company,impact_level1,impact_level2,impact_level3
https://www.marketscreener.com/news/latest/DRC-says-it-is-in-talks-with-Zambia-to-quickly-reopen-closed-border-47621225/,20240811,DRC says it is in talks with Zambia to quickly reopen closed border | MarketScreener,live_ok_trafilatura,0.9,0.95,0.8,"Environmental | Land, Soil & Geology | Transport corridors and access road impacts -> ""blocking a key export route for Congo, the world's second largest copper producer."" | ""Most of Congo's copper exports pass through the town of Kasumbalesa and into Zambia."" || Governance | Regulation, Compliance & Institutions | Legislative and regulatory framework effectiveness -> ""In the statement, he detailed the two countries' trade agreement and its dispute settlement mechanisms."" | ""which also prohibits any retaliatory measures.""",,Kasumbalesa,copper,,Environmental || Governance,"Land, Soil & Geology || Regulation, Compliance & Institutions",Transport corridors and access road impacts || Legislative and regulatory framework effectiveness
https://www.marketscreener.com/news/latest/Zambia-to-reopen-closed-border-with-Democratic-Republic-of-Congo-47629588/,20240812,Zambia to reopen closed border with Democratic Republic of Congo | MarketScreener,live_ok_trafilatura,0.98,0.98,0.9,"Environmental | Land, Soil & Geology | Transport corridors and access road impacts -> ""blocking a key export route for the world's second largest copper producer"" | ""Most of Congo's copper exports pass through the town of Kasumbalesa and into Zambia.""",,Kasumbalesa,copper,,Environmental,"Land, Soil & Geology",Transport corridors and access road impacts
https://www.miningmx.com/trending/57912-zambia-law-change-could-deliver-fatal-blow-to-copper-target/,20240808,"Zambia law change could deliver ""fatal blow"" to copper target - Miningmx",live_ok_trafilatura,0.95,0.95,0.9,"Governance | Regulation, Compliance & Institutions | Mining permitting and licensing practices -> ""Zambia is proposing a Minerals Regulation Commission Bill that would allow the government to acquire a shareholding in exploration areas before licences to search for minerals including copper are granted to investors."" || Governance | Equity, Rights & Vulnerable Groups | Land ownership impacts and regional value changes -> """"(With) the prospect of forced 'free carry' acquisitions by the state of stakes in new ventures, this Bill will seriously undermine property rights,"" the mining industry bodies said."" || Governance | Reputation & Social License | Mining image and public perception -> ""some parts of the proposed law ""will drive up the perception of investment risk"" in the country.""",,,copper,"['Barrick Gold', 'First Quantum Minerals']",Governance || Governance || Governance,"Regulation, Compliance & Institutions || Equity, Rights & Vulnerable Groups || Reputation & Social License",Mining permitting and licensing practices || Land ownership impacts and regional value changes || Mining image and public perception
https://www.miningweekly.com/article/zambia-closes-border-with-drc-blocking-key-copper-trade-route-2024-08-12,20240812,"Zambia closes border with DRC, blocking key copper trade route",live_ok_newspaper,0.95,0.95,0.75,"Environmental | Land, Soil & Geology | Transport corridors and access road impacts -> """"We may start experiencing a build-up of trucks."""" | ""Zambia has temporarily shut its borders with the Democratic Republic of Congo (DRC), the government said at the weekend, in a move that could delay exports from Africa's biggest copper producer."" || Social | Livelihoods & Economy | Income generation and poverty reduction or exacerbation -> ""a move that could delay exports from Africa's biggest copper producer.""",,,copper,,Environmental || Social,"Land, Soil & Geology || Livelihoods & Economy",Transport corridors and access road impacts || Income generation and poverty reduction or exacerbation
https://www.news24.com/fin24/economy/zambias-proposed-mining-law-bad-for-investment-miners-say-20240807,20240818,"Zambia's proposed mining law bad for investment, miners say | News24",live_ok_newspaper,0.98,0.98,0.8,"Governance | Reputation & Social License | Mining image and public perception -> """"will drive up the perception of investment risk in Zambia"""" || Social | Equity, Rights & Vulnerable Groups | Land ownership impacts and regional value changes -> """"this Bill will seriously undermine property rights,"" the mining industry bodies said."" || Governance | Transparency & Accountability | Anti-corruption and bribery risks -> """"The Bill also grants unaccountable and arbitrary discretionary decision making powers to individual regulators, which present obvious future corruption risks,"" they added."" || Governance | Regulation, Compliance & Institutions | Legislative and regulatory framework effectiveness -> ""Zambia's government has proposed a new Minerals Regulation Commission Bill, which seeks to ""regulate and monitor the development and management of mineral resources"""" | """"due to...the prospect of forced 'free carry' acquisitions by the state of stakes in new ventures, this Bill will seriously undermine property rights,"" the mining industry bodies said."" || Governance | Reputation & Social License | Trust between mining companies, government, and communities -> ""the seizure of Konkola Copper Mines from Vedanta by the previous administration in 2019.""",Konkola Copper Mines; Mopani Copper Mines,,copper,Vedanta; Barrick Gold; First Quantum Minerals; International Resources Holding; Glencore,Governance || Social || Governance || Governance || Governance,"Reputation & Social License || Equity, Rights & Vulnerable Groups || Transparency & Accountability || Regulation, Compliance & Institutions || Reputation & Social License","Mining image and public perception || Land ownership impacts and regional value changes || Anti-corruption and bribery risks || Legislative and regulatory framework effectiveness || Trust between mining companies, government, and communities"
https://www.prokerala.com/news/articles/a1555553.html,20240813,"Congo, Zambia to reopen border posts",live_ok_trafilatura,0.98,0.98,0.8,"Environmental | Land, Soil & Geology | Transport corridors and access road impacts -> ""the Zambian government closed the border posts with Congo, saying the closure was a security measure due to protests by truck drivers angry at Congo's decision in June to ban the import of products such as beer and soft drinks for 12 months."" | ""Congo and Zambia rely heavily on roads for the export of precious metals, notably copper and cobalt.""",,,copper and cobalt,,Environmental,"Land, Soil & Geology",Transport corridors and access road impacts
https://www.the-star.co.ke/news/africa/2024-08-12-dr-congo-zambia-in-talks-to-re-open-border-after-trade-dispute/,20240812,"DR Congo, Zambia in talks to re-open border after trade dispute",live_ok_trafilatura,0.9,0.9,0.8,"Social | Livelihoods & Economy | Business opportunities (local supply chains, services) -> ""The closure has disrupted a crucial export route for the DRC, the world's second-largest copper producer."" || Environmental | Land, Soil & Geology | Transport corridors and access road impacts -> ""The closure has disrupted a crucial export route for the DRC, the world's second-largest copper producer."" || Governance | Regulation, Compliance & Institutions | Legislative and regulatory framework effectiveness -> ""Kahongy emphasized that the trade agreement prohibits retaliatory measures, such as border closures.""",,,copper,,Social || Environmental || Governance,"Livelihoods & Economy || Land, Soil & Geology || Regulation, Compliance & Institutions","Business opportunities (local supply chains, services) || Transport corridors and access road impacts || Legislative and regulatory framework effectiveness"
https://www.theindependent.co.zw/opinion/article/200031000/trade-diplomacy-in-sadc-navigating-borders-disputes-and-resilience,20240821,"Trade diplomacy in Sadc: Navigating borders, disputes and resilience - The Zimbabwe Independent",live_ok_trafilatura,0.9,0.6,0.65,"Social | Livelihoods & Economy | Employment creation and job security -> ""In retaliation, Zambia shut down three border crossings — Sakania, Mokambo, and Kasumbalesa (Sadc's second-busiest border after Beitbridge) — to safeguard its balance of trade and employment."" || Social | Livelihoods & Economy | Income generation and poverty reduction or exacerbation -> ""This closure disrupted not only the movement of goods but also the flow of people, destabilising economic stability in both nations."" | ""The DRC, a landlocked nation heavily dependent on mineral exports, was particularly vulnerable to Zambia's border closures, which threatened its economic stability."" || Environmental | Land, Soil & Geology | Transport corridors and access road impacts -> ""In retaliation, Zambia shut down three border crossings — Sakania, Mokambo, and Kasumbalesa (Sadc's second-busiest border after Beitbridge) — to safeguard its balance of trade and employment."" | ""This closure disrupted not only the movement of goods but also the flow of people, destabilising economic stability in both nations."" | ""Zambia's response to the DRC's trade policy also exposed the vulnerability of supply chains across the region.""",,"Kasumbalesa, Sakania, Mokambo",,,Social || Social || Environmental,"Livelihoods & Economy || Livelihoods & Economy || Land, Soil & Geology",Employment creation and job security || Income generation and poverty reduction or exacerbation || Transport corridors and access road impacts
https://www.thestar.com.my/news/world/2024/08/14/3-illegal-miners-die-in-nw-zambia,20240813,3 illegal miners die in NW Zambia | The Star,live_ok_trafilatura,1.0,0.96,0.9,"Social | Health, Safety & Well-being | Accidents and fatalities (including structural failures such as tailings dams) -> ""Three illegal miners died after being trapped in a mine where they were digging for suspected gold in northwestern Zambia's Kasempa District, police said on Tuesday."" | ""Mine accidents involving illegal miners are common in Zambia. Last year, more than 30 illegal miners were trapped at a mine in Chingola District in Copperbelt Province after tunnels collapsed due to heavy rains."" || Environmental | Land, Soil & Geology | Surface ground instability and subsidence -> ""Last year, more than 30 illegal miners were trapped at a mine in Chingola District in Copperbelt Province after tunnels collapsed due to heavy rains."" || Governance | Regulation, Compliance & Institutions | Mining permitting and licensing practices -> ""The government has since declared war on illegal mining, and has urged people wishing to engage in mining to apply for a license so that their operations are legalized, according to safety standards."" || Governance | Regulation, Compliance & Institutions | Enforcement of environmental and social regulations -> ""The government has since declared war on illegal mining..."" || Social | Health, Safety & Well-being | Worker health and safety risks -> ""Mine accidents involving illegal miners are common in Zambia.""",,Kasempa District,gold,,Social || Environmental || Governance || Governance || Social,"Health, Safety & Well-being || Land, Soil & Geology || Regulation, Compliance & Institutions || Regulation, Compliance & Institutions || Health, Safety & Well-being",Accidents and fatalities (including structural failures such as tailings dams) || Surface ground instability and subsidence || Mining permitting and licensing practices || Enforcement of environmental and social regulations || Worker health and safety risks
https://www.timesofearth.com/2024/08/12/drc-says-it-is-in-talks-with-zambia-to-quickly-reopen-closed-border/,20240812,DRC says it is in talks with Zambia to quickly reopen closed border – The Times Of Earth,live_ok_trafilatura,0.9,0.95,0.85,"Environmental | Land, Soil & Geology | Transport corridors and access road impacts -> ""sealed their common border, blocking a key export route for Congo, the world's second largest copper producer."" | ""Zambia is a key export route for the Central African country. Most of Congo's copper exports pass through the town of Kasumbalesa and into Zambia."" || Governance | Regulation, Compliance & Institutions | Legislative and regulatory framework effectiveness -> ""he detailed the two countries' trade agreement and its dispute settlement mechanisms."" | """"There is to date no dispute brought to (the ministry's) attention in writing or through diplomatic channels,""""",,Kasumbalesa,copper,,Environmental || Governance,"Land, Soil & Geology || Regulation, Compliance & Institutions",Transport corridors and access road impacts || Legislative and regulatory framework effectiveness
https://www.winnipegfreepress.com/world/2024/08/12/zambia-and-congo-will-discuss-a-border-dispute-that-affects-the-flow-of-minerals-like-cobalt,20240812,Zambia and Congo reopen their border after resolving a trade dispute – Winnipeg Free Press,live_ok_trafilatura,0.99,0.95,0.85,"Social | Livelihoods & Economy | Business opportunities (local supply chains, services) -> ""Zambia's decision to shut its border threatened Congo's ability to export its minerals."" | ""Much of it passes through Zambia on its way to the coast for shipping."" | ""Zambia is also a key gateway for Congo's imports."" || Social | Equity, Rights & Vulnerable Groups | Crime and social disorder (corruption, violence, substance abuse) -> ""That resulted in protests by Congolese truckers near the border town of Kasumbalesa.""",,Kasumbalesa,cobalt,,Social || Social,"Livelihoods & Economy || Equity, Rights & Vulnerable Groups","Business opportunities (local supply chains, services) || Crime and social disorder (corruption, violence, substance abuse)"
