sourceurl,sqldate,title,scrape_status,in_zambia_confidence,mining_related_confidence,impact_confidence,impact_evidence,mine_name,region,mineral_type,mining_company,impact_level1,impact_level2,impact_level3
https://allafrica.com/stories/202408130015.html,20240813,,wayback_ok,0.95,0.95,0.8,"Social | Livelihoods & Economy | Income generation and poverty reduction or exacerbation -> ""The decision to shutter the Zambian border threatened Congo's ability to export its minerals"" || Social | Livelihoods & Economy | Business opportunities (local supply chains, services) -> ""Zambia key gateway to Congolese minerals"" | ""The decision to shutter the Zambian border threatened Congo's ability to export its minerals as it is a key export route for copper from mines in the south of the DRC."" | ""Landlocked Congo, meanwhile, has huge gold, copper and cobalt reserves and a large portion of it passes through Zambia en route to the coast for shipping.""",,Kasumbalesa,copper,,Social || Social,Livelihoods & Economy || Livelihoods & Economy,"Income generation and poverty reduction or exacerbation || Business opportunities (local supply chains, services)"
https://bulawayo24.com/index-id-news-sc-national-byo-244713.html,20240818,SADC countries reducing themselves to world-famous beggars - Bulawayo24 News,live_ok_trafilatura,0.7,0.95,0.8,"Social | Livelihoods & Economy | Income generation and poverty reduction or exacerbation -> ""have yet to deliver the promised economic benefits to ordinary citizens."" | ""leads to ineffective negotiations and a lack of benefits for the people."" || Social | Livelihoods & Economy | Human capital development (skills, training, workforce development) -> ""facilitate skills transfers to enhance local expertise."" || Social | Livelihoods & Economy | Business opportunities (local supply chains, services) -> ""focus on adding value within the region""",,,"gold, platinum, diamonds, lithium",,Social || Social || Social,Livelihoods & Economy || Livelihoods & Economy || Livelihoods & Economy,"Income generation and poverty reduction or exacerbation || Human capital development (skills, training, workforce development) || Business opportunities (local supply chains, services)"
https://bulawayo24.com/news/national/244726,20240818,Zambia arrests Chinese nationals smuggling 29.9kg of gold from Zimbabwe - Bulawayo24 News,live_ok_trafilatura,0.95,0.95,0.8,"Governance | Regulation, Compliance & Institutions | Enforcement of environmental and social regulations -> ""Zambian police have arrested two Chinese nationals, Zhao Yanjing (46) and Zhao Changson (58), for attempting to smuggle 29.9 kilograms of gold and US$200,000 in cash from Zimbabwe."" | ""The gold and cash have been secured as evidence, and further investigations are ongoing."" | ""Zimbabwe, which reportedly loses about US$100 million worth of gold monthly due to smuggling, is intensifying efforts to curb these activities, including installing advanced surveillance systems at border posts and airports."" || Social | Equity, Rights & Vulnerable Groups | Crime and social disorder (corruption, violence, substance abuse) -> ""Zambian police have arrested two Chinese nationals, Zhao Yanjing (46) and Zhao Changson (58), for attempting to smuggle 29.9 kilograms of gold and US$200,000 in cash from Zimbabwe."" | ""The gold, hidden in secret compartments within the door panels of a Toyota Land Cruiser Prado with Zimbabwean plates, was discovered as the suspects tried to cross into Zambia."" | ""This incident highlights the growing issue of illegal gold smuggling in the region.""",,,gold,,Governance || Social,"Regulation, Compliance & Institutions || Equity, Rights & Vulnerable Groups","Enforcement of environmental and social regulations || Crime and social disorder (corruption, violence, substance abuse)"
https://english.news.cn/20240813/edc61896fd6b46aaa624f5536ddeccfe/c.html,20240813,"DR Congo, Zambia to reopen border posts-Xinhua",live_ok_trafilatura,0.95,0.95,0.85,"Environmental | Land, Soil & Geology | Transport corridors and access road impacts -> ""The DRC and Zambia rely heavily on roads for the export of precious metals, notably copper and cobalt."" | ""Zambia is a key export route for the DRC, the world's second-largest producer of copper in 2023.""",,,copper and cobalt,,Environmental,"Land, Soil & Geology",Transport corridors and access road impacts
https://news.webindia123.com/news/Articles/Business/20240808/4223188.html,20240808,NAVA Sustains Growth and Momentum with Robust Performance and Organic Expansion,live_ok_newspaper,0.95,0.95,0.85,"Social | Livelihoods & Economy | Income generation and poverty reduction or exacerbation -> ""Mining division sustained coal sales and revenues"" | ""Mining division has maintained the external coal sales and optimum supplies to power plant"" || Social | Equity, Rights & Vulnerable Groups | Wealth distribution and inequality -> ""NBS paid maiden dividend of US$ 10 Mn to Nava Limited, since its investment in Maamba Energy Limited"" | ""Distributions to sponsors: MEL has commenced discharge of outstanding dues to the Sponsors, paying US$ 40.8 Mn to both the sponsors since Apr 24"" || Environmental | Air & Climate | Fossil fuel consumption -> ""Mining division has maintained the external coal sales and optimum supplies to power plant"" | ""Operational Excellence: MEL achieved close to 100% Plant Load Factor (PLF), showcasing exceptional operational efficiency.""",Maamba Energy Limited (formerly Maamba Collieries Limited),,coal,Maamba Energy Limited,Social || Social || Environmental,"Livelihoods & Economy || Equity, Rights & Vulnerable Groups || Air & Climate",Income generation and poverty reduction or exacerbation || Wealth distribution and inequality || Fossil fuel consumption
https://newstodaynet.com/2024/08/14/zambia-and-congo-reopen-border/,20240814,Zambia and Congo reopen border - News Today | First with the news,live_ok_trafilatura,0.95,0.95,0.7,"Environmental | Land, Soil & Geology | Transport corridors and access road impacts -> ""Zambia is a crucial transit route for Congolese minerals such as gold, copper, and cobalt"" || Social | Livelihoods & Economy | Income generation and poverty reduction or exacerbation -> ""The border closure posed a significant threat to Congo's mineral exports"" || Social | Livelihoods & Economy | Business opportunities (local supply chains, services) -> ""drew criticism from Zambian business groups, who warned that it could set a ""dangerous precedent"" for future trade relations"" || Social | Equity, Rights & Vulnerable Groups | Crime and social disorder (corruption, violence, substance abuse) -> ""The ban led to protests by Congolese truckers near the border town of Kasumbalesa""",,Kasumbalesa,"gold, copper, cobalt",,Environmental || Social || Social || Social,"Land, Soil & Geology || Livelihoods & Economy || Livelihoods & Economy || Equity, Rights & Vulnerable Groups","Transport corridors and access road impacts || Income generation and poverty reduction or exacerbation || Business opportunities (local supply chains, services) || Crime and social disorder (corruption, violence, substance abuse)"
https://northafricapost.com/79447-zambia-drc-reopen-their-border-after-successful-talks-to-resolve-trade-dispute.html,20240814,"Zambia, DRC reopen their border after successful talks to resolve trade dispute – The North Africa Post",live_ok_trafilatura,0.95,0.9,0.85,"Social | Livelihoods & Economy | Income generation and poverty reduction or exacerbation -> ""Zambia's decision to shut its border threatened landlocked DRC's ability to export its minerals"" || Social | Equity, Rights & Vulnerable Groups | Crime and social disorder (corruption, violence, substance abuse) -> ""resulting in protests by Congolese truckers near the border town of Kasumbalesa."" || Social | Livelihoods & Economy | Business opportunities (local supply chains, services) -> ""Zambian business groups also criticized the ban, with the country's Association of Manufacturers saying it could set a ""dangerous precedent for future trade relations.""""",,Kasumbalesa,"gold, copper and cobalt",,Social || Social || Social,"Livelihoods & Economy || Equity, Rights & Vulnerable Groups || Livelihoods & Economy","Income generation and poverty reduction or exacerbation || Crime and social disorder (corruption, violence, substance abuse) || Business opportunities (local supply chains, services)"
https://www.africanews.com/2024/08/13/zambia-and-congo-reopen-their-border-after-resolving-a-trade-dispute/,20240813,Zambia and Congo reopen their border after resolving a trade dispute | Africanews,live_ok_trafilatura,0.95,0.95,0.7,"Social | Livelihoods & Economy | Business opportunities (local supply chains, services) -> ""Zambia's decision to shut its border threatened Congo's ability to export its minerals."" | ""Much of it passes through Zambia on its way to the coast for shipping.""",,Kasumbalesa,cobalt; copper; gold,,Social,Livelihoods & Economy,"Business opportunities (local supply chains, services)"
https://www.albawaba.com/news/dr-congo-and-zambia-begin-talks-1581101,20240812,DR Congo and Zambia begin talks following closing borders | Al Bawaba,live_ok_trafilatura,0.95,0.98,0.78,"Social | Livelihoods & Economy | Income generation and poverty reduction or exacerbation -> ""Zambia's decision to close its border with DR Congo has created a crisis for the world's second-largest copper producer as both countries are in urgent talks to reopen the border and restore trade."" || Environmental | Land, Soil & Geology | Transport corridors and access road impacts -> ""blocking a key export route for Congo, the world's second-largest copper producer"" | ""Most of Congo's copper exports pass through the town of Kasumbalesa and into Zambia.""",,Kasumbalesa,copper,,Social || Environmental,"Livelihoods & Economy || Land, Soil & Geology",Income generation and poverty reduction or exacerbation || Transport corridors and access road impacts
https://www.bignewsnetwork.com/news/274492558/xinhua-world--summary-at-0030-gmt-aug-14,20240814,"Xinhua world news summary at 0030 GMT, Aug. 14",live_ok_newspaper,0.95,0.95,0.9,"Social | Health, Safety & Well-being | Accidents and fatalities (including structural failures such as tailings dams) -> ""Three illegal miners died after being trapped in a mine where they were digging for suspected gold in northwestern Zambia's Kasempa District, police said on Tuesday."" | ""Rae Hamoonga, the police spokesperson, said the accident happened in the early hours of Tuesday at a mine where the illegal miners had gone to dig for gold."" || Social | Health, Safety & Well-being | Worker health and safety risks -> ""Three illegal miners died after being trapped in a mine where they were digging for suspected gold in northwestern Zambia's Kasempa District, police said on Tuesday."" | ""Rae Hamoonga, the police spokesperson, said the accident happened in the early hours of Tuesday at a mine where the illegal miners had gone to dig for gold.""",,Kasempa District,gold,,Social || Social,"Health, Safety & Well-being || Health, Safety & Well-being",Accidents and fatalities (including structural failures such as tailings dams) || Worker health and safety risks
https://www.chronicle.co.zw/zambian-police-arrest-two-chinese-nationals-smuggling-29-9kg-of-gold-from-zimbabwe/,20240818,,wayback_ok,0.99,0.95,0.8,"Social | Livelihoods & Economy | Income generation and poverty reduction or exacerbation -> ""Zimbabwe, which is estimated to lose at least US$100 million worth of gold each month due to smuggling through its porous borders, has been intensifying efforts to curb these activities."" | ""Gold remains Zimbabwe's largest foreign currency earner, making the battle against smuggling a crucial economic priority for the country."" || Social | Equity, Rights & Vulnerable Groups | Crime and social disorder (corruption, violence, substance abuse) -> ""The latest development underscores growing concerns about illegal gold smuggling in the region and the complex networks involved in these operations."" || Governance | Regulation, Compliance & Institutions | Enforcement of environmental and social regulations -> ""Government is now in the process of rolling out measures to plug the leakages."" | ""Some of the measures that the Government has implemented to plug the leakages include installing a sophisticated computerised system and drones at the country's border posts and airports which can detect illegal activities.""",,,gold,,Social || Social || Governance,"Livelihoods & Economy || Equity, Rights & Vulnerable Groups || Regulation, Compliance & Institutions","Income generation and poverty reduction or exacerbation || Crime and social disorder (corruption, violence, substance abuse) || Enforcement of environmental and social regulations"
https://www.cnbcafrica.com/2024/african-markets-factors-to-watch-on-aug-12/,20240812,African Markets - Factors to watch on Aug 12 - CNBC Africa,live_ok_trafilatura,0.9,0.9,0.8,"Environmental | Land, Soil & Geology | Transport corridors and access road impacts -> ""Democratic Republic of Congo said on Sunday it had begun talks with Zambia a day after its southern African neighbour sealed their common border, blocking a key export route for Congo, the world's second-largest copper producer.""",,,copper,,Environmental,"Land, Soil & Geology",Transport corridors and access road impacts
https://www.cnbcafrica.com/2024/drc-says-it-is-in-talks-with-zambia-to-quickly-reopen-closed-border/,20240812,DRC says it is in talks with Zambia to quickly reopen closed border - CNBC Africa,live_ok_trafilatura,0.95,0.95,0.8,"Environmental | Land, Soil & Geology | Transport corridors and access road impacts -> ""blocking a key export route for Congo, the world's second largest copper producer."" | ""Most of Congo's copper exports pass through the town of Kasumbalesa and into Zambia.""",,Kasumbalesa,copper,,Environmental,"Land, Soil & Geology",Transport corridors and access road impacts
https://www.cnbcafrica.com/2024/zambia-to-reopen-closed-border-with-democratic-republic-of-congo/,20240813,Zambia to reopen closed border with Democratic Republic of Congo - CNBC Africa,live_ok_trafilatura,0.99,0.99,0.85,"Social | Livelihoods & Economy | Business opportunities (local supply chains, services) -> ""blocking a key export route for the world's second largest copper producer, the two countries said in a joint statement on Monday."" | ""Most of Congo's copper exports pass through the town of Kasumbalesa and into Zambia."" || Governance | Regulation, Compliance & Institutions | Legislative and regulatory framework effectiveness -> ""Mulenga made the announcement after a Congolese ban on imported soft drinks and beer led to demonstrations by Congolese transporters in the border town of Kasumbalesa."" | ""it said it would authorise the import of goods covered under the ban whose importation had been initiated before the ban came into effect.""",,Kasumbalesa,copper,,Social || Governance,"Livelihoods & Economy || Regulation, Compliance & Institutions","Business opportunities (local supply chains, services) || Legislative and regulatory framework effectiveness"
https://www.devdiscourse.com/article/politics/3049365-congo-and-zambia-begin-talks-to-reopen-key-copper-export-border,20240811,Congo and Zambia Begin Talks to Reopen Key Copper Export Border | Politics,live_ok_trafilatura,0.9,0.9,0.6,"Social | Livelihoods & Economy | Income generation and poverty reduction or exacerbation -> ""affecting Congo's copper exports."" | ""which has impacted the export of copper, Congo's top commodity.""",,Kasumbalesa,copper,,Social,Livelihoods & Economy,Income generation and poverty reduction or exacerbation
https://www.dw.com/en/zambia-to-reopen-border-with-drc-after-trade-dispute/a-69924708,20240812,Zambia to reopen border with DRC after trade dispute,live_ok_trafilatura,0.9,0.9,0.8,"Social | Livelihoods & Economy | Business opportunities (local supply chains, services) -> ""The decision to shutter the Zambian border threatened Congo's ability to export its minerals as it is a key export route for copper from mines in the south of the DRC."" || Environmental | Land, Soil & Geology | Transport corridors and access road impacts -> ""The decision to shutter the Zambian border threatened Congo's ability to export its minerals as it is a key export route for copper from mines in the south of the DRC."" | ""Congolese truckers protested near the border town of Kasumbalesa in response, while Zambian business groups also criticized the decision.""",,Kasumbalesa,copper,,Social || Environmental,"Livelihoods & Economy || Land, Soil & Geology","Business opportunities (local supply chains, services) || Transport corridors and access road impacts"
https://www.euronews.com/green/2024/08/09/to-tackle-the-climate-crisis-europe-must-lead-by-forging-meaningful-partnerships-everywher,20240809,"To tackle the climate crisis, Europe must lead by forging meaningful partnerships everywhere | Euronews",live_ok_trafilatura,0.98,0.98,0.8,"Governance | Regulation, Compliance & Institutions | Compliance with national and international standards -> ""The challenge with many African partners, however, is balancing their role in providing for much-needed European critical minerals while ensuring mining practices meeting international standards are in place, especially in terms of human rights, labour protections, and respect for environmental standards."" || Governance | Regulation, Compliance & Institutions | Enforcement of environmental and social regulations -> ""The challenge with many African partners, however, is balancing their role in providing for much-needed European critical minerals while ensuring mining practices meeting international standards are in place, especially in terms of human rights, labour protections, and respect for environmental standards."" || Governance | Transparency & Accountability | Anti-corruption and bribery risks -> ""The conference served as a platform for the UN Global Compact to highlight its vision for sustainable practices that protect human rights and gender equality, root out corruption and consider environmental needs.""",,,copper,,Governance || Governance || Governance,"Regulation, Compliance & Institutions || Regulation, Compliance & Institutions || Transparency & Accountability",Compliance with national and international standards || Enforcement of environmental and social regulations || Anti-corruption and bribery risks
https://www.faceofmalawi.com/2024/08/13/zambia-chief-nkana-drags-to-court-ant-corruption-commission-for-freezing-his-account/,20240813,Zambia Chief Nkana Drags To Court Ant-Corruption Commission For Freezing His Account – Face of Malawi,live_ok_trafilatura,1.0,0.9,0.8,"Social | Livelihoods & Economy | Income generation and poverty reduction or exacerbation -> ""seeking damages for loss of over US$200,000 which the commission froze in his account."" | ""is also seeking damages for loss of business and profits"" | ""director and shareholder of Bisma Investment Limited, a company that owned mining licence 13811-HQ-GML."" || Social | Health, Safety & Well-being | Mental and physical health impacts on communities -> ""compensations for loss of amenities as well as reimbursements for emotional distress and anguish."" || Social | Living Conditions & Social Fabric | Social infrastructure and amenities (education, healthcare, public services, leisure) -> ""compensations for loss of amenities"" || Governance | Transparency & Accountability | Anti-corruption and bribery risks -> ""sued Anti-Corruption Commission (ACC) seeking damages for loss of over US$200,000 which the commission froze in his account."" | ""compensations for abuse of statutory powers and authority.""",mining licence 13811-HQ-GML,"Lufwanyama, Copperbelt",,Bisma Investment Limited,Social || Social || Social || Governance,"Livelihoods & Economy || Health, Safety & Well-being || Living Conditions & Social Fabric || Transparency & Accountability","Income generation and poverty reduction or exacerbation || Mental and physical health impacts on communities || Social infrastructure and amenities (education, healthcare, public services, leisure) || Anti-corruption and bribery risks"
https://www.investegate.co.uk:443/announcement/rns/firering-strategic-minerals-di---frg/result-of-agm/8361927,20240812,Result of AGM | Company Announcement | Investegate,live_ok_trafilatura,0.95,0.95,0.8,"Social | Livelihoods & Economy | Business opportunities (local supply chains, services) -> ""is an AIM listed resource company set to commence commissioning its significant quicklime project in Zambia in Q4 2024 to produce 600-800 tonnes of quicklime per day along with ancillary products."" | ""the project is strategically positioned to support the expanding copper producers in the Zambian Copper Belt, which are currently reliant on imported quicklime from South Africa.""",,Zambian Copper Belt,quicklime,Firering Strategic Minerals plc,Social,Livelihoods & Economy,"Business opportunities (local supply chains, services)"
https://www.lusakatimes.com/2024/08/14/president-hichilema-officially-launches-construction-of-300mw-maamba-power-project/,20240814,Zambia : President Hichilema officially launches Construction of 300mw Maamba power project,live_ok_trafilatura,1.0,0.7,0.8,"Social | Livelihoods & Economy | Business opportunities (local supply chains, services) -> """"You will start doing business through contracts with the mines, ensure you support the project, it will also support you,"""" || Social | Livelihoods & Economy | Employment creation and job security -> ""The President also emphasized the importance of environmental responsibility in the implementation of the project and called on the power plant management to prioritize the employment of locals.""",,"Sinazongwe, Southern Province",,ZCCM-IH,Social || Social,Livelihoods & Economy || Livelihoods & Economy,"Business opportunities (local supply chains, services) || Employment creation and job security"
https://www.lusakatimes.com/2024/08/15/government-launches-high-resolution-areial-geophysical-survey/,20240815,Zambia : Government Launches High Resolution Areial Geophysical Survey,live_ok_trafilatura,0.99,0.99,0.9,"Governance | Regulation, Compliance & Institutions | Enforcement of environmental and social regulations -> ""the mapping exercise will be used to bring order in the mining sector as opposed to people mining illegally."" | ""the mineral mapping exercise is meant also to bring order and sanity in the mining sector."" || Social | Equity, Rights & Vulnerable Groups | Crime and social disorder (corruption, violence, substance abuse) -> ""some scrupulous people took advantage of the absence of a mineral map to engage in illegal mining activities."" || Environmental | Water Resources | Water management challenges -> ""The Head of State stated that the mineral exploration will also be used to determine how much underground water is in the county."" | ""President Hichilema said from the findings, the government will be able to invest in irrigation so as to avert hunger in the wake of the drought."" || Social | Livelihoods & Economy | Human capital development (skills, training, workforce development) -> ""Mr Grasa assured the government that his company will train some Zambians as part of skills transfer in the interpretation of mineral data."" || Social | Equity, Rights & Vulnerable Groups | Wealth distribution and inequality -> ""the country's rich resource endowment should benefit everyone and not a few selected individuals.""",,all the ten provinces,,,Governance || Social || Environmental || Social || Social,"Regulation, Compliance & Institutions || Equity, Rights & Vulnerable Groups || Water Resources || Livelihoods & Economy || Equity, Rights & Vulnerable Groups","Enforcement of environmental and social regulations || Crime and social disorder (corruption, violence, substance abuse) || Water management challenges || Human capital development (skills, training, workforce development) || Wealth distribution and inequality"
https://www.lusakatimes.com/2024/08/21/zambians-should-brace-for-tough-times-as-energy-crisis-deepens-socialist-party/,20240821,Zambia : Zambians Should Brace For Tough Times As Energy Crisis Deepens - Socialist Party,live_ok_trafilatura,0.95,0.95,0.8,"Social | Livelihoods & Economy | Employment creation and job security -> ""people operating butcheries, barbershops, welding shops, saloons, computer cafe and grocery dealers are all out of business"" | ""the Government's target to produce 3 million metric tons of copper in ten years is becoming impossible due to power challenges."" || Social | Livelihoods & Economy | Income generation and poverty reduction or exacerbation -> ""prolonging hours of load shedding will continue to weaken the local economy and sending more people into misery."" | ""energy crisis has killed SMEs who are major players in the local economy.""",,Copperbelt Province,copper,,Social || Social,Livelihoods & Economy || Livelihoods & Economy,Employment creation and job security || Income generation and poverty reduction or exacerbation
