sourceurl,sqldate,title,scrape_status,in_zambia_confidence,mining_related_confidence,impact_confidence,impact_evidence,mine_name,region,mineral_type,mining_company,impact_level1,impact_level2,impact_level3
http://en.people.cn/n3/2026/0225/c90000-20428066.html,20260225,Zambian expert urges Africa to boost output under China's zero-tariff policy - People's Daily Online,live_ok_trafilatura,0.95,0.9,0.9,"Social | Livelihoods & Economy | Business opportunities (local supply chains, services) -> ""Sectors such as agriculture, mining and manufacturing could see increased exports if African countries strengthen supply capacity and improve value addition, Chisanga said, adding that China's large industrial base has strong demand for raw materials, which Africa can supply."" || Social | Livelihoods & Economy | Human capital development (skills, training, workforce development) -> ""African countries will need support to build production capacity, develop skills, facilitate technology transfer, and improve product standards to meet Chinese market requirements, he said.""",,Lusaka,,,Social || Social,Livelihoods & Economy || Livelihoods & Economy,"Business opportunities (local supply chains, services) || Human capital development (skills, training, workforce development)"
http://www.bignewsnetwork.com/news/278886288/zambian-expert-urges-africa-to-boost-output-under-china-zero-tariff-policy,20260224,Zambian expert urges Africa to boost output under China's zero-tariff policy,live_ok_newspaper,0.9,0.9,0.8,"Social | Livelihoods & Economy | Business opportunities (local supply chains, services) -> ""Sectors such as agriculture, mining and manufacturing could see increased exports if African countries strengthen supply capacity and improve value addition, Chisanga said, adding that China's large industrial base has strong demand for raw materials, which Africa can supply."" || Social | Livelihoods & Economy | Human capital development (skills, training, workforce development) -> ""African countries will need support to build production capacity, develop skills, facilitate technology transfer, and improve product standards to meet Chinese market requirements, he said.""",,,,,Social || Social,Livelihoods & Economy || Livelihoods & Economy,"Business opportunities (local supply chains, services) || Human capital development (skills, training, workforce development)"
https://africa.com/a-new-approach-to-resource-management-maximizes-profits-for-african-countries/,20260220,A New Approach To Resource Management Maximizes Profits For African Countries | Africa News | Africa.com,live_ok_trafilatura,0.95,0.98,0.9,"Governance | Regulation, Compliance & Institutions | Legislative and regulatory framework effectiveness -> ""More broadly, Zambia has reformed its mining legal framework to maximise the value of its minerals with the Minerals Regulations Commission Act of 2024."" | ""This centralised commission exists to improve efficiency in regulating large-scale mining and gemstone extraction."" || Governance | Regulation, Compliance & Institutions | Mining permitting and licensing practices -> ""The Local Content Regulations of 2025 mandates that companies with at least 25% Zambian shareholding qualify for preference in the government supply chain, which is also an attempt to expand the local share of mineral wealth."" | ""The local shareholding requirement rises to 40% by the firm's fifth year of extraction operations."" | ""Industry stability was the purpose of new higher taxes on the transfer of mining rights."" || Social | Livelihoods & Economy | Employment creation and job security -> ""Several Zambian 'mine-to-market' companies now mine, cut, polish and produce amethyst jewellery, including Jagoda Gems, Jewel of Africa, Mutinta Jewellery, Mwezi Blu and Virtu Gem."" | ""These firms are aided by the 2025 law the Local Content Statutory Instrument, which mandates domestic processing of raw material before they are exported."" || Social | Livelihoods & Economy | Business opportunities (local supply chains, services) -> ""Several Zambian 'mine-to-market' companies now mine, cut, polish and produce amethyst jewellery, including Jagoda Gems, Jewel of Africa, Mutinta Jewellery, Mwezi Blu and Virtu Gem."" | ""These firms are aided by the 2025 law the Local Content Statutory Instrument, which mandates domestic processing of raw material before they are exported."" || Social | Equity, Rights & Vulnerable Groups | Wealth distribution and inequality -> ""The Local Content Regulations of 2025 mandates that companies with at least 25% Zambian shareholding qualify for preference in the government supply chain, which is also an attempt to expand the local share of mineral wealth.""",,,amethyst,Jagoda Gems; Jewel of Africa; Mutinta Jewellery; Mwezi Blu; Virtu Gem,Governance || Governance || Social || Social || Social,"Regulation, Compliance & Institutions || Regulation, Compliance & Institutions || Livelihoods & Economy || Livelihoods & Economy || Equity, Rights & Vulnerable Groups","Legislative and regulatory framework effectiveness || Mining permitting and licensing practices || Employment creation and job security || Business opportunities (local supply chains, services) || Wealth distribution and inequality"
https://allafrica.com/stories/202602240126.html,20260224,,wayback_ok,0.99,0.98,0.88,"Environmental | Water Resources | Surface water pollution and quality degradation -> ""Concerns over pollution and environmental oversight intensified after an acid spill in February 2025 at the Chinese-owned Sino-Metals Leach Zambia operation contaminated a nearby river which forms part of the Kafue River watershed."" | """"After that major acid spill, toxins went into the river,"" local resident Lloyd Mwakwa tells DW."" || Environmental | Water Resources | Freshwater ecotoxicity (heavy metals, pH changes, sensitive species) -> ""Environmental activists say pollution, heavy metal exposure and land displacement continue to affect mining areas, which neighbor farmland or villages."" | ""Aside from destroying crops and killing fish, the incident renewed fears about water safety, health risks and long-term ecological damage that the mining industry brings."" || Environmental | Biodiversity & Ecosystems | Impacts on aquatic ecosystems and life below water -> ""Aside from destroying crops and killing fish, the incident renewed fears about water safety, health risks and long-term ecological damage that the mining industry brings."" || Environmental | Land, Soil & Geology | Land disturbance and land-use change -> """"As mining expands, communities lose land and social cohesion weakens, while inequality deepens when local people do not benefit,"" Chimfwembe told DW."" | """"When land is taken for mining, their livelihood options shrink."""" || Social | Health, Safety & Well-being | Community exposure to dust, noise, pollution -> """"Rising health issues linked to pollution threaten public health,"" says community project officer Andrew Chanda Chimfwembe at the Catholic Archdiocese in Ndola, working with local communities."" || Social | Health, Safety & Well-being | Mental and physical health impacts on communities -> """"Those are serious toxins, and they will affect us in the long run,"" he adds."" | """"Rising health issues linked to pollution threaten public health,"" says community project officer Andrew Chanda Chimfwembe..."" || Social | Livelihoods & Economy | Employment creation and job security -> """"Mining investment is important because it creates jobs and business opportunities,"" Copperbelt resident Landa Mulima told DW."" | """"Workers are employed on short-term contracts, sometimes as short as six months,"" says Joseph Chewe, president of the Mine Workers Union, which is based in Kitwe. ""The conditions are not the same as those of permanent employees."""" || Social | Livelihoods & Economy | Income generation and poverty reduction or exacerbation -> """"Mining investment is important because it creates jobs and business opportunities,"" Copperbelt resident Landa Mulima told DW."" | ""Apart from exceptional cases, Zambian mineworkers are not paid high wages, leaving Zambian policymakers increasingly having to weigh the relatively short term economic benefits against the increasingly significant, long-term environmental impacts of the copper industry."" || Social | Living Conditions & Social Fabric | Social relationships and family/community cohesion -> """"As mining expands, communities lose land and social cohesion weakens, while inequality deepens when local people do not benefit,"" Chimfwembe told DW."" || Social | Equity, Rights & Vulnerable Groups | Land ownership impacts and regional value changes -> ""Environmental activists say pollution, heavy metal exposure and land displacement continue to affect mining areas, which neighbor farmland or villages."" | """"When land is taken for mining, their livelihood options shrink."""" || Governance | Regulation, Compliance & Institutions | Enforcement of environmental and social regulations -> ""Officials say policies are in place to protect mining communities, including stricter environmental impact assessments, increased monitoring by the Zambia Environmental Management Agency, requirements for land rehabilitation, and measures to safeguard water sources."" || Governance | Regulation, Compliance & Institutions | Legislative and regulatory framework effectiveness -> ""Officials say policies are in place to protect mining communities, including stricter environmental impact assessments, increased monitoring by the Zambia Environmental Management Agency, requirements for land rehabilitation, and measures to safeguard water sources."" || Governance | Transparency & Accountability | Monitoring and disclosure of environmental and social performance -> ""Officials say policies are in place to protect mining communities, including ... increased monitoring by the Zambia Environmental Management Agency ..."" || Governance | Risk Management & Long-Term Stewardship | Tailings and waste governance -> ""A mine dump site at Luanshya Mine borders farmlands, with leaks and spills causing hazards for neighboring communities near farm lands"" || Governance | Reputation & Social License | Social license to operate -> ""For many residents, the incident reinforced long-standing anxieties about whether mining expansion can coexist with community well-being.""",Luanshya Mine,Copperbelt Province,copper,Sino-Metals Leach Zambia,Environmental || Environmental || Environmental || Environmental || Social || Social || Social || Social || Social || Social || Governance || Governance || Governance || Governance || Governance,"Water Resources || Water Resources || Biodiversity & Ecosystems || Land, Soil & Geology || Health, Safety & Well-being || Health, Safety & Well-being || Livelihoods & Economy || Livelihoods & Economy || Living Conditions & Social Fabric || Equity, Rights & Vulnerable Groups || Regulation, Compliance & Institutions || Regulation, Compliance & Institutions || Transparency & Accountability || Risk Management & Long-Term Stewardship || Reputation & Social License","Surface water pollution and quality degradation || Freshwater ecotoxicity (heavy metals, pH changes, sensitive species) || Impacts on aquatic ecosystems and life below water || Land disturbance and land-use change || Community exposure to dust, noise, pollution || Mental and physical health impacts on communities || Employment creation and job security || Income generation and poverty reduction or exacerbation || Social relationships and family/community cohesion || Land ownership impacts and regional value changes || Enforcement of environmental and social regulations || Legislative and regulatory framework effectiveness || Monitoring and disclosure of environmental and social performance || Tailings and waste governance || Social license to operate"
https://finance.yahoo.com/news/eu-backed-minerals-projects-africa-152126283.html,20260219,EU-backed minerals projects in Africa move from policy to proof,live_ok_trafilatura,0.99,0.99,0.9,"Social | Livelihoods & Economy | Employment creation and job security -> ""If financing is secured on schedule, production could begin in the second half of 2027, with the project expected to create 165 direct jobs at full capacity."" | """"What these projects do for us, particularly that one, is benefit us in so many ways through job creation, first of all,"" Chipokota Mwanawasa, policy advisor to Zambian President Hakainde Hichilema and deputy head of the Presidential Delivery Unit, tells Mining Technology."" || Social | Livelihoods & Economy | Business opportunities (local supply chains, services) -> ""The planned facility would be the first stand-alone cobalt refinery in Africa, according to Kobaloni Energy, shifting part of the value chain away from exporting raw concentrate."" | ""In a region with more than a century of mining history, it points to the potential for the Copperbelt to support longer-term industrial activity through processing infrastructure and related supply chains, rather than extraction alone."" || Environmental | Water Resources | Water management challenges -> ""Yet the continent's push to move downstream has long been constrained by weak infrastructure, energy shortages, water scarcity and political risk."" || Environmental | Air & Climate | Energy demand and consumption -> ""Yet the continent's push to move downstream has long been constrained by weak infrastructure, energy shortages, water scarcity and political risk.""",,Copperbelt,cobalt,Kobaloni Energy,Social || Social || Environmental || Environmental,Livelihoods & Economy || Livelihoods & Economy || Water Resources || Air & Climate,"Employment creation and job security || Business opportunities (local supply chains, services) || Water management challenges || Energy demand and consumption"
https://miningdigital.com/news/zambia-mining-wealth-shaping-foreign-diplomacy,20260227,How Zambia's Mining Wealth is Shaping Foreign Diplomacy | Mining Digital,live_ok_trafilatura,0.95,0.95,0.85,"Governance | Regulation, Compliance & Institutions | Mining permitting and licensing practices -> ""the US embassy in Zambia confirmed the health financing was contingent on ""collaboration in the mining sector and clear business-sector reforms"" improving US economic access."" | ""links the entire health financing package to a separate arrangement that could grant US interests access to Zambia's lucrative mining sector."" | ""critics argue the country's fiscal vulnerability could provide leverage for the US to extract mining concessions in exchange for desperately needed health funding.""",,Lusaka,copper,,Governance,"Regulation, Compliance & Institutions",Mining permitting and licensing practices
https://www.africanews.com/2026/02/26/zambia-rejects-us-health-aid-over-mining-partnership-ties/,20260226,Zambia rejects U.S. health aid over mining partnership ties | Africanews,live_ok_trafilatura,0.95,0.95,0.8,"Social | Health, Safety & Well-being | Mental and physical health impacts on communities -> """"This deal would slash US funding to life-saving programs while prioritizing mining corporations over Zambians with HIV,"" said Health GAP's Asia Russell."" | ""The five-year deal with Zambia, intended to combat HIV/AIDS and malaria, stalled after the US linked funding to a ""bilateral compact"" involving copper and cobalt access."" || Governance | Regulation, Compliance & Institutions | Mining permitting and licensing practices -> ""Zambia has halted a proposed $1 billion US health funding agreement over clauses tying aid to mining partnerships, joining Zimbabwe and Kenya in pushing back against what African nations view as sovereignty-compromising conditions."" | ""The five-year deal with Zambia, intended to combat HIV/AIDS and malaria, stalled after the US linked funding to a ""bilateral compact"" involving copper and cobalt access."" || Governance | Transparency & Accountability | Monitoring and disclosure of environmental and social performance -> ""Harare rejected a $367 million agreement over clauses requiring instant pathogen data access without benefit-sharing guarantees."" | ""Dr Jean Kaseya, Africa CDC Director-General, expressed support for countries renegotiating: ""We want to own our data in Africa. We want to own our future. We cannot accept not owning our data.""""",,,copper and cobalt,,Social || Governance || Governance,"Health, Safety & Well-being || Regulation, Compliance & Institutions || Transparency & Accountability",Mental and physical health impacts on communities || Mining permitting and licensing practices || Monitoring and disclosure of environmental and social performance
https://www.africaoutlookmag.com/mining/konkola-copper-mines-the-pride-of-zambia,20260224,Konkola Copper Mines : The Pride of Zambia - Africa Outlook Magazine,live_ok_trafilatura,0.99,0.99,0.9,"Environmental | Land, Soil & Geology | Tailings generation and management -> ""Its renowned Nchanga Mine comprises numerous open pits and processing plants, as well as two concentrators, a tailings leach plant (TLP), and the Nchanga smelter."" | ""Other future targets for KCM involve the expansion of the Nchanga smelter's capacity from 311,000 tpa to 500,000 tpa, as well as developing two additional TLPs."" || Environmental | Air & Climate | Energy demand and consumption -> ""The Nchanga smelter meets benchmark environmental performance, as it captures approximately 99.6 percent of SO2 emissions, and uses 70 percent less fuel than the old smelter."" || Environmental | Air & Climate | Air quality degradation (dust, diesel exhaust, blasting emissions) -> ""One particularly noteworthy example is the commissioning of the Nchanga smelter, which has increased sulphur dioxide (SO2) capture and improved energy efficiency at the Nchanga Mine."" | ""The Nchanga smelter meets benchmark environmental performance, as it captures approximately 99.6 percent of SO2 emissions..."" || Environmental | Water Resources | Water table alteration and drainage issues -> ""The most recent developments at KCM's KDMP include improvements to the company's deepest pump station – located 985 metres (m) underground – which currently cannot mine ore safely below a level of 1,040 m due to mine dewatering constraints."" | ""Therefore, the business requires a new pump station to be constructed at 1,390 m to allow for the dewatering of 283 million metric tonnes (Mt) of ore resource between levels of 1,040 m and 1,350 m."" || Environmental | Water Resources | Surface water pollution and quality degradation -> ""KCM's recent environmental programme has also led to the commissioning of new concentrators at both the Nchanga and Konkola Mines, with updated machinery implemented to achieve zero discharge on operations that could harm the planet."" | ""Other environmental management projects include the revamping of the piping and dam catchment for hydrometallurgical processing, which reduces run-off in areas most responsible for discharges."" || Governance | Risk Management & Long-Term Stewardship | Long-term liability management (pollution, water treatment, land stability) -> ""The pump station infrastructure will have a nominal capacity of 290,000 cubic metres (cbm), utilising 22 multi-stage clear water pumps, eight settlers to remove suspended solids and ensure compliance with environmental limits, and an equal number of sumps to allow for a greater surge capacity in case of the pump station's emergency stoppage."" | ""Watertight doors and penstocks required to contain water in the workings in case of an emergency will also be installed."" || Social | Health, Safety & Well-being | Worker health and safety risks -> ""These drain holes are critical to dewatering previously inaccessible areas, improving underground safety and unlocking additional mining potential – both key enablers in stabilising mine conditions and increasing productive capacity."" || Social | Livelihoods & Economy | Employment creation and job security -> ""Excavation works for this are to be commenced by the Australia-based Mancala Group at a total cost of USD$63 million, which will create approximately 200 local job opportunities with a projected duration of 26 months."" | ""Equipped with over 13,800 employees and contractors, the company is headquartered in Chingola and spans four world-class mining operations."" || Social | Living Conditions & Social Fabric | Education and training opportunities -> ""Since 2004, the company has run scholarships at primary, secondary, and tertiary levels for high achievers in Grades 7 to 9 at government schools."" | ""The company has also sponsored students' college and university education both domestically and abroad, directly benefitting over 500 young people."" | ""The company announced the launch of the KCM-HELSB Scholastic Excellence Programme in collaboration with the Higher Education Loans and Scholarship Board (HELSB). The company has committed USD$100,000 per year to support meritorious but underprivileged students..."" || Social | Living Conditions & Social Fabric | Social infrastructure and amenities (education, healthcare, public services, leisure) -> ""This initiative is one of many community development projects, which have also seen KCM support water sanitation projects, aid local clinics, and fund infrastructure, further emphasising the company's socioeconomic significance in the region."" || Governance | Transparency & Accountability | Corporate transparency and reporting -> ""The programme aims to provide student loans for those pursuing tertiary education, with a focus on individuals from KCM's operational areas, namely Chingola, Chililabombwe, Kitwe, and Nampundwe."" | ""The company has committed USD$100,000 per year to support meritorious but underprivileged students, with funds managed transparently by HELSB."" | ""Significantly, the scholarship utilises merit-based selection, with HELSB overseeing a transparent selection and administration process to ensure the most deserving students benefit.""",Nchanga Mine,Copperbelt Province,copper,Konkola Copper Mines,Environmental || Environmental || Environmental || Environmental || Environmental || Governance || Social || Social || Social || Social || Governance,"Land, Soil & Geology || Air & Climate || Air & Climate || Water Resources || Water Resources || Risk Management & Long-Term Stewardship || Health, Safety & Well-being || Livelihoods & Economy || Living Conditions & Social Fabric || Living Conditions & Social Fabric || Transparency & Accountability","Tailings generation and management || Energy demand and consumption || Air quality degradation (dust, diesel exhaust, blasting emissions) || Water table alteration and drainage issues || Surface water pollution and quality degradation || Long-term liability management (pollution, water treatment, land stability) || Worker health and safety risks || Employment creation and job security || Education and training opportunities || Social infrastructure and amenities (education, healthcare, public services, leisure) || Corporate transparency and reporting"
https://www.africaoutlookmag.com/mining/mopani-copper-mines-unearthing-zambian-prosperity,20260224,Mopani Copper Mines : Unearthing Zambian Prosperity - Africa Outlook Magazine,live_ok_trafilatura,0.99,0.99,0.85,"Social | Livelihoods & Economy | Employment creation and job security -> ""the newest infrastructure includes three deep shafts – Synclinorium, Mindola, and Henderson – which were sunk and equipped between 2014 and 2021 to extend the life of the mine by over 25 years, safeguard existing jobs at both mine sites, and ensure Mopani's continuous contribution to Zambia's burgeoning economic development."" | ""As one of the nation's largest mining employers, Mopani has become beyond integral to the local economy, providing significant job opportunities and contributing to the region's prosperity and evolution"" || Social | Livelihoods & Economy | Income generation and poverty reduction or exacerbation -> ""As one of the nation's largest mining employers, Mopani has become beyond integral to the local economy, providing significant job opportunities and contributing to the region's prosperity and evolution"" || Social | Livelihoods & Economy | Human capital development (skills, training, workforce development) -> ""offering world-class community outreach and support in the form of education, job prospects, and other transformational opportunities."" || Social | Living Conditions & Social Fabric | Education and training opportunities -> ""offering world-class community outreach and support in the form of education, job prospects, and other transformational opportunities."" || Environmental | Biodiversity & Ecosystems | Ecosystem degradation and habitat loss/fragmentation -> ""Today, population density in this region is extremely high, and the environmental impact of so many people is clear to see – as is the intricate relationship between mining, cultural identity, and the local people's hope for a better future.""",Mopani Copper Mines,"Kitwe and Mufulira, Copperbelt Province",copper,Mopani Copper Mines,Social || Social || Social || Social || Environmental,Livelihoods & Economy || Livelihoods & Economy || Livelihoods & Economy || Living Conditions & Social Fabric || Biodiversity & Ecosystems,"Employment creation and job security || Income generation and poverty reduction or exacerbation || Human capital development (skills, training, workforce development) || Education and training opportunities || Ecosystem degradation and habitat loss/fragmentation"
