sourceurl,sqldate,title,scrape_status,in_zambia_confidence,mining_related_confidence,impact_confidence,impact_evidence,mine_name,region,mineral_type,mining_company,impact_level1,impact_level2,impact_level3
http://www.businessghana.com/site/news/politics/332575/Zambia-dismisses-US-health-warning-after-toxic-spill-in-copper-mining-area,20250809,Zambia dismisses US health warning after toxic spill in copper mining area - BusinessGhana,live_ok_trafilatura,1.0,1.0,0.9,"Environmental | Land, Soil & Geology | Tailings generation and management -> ""The spill happened when a tailings dam, used to store toxic waste and heavy metals, collapsed into the Kafue River, a key drinking water source"" | ""contaminants from the spilled mine tailings may also become airborne, posing a health threat if inhaled"" || Environmental | Water Resources | Surface water pollution and quality degradation -> ""widespread contamination of water and soil"" | ""collapsed into the Kafue River, a key drinking water source"" | ""The spill affected aquatic life as well as farmers who use the water to irrigate their crops."" || Environmental | Water Resources | Freshwater ecotoxicity (heavy metals, pH changes, sensitive species) -> ""tailings dam, used to store toxic waste and heavy metals, collapsed into the Kafue River"" | ""The spill affected aquatic life as well as farmers who use the water to irrigate their crops."" | ""laboratory results show that PH levels have returned to normal"" || Environmental | Air & Climate | Air quality degradation (dust, diesel exhaust, blasting emissions) -> ""contaminants from the spilled mine tailings may also become airborne, posing a health threat if inhaled"" || Environmental | Biodiversity & Ecosystems | Impacts on aquatic ecosystems and life below water -> ""The spill affected aquatic life as well as farmers who use the water to irrigate their crops."" | ""The spill affected aquatic life"" || Social | Health, Safety & Well-being | Community exposure to dust, noise, pollution -> ""contaminants from the spilled mine tailings may also become airborne, posing a health threat if inhaled"" | ""widespread contamination of water and soil"" || Social | Health, Safety & Well-being | Worker health and safety risks -> ""the US embassy issued a health alert, ordering the immediate withdrawal of its personnel in Kitwe town and nearby areas due to concerns of ""widespread contamination of water and soil"" linked to a February spill at the Sino-Metals mine."" || Social | Health, Safety & Well-being | Accidents and fatalities (including structural failures such as tailings dams) -> ""The spill happened when a tailings dam, used to store toxic waste and heavy metals, collapsed into the Kafue River"" || Social | Livelihoods & Economy | Income generation and poverty reduction or exacerbation -> ""The spill affected aquatic life as well as farmers who use the water to irrigate their crops."" | ""At the time of the spill, Sino-Metals pledged to compensate the affected communities and restore the environment."" || Governance | Risk Management & Long-Term Stewardship | Tailings and waste governance -> ""The spill happened when a tailings dam, used to store toxic waste and heavy metals, collapsed into the Kafue River"" | ""At the time of the spill, Sino-Metals pledged to compensate the affected communities and restore the environment.""",Sino-Metals Leach Zambia mine,Copperbelt,copper,China Nonferrous Metal Mining Group,Environmental || Environmental || Environmental || Environmental || Environmental || Social || Social || Social || Social || Governance,"Land, Soil & Geology || Water Resources || Water Resources || Air & Climate || Biodiversity & Ecosystems || Health, Safety & Well-being || Health, Safety & Well-being || Health, Safety & Well-being || Livelihoods & Economy || Risk Management & Long-Term Stewardship","Tailings generation and management || Surface water pollution and quality degradation || Freshwater ecotoxicity (heavy metals, pH changes, sensitive species) || Air quality degradation (dust, diesel exhaust, blasting emissions) || Impacts on aquatic ecosystems and life below water || Community exposure to dust, noise, pollution || Worker health and safety risks || Accidents and fatalities (including structural failures such as tailings dams) || Income generation and poverty reduction or exacerbation || Tailings and waste governance"
https://afdb.africa-newsroom.com/press/briefing-highlights-how-the-african-development-fund-is-financing-africas-future-in-a-shifting-global-landscape,20250811,African Development Bank Group (AfDB) / Press release | Briefing Highlights: How the African Development Fund is Financing Africa's Future in a Shifting Global Landscape,live_ok_trafilatura,0.95,0.85,0.6,"Social | Livelihoods & Economy | Business opportunities (local supply chains, services) -> ""With a $500 million commitment, the Fund is helping to finance and de-risk the project, which is expected to catalyze investment in logistics, agriculture, and mining, particularly in critical minerals vital to the global energy transition.""",,Lusaka,,,Social,Livelihoods & Economy,"Business opportunities (local supply chains, services)"
https://african.business/2025/08/resources/regional-cooperation-is-best-bet-in-africa-critical-minerals-scramble,20250813,Regional cooperation is best bet in Africa critical minerals scramble - African Business,live_ok_newspaper,0.95,0.95,0.85,"Environmental | Water Resources | Surface water pollution and quality degradation -> ""Earlier this year in Zambia, a toxic spill from a copper mine poisoned the Kafue River, cutting off water supplies and devastating local communities."" || Environmental | Water Resources | Water management challenges -> ""cutting off water supplies"" || Social | Health, Safety & Well-being | Community exposure to dust, noise, pollution -> ""a toxic spill from a copper mine poisoned the Kafue River"" | ""devastating local communities"" || Social | Livelihoods & Economy | Income generation and poverty reduction or exacerbation -> ""leaving nations trapped in cycles of poverty and environmental degradation."" || Social | Livelihoods & Economy | Employment creation and job security -> ""communities remain without reliable electricity and decent work."" || Environmental | Biodiversity & Ecosystems | Ecosystem degradation and habitat loss/fragmentation -> ""leaving nations trapped in cycles of poverty and environmental degradation.""",,Kafue River,copper,,Environmental || Environmental || Social || Social || Social || Environmental,"Water Resources || Water Resources || Health, Safety & Well-being || Livelihoods & Economy || Livelihoods & Economy || Biodiversity & Ecosystems","Surface water pollution and quality degradation || Water management challenges || Community exposure to dust, noise, pollution || Income generation and poverty reduction or exacerbation || Employment creation and job security || Ecosystem degradation and habitat loss/fragmentation"
https://allafrica.com/stories/202508080082.html,20250808,,wayback_ok,0.98,0.95,0.9,"Environmental | Water Resources | Surface water pollution and quality degradation -> ""The U.S. embassy issued a health alert, ordering the immediate withdrawal of its personnel in Kitwe town and nearby areas due to concerns of ""widespread contamination of water and soil"" linked to a February spill at the Sino-Metals mine."" | ""Following heavy rains, a tailings dam, which stores toxic waste and heavy metals, collapsed into the Kafue River, a major drinking water source."" || Environmental | Land, Soil & Geology | Tailings generation and management -> ""Following heavy rains, a tailings dam, which stores toxic waste and heavy metals, collapsed into the Kafue River, a major drinking water source."" | ""linked to a February spill at the Sino-Metals mine"" | ""contaminants from the spilled mine tailings"" || Environmental | Air & Climate | Air quality degradation (dust, diesel exhaust, blasting emissions) -> ""the U.S. embassy said there was new information that showed ""the extent of hazardous and carcinogenic substances,"" and warned that beyond the ""contaminated water and soil, contaminants from the spilled mine tailings may also become airborne, posing a health threat if inhaled."""" || Social | Health, Safety & Well-being | Community exposure to dust, noise, pollution -> ""the U.S. embassy said there was new information that showed ""the extent of hazardous and carcinogenic substances,"" and warned that beyond the ""contaminated water and soil, contaminants from the spilled mine tailings may also become airborne, posing a health threat if inhaled."""" | ""The U.S. embassy issued a health alert, ordering the immediate withdrawal of its personnel in Kitwe town and nearby areas due to concerns of ""widespread contamination of water and soil"""" || Social | Health, Safety & Well-being | Accidents and fatalities (including structural failures such as tailings dams) -> ""Following heavy rains, a tailings dam, which stores toxic waste and heavy metals, collapsed into the Kafue River, a major drinking water source."" || Governance | Risk Management & Long-Term Stewardship | Tailings and waste governance -> ""Following heavy rains, a tailings dam, which stores toxic waste and heavy metals, collapsed into the Kafue River, a major drinking water source."" | ""The U.S. embassy issued a health alert, ordering the immediate withdrawal of its personnel in Kitwe town and nearby areas due to concerns of ""widespread contamination of water and soil"" linked to a February spill at the Sino-Metals mine.""",Sino-Metals mine,Copperbelt mining region,,Sino-Metals,Environmental || Environmental || Environmental || Social || Social || Governance,"Water Resources || Land, Soil & Geology || Air & Climate || Health, Safety & Well-being || Health, Safety & Well-being || Risk Management & Long-Term Stewardship","Surface water pollution and quality degradation || Tailings generation and management || Air quality degradation (dust, diesel exhaust, blasting emissions) || Community exposure to dust, noise, pollution || Accidents and fatalities (including structural failures such as tailings dams) || Tailings and waste governance"
https://allafrica.com/stories/202508180367.html,20250818,,wayback_ok,0.99,0.99,0.9,"Environmental | Land, Soil & Geology | Slope instability and landslides -> ""a fatal disaster in December 2023, when a mudslide caused by informal mining claimed 30 lives."" | ""three informal miners killed when a pit collapsed at Sensele Mine in early July."" || Environmental | Land, Soil & Geology | Surface ground instability and subsidence -> """"It wasn't even a deep pit ... The ground gave way and buried all three of them. I don't know exactly what happened. I was only told that Paul was trapped,"" she said."" | """"As we speak,"" said one, ""there was an accident at the mine. The earth collapsed, killing two youth and leaving two others seriously injured."""" || Social | Health, Safety & Well-being | Accidents and fatalities (including structural failures such as tailings dams) -> ""three informal miners killed when a pit collapsed at Sensele Mine in early July."" | ""a fatal disaster in December 2023, when a mudslide caused by informal mining claimed 30 lives."" | """"As we speak,"" said one, ""there was an accident at the mine. The earth collapsed, killing two youth and leaving two others seriously injured. One of the boys who died was about 16."""" || Social | Health, Safety & Well-being | Worker health and safety risks -> ""Drawn by the promise of quick money, young men, many still in their teens, risk their lives as illegal miners in Zambia's dangerous copper mines."" | ""Using only picks and shovels, they risk their lives for around K100 (about US$4 or R70) per day."" || Social | Equity, Rights & Vulnerable Groups | Child labor and forced labor risks -> ""Mining insiders say children as young as 14 are sought after because their small bodies allow them to get into narrow underground tunnels."" | ""Two local businessmen with mining experience said illegal mining encourages child labour."" | ""The report notes that Zambian children may be forced by criminal groups known as Jerabos (jail boys) to work in illegal mining, including loading stolen copper and crushing rocks."" || Social | Livelihoods & Economy | Income generation and poverty reduction or exacerbation -> ""She said the pit was the only source of income for her grandson and many other children in the nearby informal settlement."" | ""Using only picks and shovels, they risk their lives for around K100 (about US$4 or R70) per day."" || Governance | Regulation, Compliance & Institutions | Mining permitting and licensing practices -> ""Sensele [Mine] is licenced to a private individual, and according to the law, it is that individual's responsibility to secure the area,"" | ""The mine, licenced under Small-Scale Mining Licence Nos. 8723-HQ-SML and 8724-HQ-SML, remains a hotspot for illegal mining activities in Chingola."" || Governance | Transparency & Accountability | Anti-corruption and bribery risks -> ""Politically connected people profit from this, while state institutions grow weaker."" | ""A local businessman from Chingola told us that the police ""simply take instructions from politicians and their allies""."" | ""Police spokesperson Rae Hamoonga urged the public to report any officers who take bribes for allowing unauthorised access to mining areas."" || Governance | Regulation, Compliance & Institutions | Enforcement of environmental and social regulations -> ""Despite these amendments, enforcement is weak."" | ""Staff at Nchanga North General Hospital told us they have observed a steady increase in ""brought in dead"" (BID) cases. As at 22 July, the hospital's mortuary had recorded 116 BIDs for the month, of which only five were officially linked to mine accidents.""",Sensele Mine,Chingola,copper,Sensele Mine,Environmental || Environmental || Social || Social || Social || Social || Governance || Governance || Governance,"Land, Soil & Geology || Land, Soil & Geology || Health, Safety & Well-being || Health, Safety & Well-being || Equity, Rights & Vulnerable Groups || Livelihoods & Economy || Regulation, Compliance & Institutions || Transparency & Accountability || Regulation, Compliance & Institutions",Slope instability and landslides || Surface ground instability and subsidence || Accidents and fatalities (including structural failures such as tailings dams) || Worker health and safety risks || Child labor and forced labor risks || Income generation and poverty reduction or exacerbation || Mining permitting and licensing practices || Anti-corruption and bribery risks || Enforcement of environmental and social regulations
https://english.news.cn/20250808/2cd01bf5e0044d62a4425525f90dbe33/c.html,20250808,Zambia commends China's Sino Metals over river pollution response-Xinhua,live_ok_trafilatura,0.99,0.99,0.9,"Environmental | Water Resources | Surface water pollution and quality degradation -> ""a spillage of acid and heavy metals into local rivers."" || Environmental | Water Resources | Freshwater ecotoxicity (heavy metals, pH changes, sensitive species) -> ""a spillage of acid and heavy metals into local rivers."" | ""pH levels in the water have returned to normal, and concentrations of heavy metals are steadily decreasing, which means immediate threats to human, animal, and plant life have been mitigated."" || Environmental | Land, Soil & Geology | Tailings generation and management -> ""The pollution occurred after vandals damaged the tailings dam infrastructure earlier this year."" | ""spillage from dams owned by Sino-Metals Leach Zambia Limited."" || Social | Health, Safety & Well-being | Community exposure to dust, noise, pollution -> ""a spillage of acid and heavy metals into local rivers."" | ""The U.S. Embassy in Zambia issued a health alert on Wednesday, directing U.S. citizens to immediately leave Chambishi town and other areas in the Copperbelt province affected by spillage from dams owned by Sino-Metals Leach Zambia Limited."" || Social | Livelihoods & Economy | Income generation and poverty reduction or exacerbation -> ""The necessary compensations for affected individuals are on schedule, and the company is covering the costs of asset replacement and environmental cleanup,"" || Governance | Regulation, Compliance & Institutions | Compliance with national and international standards -> ""the company has been working closely with authorities since the February incident and is complying with national laws and international principles, including the ""polluter pays"" principle."" || Governance | Transparency & Accountability | Accountability for accidents and environmental damage -> ""The necessary compensations for affected individuals are on schedule, and the company is covering the costs of asset replacement and environmental cleanup,"" | ""complying with national laws and international principles, including the ""polluter pays"" principle."" || Governance | Risk Management & Long-Term Stewardship | Tailings and waste governance -> ""The pollution occurred after vandals damaged the tailings dam infrastructure earlier this year."" | ""spillage from dams owned by Sino-Metals Leach Zambia Limited.""",,"Chambishi, Copperbelt province",,Sino-Metals Leach Zambia Limited,Environmental || Environmental || Environmental || Social || Social || Governance || Governance || Governance,"Water Resources || Water Resources || Land, Soil & Geology || Health, Safety & Well-being || Livelihoods & Economy || Regulation, Compliance & Institutions || Transparency & Accountability || Risk Management & Long-Term Stewardship","Surface water pollution and quality degradation || Freshwater ecotoxicity (heavy metals, pH changes, sensitive species) || Tailings generation and management || Community exposure to dust, noise, pollution || Income generation and poverty reduction or exacerbation || Compliance with national and international standards || Accountability for accidents and environmental damage || Tailings and waste governance"
https://foreignpolicy.com/2025/08/20/congos-peace-negotiations-fall-through/,20250820,Congo's Peace Negotiations Fall Through,live_ok_trafilatura,0.95,0.98,0.9,"Environmental | Land, Soil & Geology | Tailings generation and management -> ""The spill occurred when a tailings dam partially collapsed at a mine run by Sino-Metals Leach, a subsidiary of the state-run China Nonferrous Mining Corp."" || Environmental | Water Resources | Surface water pollution and quality degradation -> ""According to Drizit Zambia, the company hired by Sino-Metals to evaluate the accident, at least 1.5 million tons of toxic material spilled, contaminating the Mwambashi River, which flows into the Kafue River."" || Environmental | Water Resources | Acid mine drainage -> ""Six months after an acid spill at a Chinese-owned copper mine in Zambia, an independent audit has found that the disaster released around 30 times more toxic sludge than the 50,000 tons reported by the company and the Zambian government."" || Environmental | Water Resources | Freshwater ecotoxicity (heavy metals, pH changes, sensitive species) -> ""an independent audit has found that the disaster released around 30 times more toxic sludge than the 50,000 tons reported by the company and the Zambian government."" | ""at least 1.5 million tons of toxic material spilled, contaminating the Mwambashi River"" || Social | Health, Safety & Well-being | Community exposure to dust, noise, pollution -> ""at least 1.5 million tons of toxic material spilled, contaminating the Mwambashi River, which flows into the Kafue River."" | ""Around 60 percent of Zambia's 20 million people live in the Kafue River basin, and the river supplies drinking water to around 5 million people, including residents of the capital, Lusaka."" || Social | Health, Safety & Well-being | Accidents and fatalities (including structural failures such as tailings dams) -> ""The spill occurred when a tailings dam partially collapsed at a mine run by Sino-Metals Leach, a subsidiary of the state-run China Nonferrous Mining Corp."" || Governance | Transparency & Accountability | Corporate transparency and reporting -> ""an independent audit has found that the disaster released around 30 times more toxic sludge than the 50,000 tons reported by the company and the Zambian government."" | ""Sino-Metals questioned Drizit's methodology and has terminated its contract with the firm."" || Governance | Risk Management & Long-Term Stewardship | Tailings and waste governance -> ""The spill occurred when a tailings dam partially collapsed at a mine run by Sino-Metals Leach, a subsidiary of the state-run China Nonferrous Mining Corp.""",,Kafue River basin,copper,Sino-Metals Leach,Environmental || Environmental || Environmental || Environmental || Social || Social || Governance || Governance,"Land, Soil & Geology || Water Resources || Water Resources || Water Resources || Health, Safety & Well-being || Health, Safety & Well-being || Transparency & Accountability || Risk Management & Long-Term Stewardship","Tailings generation and management || Surface water pollution and quality degradation || Acid mine drainage || Freshwater ecotoxicity (heavy metals, pH changes, sensitive species) || Community exposure to dust, noise, pollution || Accidents and fatalities (including structural failures such as tailings dams) || Corporate transparency and reporting || Tailings and waste governance"
https://gna.org.gh/2025/08/africas-dependence-on-imported-fuel-poses-strategic-risk-arda/,20250813,Africa's dependence on imported fuel poses strategic risk – ARDA | Ghana News Agency,wayback_ok,0.95,0.95,0.9,"Social | Livelihoods & Economy | Income generation and poverty reduction or exacerbation -> ""Mining operations in South Africa, Nigeria, Ghana, the Democratic Republic of Congo (DRC), and Zambia would halt, affecting exports of copper, cobalt, and gold and resulting in billions of dollars in lost revenue within days.""",,,"copper, cobalt, gold",,Social,Livelihoods & Economy,Income generation and poverty reduction or exacerbation
