sourceurl,sqldate,title,scrape_status,in_zambia_confidence,mining_related_confidence,impact_confidence,impact_evidence,mine_name,region,mineral_type,mining_company,impact_level1,impact_level2,impact_level3
https://www.finanznachrichten.de/nachrichten-2025-08/66114576-zccm-ih-further-cautionary-announcement-court-petition-relating-to-mopani-copper-mines-plc-transact-sens-650.htm,20250807,ZCCM-IH Further Cautionary Announcement_ Court Petition Relating to Mopani Copper Mines Plc Transact-SENS,live_ok_trafilatura,1.0,1.0,0.9,"Governance | Regulation, Compliance & Institutions | Legislative and regulatory framework effectiveness -> ""The Petition challenges the 2024 transaction involving Mopani Copper Mines Plc (""MCM"") and International Resources Holdings (""IRH"") on constitutional grounds."" | ""the Petitioner contends that the transaction, executed when MCM was wholly owned by ZCCM-IH, a state-controlled entity, amounts to a disposal of a significant state asset and, as such, should have been subjected to prior approval by Parliament in accordance with Article 210 of the Constitution of Zambia (Amendment) Act No. 2 of 2016."" | ""The Petitioner requests a declaration that the transaction is unconstitutional, null, and void, and seeks an order to nullify the transaction on the grounds of non-compliance with the Constitution."" || Governance | Transparency & Accountability | Corporate transparency and reporting -> ""The Company will provide further updates as the matter progresses, in line with its continuous disclosure obligations."" | ""Accordingly, shareholders are advised to continue exercising caution and to seek professional advice from a licensed investment advisor when dealing in the Company's securities until a further announcement is made.""",Mopani Copper Mines Plc,,copper,ZCCM Investments Holdings Plc,Governance || Governance,"Regulation, Compliance & Institutions || Transparency & Accountability",Legislative and regulatory framework effectiveness || Corporate transparency and reporting
https://www.finanznachrichten.de/nachrichten-2025-08/66205703-goviex-uranium-inc-goviex-uranium-announces-transformational-reverse-takeover-of-tombador-iron-limited-unlocking-asx-listing-and-a-dollar-10-4-million-in-296.htm,20250818,"GoviEx Uranium Inc.: GoviEx Uranium Announces Transformational Reverse Takeover of Tombador Iron Limited, Unlocking ASX Listing and A$10.4 Million in Cash Reserves",live_ok_trafilatura,0.95,0.95,0.8,"Governance | Regulation, Compliance & Institutions | Mining permitting and licensing practices -> ""GoviEx's principal objective is to become a significant uranium producer through the continued exploration and development of its mine-permitted Muntanga Project in Zambia."" || Governance | Stakeholder Engagement & Rights | Stakeholder inclusion in decision-making -> ""- Continued focus on Zambia and the Muntanga Project. The Transaction is expected to enable the Combined Company to position its development strategy towards continuing to significantly increase the size of Muntanga Project and achieving economies of scale to improve the potential project economics and benefits for all stakeholders, as well as targeting the substantial exploration potential of the Karoo sandstones in Zambia."" | ""Insiders and certain significant GoviEx shareholders, who collectively hold 27.6% of the issued and outstanding Class A common shares of GoviEx (each, a ""GoviEx Share""), have entered into voting support agreements with Tombador pursuant to which they have agreed to vote their GoviEx Shares in favour of the Transaction at the GoviEx Meeting, scheduled to be held on 24 October 2025."" || Governance | Transparency & Accountability | Corporate transparency and reporting -> ""Full details of the Transaction will be included in the GoviEx Circular which will be available, after it is filed, on SEDAR+ at www.sedarplus.ca under GoviEx's profile."" | ""Stifel Canada has provided a fairness opinion to the GoviEx Special Committee, stating that, as of the date of such opinion, and based upon and subject to the assumptions, limitations and qualifications stated in such opinion, that the consideration to be received by GoviEx shareholders pursuant to the Transaction is fair, from a financial point of view, to GoviEx shareholders.""",Muntanga Project,,uranium,GoviEx Uranium Inc.,Governance || Governance || Governance,"Regulation, Compliance & Institutions || Stakeholder Engagement & Rights || Transparency & Accountability",Mining permitting and licensing practices || Stakeholder inclusion in decision-making || Corporate transparency and reporting
https://www.finanznachrichten.de/nachrichten-2025-08/66225643-midnight-sun-mining-corp-midnight-sun-puts-second-drill-to-work-at-dumbwa-296.htm,20250820,Midnight Sun Mining Corp.: Midnight Sun Puts Second Drill To Work at Dumbwa,live_ok_trafilatura,1.0,1.0,0.9,"Governance | Regulation, Compliance & Institutions | Compliance with national and international standards -> ""Qualified Person: Darin Labrenz, P.Geo., a consulting geologist for the Company and Qualified Person under NI 43-101, has reviewed and approved the technical data and contents of this release.""",Dumbwa,Solwezi,copper,Midnight Sun Mining Corp.,Governance,"Regulation, Compliance & Institutions",Compliance with national and international standards
https://www.insurancejournal.com/news/international/2025/08/15/835763.htm,20250808,Toxic Spill at China-Owned Zambian Mine 30 Times Worse Than Estimated,live_ok_trafilatura,0.99,0.99,0.9,"Environmental | Land, Soil & Geology | Tailings generation and management -> ""The dam where the tailings escaped from is still there and the amount of tailings that escaped can be ascertained by the volume of the dam,"" || Environmental | Water Resources | Surface water pollution and quality degradation -> ""releasing a torrent of sulphuric acid-bearing material used to extract copper into the nearby Mwambashi River."" | ""Preliminary assessments showed the river measured a pH as low as 1, Collins Nzovu, Zambia's water and sanitation minister, told lawmakers Feb. 21."" || Environmental | Water Resources | Acid mine drainage -> ""The disaster unfolded when a dam wall breached after heavy rains on Feb. 18, releasing a torrent of sulphuric acid-bearing material used to extract copper into the nearby Mwambashi River."" || Environmental | Water Resources | Freshwater ecotoxicity (heavy metals, pH changes, sensitive species) -> ""The US Ambassador to Zambia Michael Gonzales said the disaster appeared to be the sixth-worst in history, and that toxic substances including arsenic, cyanide and uranium will continue to pose threats to humans and animals until removed."" | ""In the immediate aftermath of the incident, the government began dumping hundreds of tons of lime into the rivers to neutralize the acid, which had wiped out aquatic life for miles, along with crops growing alongside them."" | ""While the acidity may have returned to normal, heavy metals pose a persistent threat, especially to the 800 individuals still living near the fallout zone, Drizit's letter said."" || Environmental | Water Resources | Water management challenges -> ""In the immediate aftermath of the incident, the government began dumping hundreds of tons of lime into the rivers to neutralize the acid, which had wiped out aquatic life for miles, along with crops growing alongside them."" || Environmental | Biodiversity & Ecosystems | Ecosystem degradation and habitat loss/fragmentation -> ""Drizit described the event as a ""large-scale environmental catastrophe"" that threatened drinking water, fishing stocks and farmland in the area."" | ""the government began dumping hundreds of tons of lime into the rivers to neutralize the acid, which had wiped out aquatic life for miles, along with crops growing alongside them."" || Social | Health, Safety & Well-being | Community exposure to dust, noise, pollution -> ""toxic substances including arsenic, cyanide and uranium will continue to pose threats to humans and animals until removed."" | ""While the acidity may have returned to normal, heavy metals pose a persistent threat, especially to the 800 individuals still living near the fallout zone, Drizit's letter said."" || Social | Livelihoods & Economy | Income generation and poverty reduction or exacerbation -> ""Drizit described the event as a ""large-scale environmental catastrophe"" that threatened drinking water, fishing stocks and farmland in the area."" | ""which had wiped out aquatic life for miles, along with crops growing alongside them."" || Social | Living Conditions & Social Fabric | Livability (cost of living, food security, communication services) -> ""the government began dumping hundreds of tons of lime into the rivers to neutralize the acid, which had wiped out aquatic life for miles, along with crops growing alongside them."" | """"Without immediate intervention, the consequences for future generations of Zambians will be severe and long-lasting,"" Drizit said in the letter."" || Governance | Transparency & Accountability | Monitoring and disclosure of environmental and social performance -> """"From the outset, they have actively sought to disrupt the assessment process and have made attempts to influence the outcomes of our findings,"" it said."" | ""SML has accused us of breaching the contract and has since terminated the agreement just days before its conclusion, seemingly with the intention of preventing our report from reaching the proper authorities."" || Governance | Transparency & Accountability | Accountability for accidents and environmental damage -> ""The Zambian government is in the process of contracting a new company to conduct the environmental impact assessment, and Sino Metals will still pay for the entire process, the spokesman said."" | ""Transparency International Zambia called on the government to ""act seriously and pointedly"" in a manner that the situation's severity merits."" || Governance | Risk Management & Long-Term Stewardship | Tailings and waste governance -> ""The dam where the tailings escaped from is still there and the amount of tailings that escaped can be ascertained by the volume of the dam,"" | ""The Zambian government is in the process of contracting a new company to conduct the environmental impact assessment, and Sino Metals will still pay for the entire process, the spokesman said.""",Sino-Metals Leach Zambia Ltd.,Kitwe,copper,Sino-Metals Leach Zambia Ltd.,Environmental || Environmental || Environmental || Environmental || Environmental || Environmental || Social || Social || Social || Governance || Governance || Governance,"Land, Soil & Geology || Water Resources || Water Resources || Water Resources || Water Resources || Biodiversity & Ecosystems || Health, Safety & Well-being || Livelihoods & Economy || Living Conditions & Social Fabric || Transparency & Accountability || Transparency & Accountability || Risk Management & Long-Term Stewardship","Tailings generation and management || Surface water pollution and quality degradation || Acid mine drainage || Freshwater ecotoxicity (heavy metals, pH changes, sensitive species) || Water management challenges || Ecosystem degradation and habitat loss/fragmentation || Community exposure to dust, noise, pollution || Income generation and poverty reduction or exacerbation || Livability (cost of living, food security, communication services) || Monitoring and disclosure of environmental and social performance || Accountability for accidents and environmental damage || Tailings and waste governance"
https://www.investegate.co.uk/announcement/rns/firering-strategic-minerals-di---frg/jv-partner-withdrawal-from-lithium-projects/9063146,20250819,JV Partner withdrawal from Lithium Projects | Company Announcement | Investegate,live_ok_trafilatura,0.95,0.95,0.8,"Social | Livelihoods & Economy | Business opportunities (local supply chains, services) -> ""Targeting daily output of 600-800 tonnes, Limeco is well positioned to supply copper producers operating within the Central African Copperbelt and other regional industries that currently rely on imported quicklime from South Africa."" || Social | Livelihoods & Economy | Income generation and poverty reduction or exacerbation -> ""Limeco remains at the heart of our business, offering scalable near-term revenues and the foundation for Firering's long-term value creation alongside the additional upside that we expect to realise ultimately from the Atex and Alliance Projects.""",Limeco,,quicklime,Firering Strategic Minerals,Social || Social,Livelihoods & Economy || Livelihoods & Economy,"Business opportunities (local supply chains, services) || Income generation and poverty reduction or exacerbation"
https://www.jacarandafm.com/news/news/us-orders-evacuation-6-months-afterzambia-mine-spill/,20250807,US orders staff evacuation 6 months after Zambia mine spill,live_ok_trafilatura,1.0,1.0,0.9,"Environmental | Land, Soil & Geology | Tailings generation and management -> ""The acid spill occurred when a tailings dam, which is used to capture waste from the mining process, collapsed."" | ""The February 18 spill at a Chinese-owned mine in Zambia's northern copperbelt released 50 million litres (13 million gallons) of toxic waste into a tributary..."" || Environmental | Water Resources | Surface water pollution and quality degradation -> ""released 50 million litres (13 million gallons) of toxic waste into a tributary of one of the country's longest rivers, the Kafue, which was also polluted,"" || Environmental | Water Resources | Freshwater ecotoxicity (heavy metals, pH changes, sensitive species) -> ""Newly available information reveals the extent of hazardous and carcinogenic substances -– including arsenic, cyanide, uranium, and other heavy metals –-"" | ""Media reports from the area soon after the disaster said that the pollution had travelled more than 100 kilometres from the dam, killing fish and livestock."" || Environmental | Biodiversity & Ecosystems | Impacts on aquatic ecosystems and life below water -> ""Media reports from the area soon after the disaster said that the pollution had travelled more than 100 kilometres from the dam, killing fish and livestock."" || Environmental | Biodiversity & Ecosystems | Impacts on terrestrial ecotoxicity -> ""Media reports from the area soon after the disaster said that the pollution had travelled more than 100 kilometres from the dam, killing fish and livestock."" || Social | Health, Safety & Well-being | Accidents and fatalities (including structural failures such as tailings dams) -> ""The acid spill occurred when a tailings dam, which is used to capture waste from the mining process, collapsed."" | ""The February 18 spill ... released 50 million litres ... of toxic waste"" || Social | Health, Safety & Well-being | Mental and physical health impacts on communities -> ""Newly available information reveals the extent of hazardous and carcinogenic substances -– including arsenic, cyanide, uranium, and other heavy metals –- as well as the immediate and long-term health threats that exposure to these contaminants pose as long as they remain in the environment,"" || Social | Health, Safety & Well-being | Community exposure to dust, noise, pollution -> ""Newly available information reveals the extent of hazardous and carcinogenic substances -– including arsenic, cyanide, uranium, and other heavy metals –- as well as the immediate and long-term health threats that exposure to these contaminants pose as long as they remain in the environment,"" || Social | Health, Safety & Well-being | Worker health and safety risks -> ""The US government has ordered the immediate withdrawal of all US government personnel from Kitwe and nearby areas affected by the Sino Metals mine tailings dam spill,""",Sino Metals mine,Kitwe,copper,Sino Metals,Environmental || Environmental || Environmental || Environmental || Environmental || Social || Social || Social || Social,"Land, Soil & Geology || Water Resources || Water Resources || Biodiversity & Ecosystems || Biodiversity & Ecosystems || Health, Safety & Well-being || Health, Safety & Well-being || Health, Safety & Well-being || Health, Safety & Well-being","Tailings generation and management || Surface water pollution and quality degradation || Freshwater ecotoxicity (heavy metals, pH changes, sensitive species) || Impacts on aquatic ecosystems and life below water || Impacts on terrestrial ecotoxicity || Accidents and fatalities (including structural failures such as tailings dams) || Mental and physical health impacts on communities || Community exposure to dust, noise, pollution || Worker health and safety risks"
https://www.lusakatimes.com/2025/08/07/theres-no-cause-for-alarm-over-kitwe-water-contamination-mweetwa/,20250807,Zambia : There's no cause for alarm over Kitwe water contamination-Mweetwa,live_ok_trafilatura,0.99,0.98,0.9,"Environmental | Water Resources | Surface water pollution and quality degradation -> ""The pollution incident, which saw approximately 50,000 cubic metres of acidic slurry discharged into key water bodies, had triggered nationwide concern."" | ""acidity levels in the Chambishi, Mwambashi and Kafue rivers have returned to normal and concentrations of heavy metals are steadily decreasing."" || Environmental | Water Resources | Freshwater ecotoxicity (heavy metals, pH changes, sensitive species) -> ""acidity levels in the Chambishi, Mwambashi and Kafue rivers have returned to normal and concentrations of heavy metals are steadily decreasing."" | ""the mine tailings spill released a mix of hazardous and carcinogenic substances into the environment, including arsenic, cyanide, uranium, and other heavy metals."" || Environmental | Water Resources | Water management challenges -> ""In Kitwe, two water treatment plants were temporarily shut down after detecting pH abnormalities but resumed operations within days following successful chemical treatment and quality assurance."" | ""the Nkana Water Supply and Sanitation Company provided alternative water via bowsers during the disruption."" || Environmental | Land, Soil & Geology | Tailings generation and management -> ""The pollution occurred on 18th February 2025 when Sino Metals reported the failure of tailings dam TD15F."" | ""going forward, all mining companies have been instructed to cease disposal of acidic tailings into dams without prior neutralisation and that existing facilities must comply by December 2025."" || Environmental | Land, Soil & Geology | Topsoil degradation and loss of soil fertility -> ""the company is also compensating affected communities for crop and soil damage over two farming seasons."" | ""ZEMA also began lime dosing to neutralise acidity and launched ongoing monitoring of water, soil, and sediment."" || Environmental | Air & Climate | Air quality degradation (dust, diesel exhaust, blasting emissions) -> """"Beyond contaminated water and soil, contamination from the spilled mine tailings may also become airborne, posing a health threat if inhaled,"" the embassy stated."" || Social | Health, Safety & Well-being | Accidents and fatalities (including structural failures such as tailings dams) -> ""Government says the environmental crisis caused by the February acid tailings dam failure at Sino Metals Leach Zambia Limited in the Copperbelt Province has been contained"" | ""the pollution occurred on 18th February 2025 when Sino Metals reported the failure of tailings dam TD15F."" || Social | Health, Safety & Well-being | Community exposure to dust, noise, pollution -> ""According to a health alert issued by the U.S. Embassy in Lusaka, newly uncovered information reveals that the mine tailings spill released a mix of hazardous and carcinogenic substances into the environment, including arsenic, cyanide, uranium, and other heavy metals."" | ""Mr Mweetwa ... said when the pollution occurred, the Ministry of Health dispatched rapid response teams to Kitwe, Ngabwe, and Mumbwa districts, adding that only three cases of suspected water-related illness were recorded, all of which fully recovered."" || Social | Livelihoods & Economy | Income generation and poverty reduction or exacerbation -> ""the company is also compensating affected communities for crop and soil damage over two farming seasons."" || Social | Living Conditions & Social Fabric | Livability (cost of living, food security, communication services) -> ""In Kitwe, two water treatment plants were temporarily shut down after detecting pH abnormalities but resumed operations within days following successful chemical treatment and quality assurance."" | ""the Nkana Water Supply and Sanitation Company provided alternative water via bowsers during the disruption."" || Governance | Regulation, Compliance & Institutions | Enforcement of environmental and social regulations -> ""the government invoked Section 107 of the Environmental Management Act after Sino Metals failed to appoint a qualified consultant to conduct a full environmental impact assessment."" | ""ZEMA immediately suspended operations at the facility and issued an Environmental Restoration Order compelling the company to clean up and submit a remediation plan."" | ""the Mine Safety Department suspended Sino Metals' operations, issued a compliance order with 12 corrective actions, and fined the company over K1.5 million."" || Governance | Transparency & Accountability | Monitoring and disclosure of environmental and social performance -> ""He said the pH levels recovered by early March, and over 200 water and sediment samples have been collected for testing, 163 of which are currently undergoing analysis at an independent laboratory in Kitwe."" | ""Mr Mweetwa ... said government pledged to safeguard the environment, public health and promised transparency throughout the remaining restoration process."" || Governance | Transparency & Accountability | Accountability for accidents and environmental damage -> """"We remain fully committed to holding the polluter accountable,"" Mr Mweetwa assured, adding that Sino Metals has so far cooperated fully."" | ""The fine has since been paid while the company is also compensating affected communities for crop and soil damage over two farming seasons."" || Governance | Risk Management & Long-Term Stewardship | Tailings and waste governance -> ""ZEMA also began lime dosing to neutralise acidity and launched ongoing monitoring of water, soil, and sediment."" | ""going forward, all mining companies have been instructed to cease disposal of acidic tailings into dams without prior neutralisation and that existing facilities must comply by December 2025.""",Sino Metals Leach Mine (TD15F),"Chambishi, Kitwe (Copperbelt Province)",,Sino Metals Leach Zambia Limited,Environmental || Environmental || Environmental || Environmental || Environmental || Environmental || Social || Social || Social || Social || Governance || Governance || Governance || Governance,"Water Resources || Water Resources || Water Resources || Land, Soil & Geology || Land, Soil & Geology || Air & Climate || Health, Safety & Well-being || Health, Safety & Well-being || Livelihoods & Economy || Living Conditions & Social Fabric || Regulation, Compliance & Institutions || Transparency & Accountability || Transparency & Accountability || Risk Management & Long-Term Stewardship","Surface water pollution and quality degradation || Freshwater ecotoxicity (heavy metals, pH changes, sensitive species) || Water management challenges || Tailings generation and management || Topsoil degradation and loss of soil fertility || Air quality degradation (dust, diesel exhaust, blasting emissions) || Accidents and fatalities (including structural failures such as tailings dams) || Community exposure to dust, noise, pollution || Income generation and poverty reduction or exacerbation || Livability (cost of living, food security, communication services) || Enforcement of environmental and social regulations || Monitoring and disclosure of environmental and social performance || Accountability for accidents and environmental damage || Tailings and waste governance"
https://www.lusakatimes.com/2025/08/07/zambia-unveils-critical-mineral-prospects-and-milestones/,20250807,Zambia : Zambia Unveils Critical Mineral Prospects and Milestones,live_ok_trafilatura,1.0,1.0,0.9,"Social | Livelihoods & Economy | Business opportunities (local supply chains, services) -> ""African Mining Week will connect global investors with investment and project opportunities in Zambia – home to significant critical mineral reserves"" || Social | Livelihoods & Economy | Employment creation and job security -> ""With global lithium demand set to grow by 350% by 2040, these assets could significantly boost Zambia's export revenues and job creation."" || Social | Livelihoods & Economy | Income generation and poverty reduction or exacerbation -> ""With global lithium demand set to grow by 350% by 2040, these assets could significantly boost Zambia's export revenues and job creation."" || Governance | Regulation, Compliance & Institutions | Mining permitting and licensing practices -> ""The event will feature a dedicated panel on Zambia, titled Zambia: Accelerating Exploration and Development Through License Allocation.""",Luongo Open-Pit Mine,Luapula Province,copper,Musamu Resources,Social || Social || Social || Governance,"Livelihoods & Economy || Livelihoods & Economy || Livelihoods & Economy || Regulation, Compliance & Institutions","Business opportunities (local supply chains, services) || Employment creation and job security || Income generation and poverty reduction or exacerbation || Mining permitting and licensing practices"
