sourceurl,sqldate,title,scrape_status,in_zambia_confidence,mining_related_confidence,impact_confidence,impact_evidence,mine_name,region,mineral_type,mining_company,impact_level1,impact_level2,impact_level3
http://news.xinhuanet.com/english/2017-08/09/c_136513329.htm,20170809,Zambia arrests 30 Tanzanians over illegal work - Xinhua | English.news.cn,live_ok_trafilatura,1.0,1.0,0.9,"Governance | Regulation, Compliance & Institutions | Mining permitting and licensing practices -> ""Authorities in Zambia have arrested 30 Tanzanians for working without permits, the immigration department said on Wednesday."" || Governance | Regulation, Compliance & Institutions | Enforcement of environmental and social regulations -> ""Authorities in Zambia have arrested 30 Tanzanians for working without permits, the immigration department said on Wednesday."" | ""The Tanzanians, who are currently in police custody, will appear in court soon, he added."" || Social | Living Conditions & Social Fabric | Demographic changes (migration, influx of workers, displacement) -> ""The eastern part of Zambia has recorded an increase in foreigners, especially Tanzanians, conducting illegal mining activities."" || Social | Equity, Rights & Vulnerable Groups | Crime and social disorder (corruption, violence, substance abuse) -> ""Authorities in Zambia have arrested 30 Tanzanians for working without permits, the immigration department said on Wednesday."" | ""In June, authorities arrested 19 other Tanzanians in the same district over illegal gold mining.""",,Petauke district,gold,,Governance || Governance || Social || Social,"Regulation, Compliance & Institutions || Regulation, Compliance & Institutions || Living Conditions & Social Fabric || Equity, Rights & Vulnerable Groups","Mining permitting and licensing practices || Enforcement of environmental and social regulations || Demographic changes (migration, influx of workers, displacement) || Crime and social disorder (corruption, violence, substance abuse)"
http://www.china.org.cn/world/Off_the_Wire/2017-08/04/content_41351214.htm,20170804,Top news items in major Zambian media outlets - China.org.cn,live_ok_trafilatura,1.0,1.0,0.9,"Social | Livelihoods & Economy | Employment creation and job security -> ""Zambian President Edgar Lungu said the benefits from high copper prices on the international market should now trigger investments into the agriculture sector, which has potential to create wealth and jobs."" || Social | Livelihoods & Economy | Income generation and poverty reduction or exacerbation -> ""Zambian President Edgar Lungu said the benefits from high copper prices on the international market should now trigger investments into the agriculture sector, which has potential to create wealth and jobs.""",Nchanga underground mine,"Chingola, Copperbelt Province",copper,Konkola Copper Mines,Social || Social,Livelihoods & Economy || Livelihoods & Economy,Employment creation and job security || Income generation and poverty reduction or exacerbation
http://www.iol.co.za/business-report/pallinghurst-resources-takes-full-control-of-australian-de-listed-gemfields-10630557,20170804,Pallinghurst Resources takes full control of Australian de-listed Gemfields,live_ok_newspaper,0.95,0.98,0.9,"Social | Livelihoods & Economy | Income generation and poverty reduction or exacerbation -> ""Gemfields' debt is currently at record levels, caused in large measure by a material drop in emerald production at Kagem mine in Zambia and resulting in a U.S.$54 million year-on-year decline in Kagem's auction revenues for the year ending 30 June.""",Kagem,,emeralds,Gemfields,Social,Livelihoods & Economy,Income generation and poverty reduction or exacerbation
http://www.miningweekly.com/article/nedbank-cib-supports-african-mining-keen-to-do-more-2017-08-11,20170810,"Nedbank CIB supports African mining, keen to do more",live_ok_newspaper,0.9,0.95,0.8,"Governance | Regulation, Compliance & Institutions | Mining permitting and licensing practices -> ""Mining companies also need to have all their permitting in place before the bank will advance the money; this includes the completed DFS, regulatory approvals and their social- and environmental-impact plans, he says.""",,,,First Quantum Minerals,Governance,"Regulation, Compliance & Institutions",Mining permitting and licensing practices
https://www.lusakatimes.com/2017/08/01/zambiarentier-state-collecting-cash-copper-refusing-diversify-economy/,20170801,Zambia : Zambia:Rentier State Collecting Cash From Copper But refusing to Diversify Economy,live_ok_trafilatura,0.95,0.95,0.8,"Social | Livelihoods & Economy | Income generation and poverty reduction or exacerbation -> ""Zambia's per capita fell from $1,725 in 2012 to $1,292 in 2016 and am sure there are other things affected."" || Social | Livelihoods & Economy | Business opportunities (local supply chains, services) -> ""Fall in exports of copper affect several other economic activities."" || Social | Equity, Rights & Vulnerable Groups | Wealth distribution and inequality -> ""Zambia is trapped into a rentier state where the business sector cannot use the cash that comes from the cow to diversify its exports, at least when copper prices are favorable.""",,,copper,,Social || Social || Social,"Livelihoods & Economy || Livelihoods & Economy || Equity, Rights & Vulnerable Groups","Income generation and poverty reduction or exacerbation || Business opportunities (local supply chains, services) || Wealth distribution and inequality"
https://www.lusakatimes.com/2017/08/03/allegations-3-billion-mineral-theft-malicious-nonsense-says-chamber-mines-chief/,20170803,"Zambia : Allegations of $3 billion of mineral theft ""malicious nonsense"", says Chamber of Mines Chief",live_ok_trafilatura,0.99,0.99,0.9,"Governance | Transparency & Accountability | Anti-corruption and bribery risks -> """"Zambia loses about US$3 billion annually through illicit financial flows (IFF) mainly perpetrated in the minerals sub-sector""."" | ""it is corruption that is the big-ticket item, not alleged mineral theft. The report says the amounts linked to suspected corruption are ""significant"" – over ZMW 3 billion, 76% of the total potential losses."" | """"Analysis revealed that these were predominantly linked to public procurement contracts,"" the report says."" || Governance | Reputation & Social License | Mining image and public perception -> """"The portrayal of the mining industry as robbing Zambia of billions of dollars is dramatically at odds with the actual findings of the report,"" said Chishimba."" | """"These allegations are wholly untrue, and come from a position of ignorance – not just about how copper is mined and produced, but how our mineral monitoring systems work,"" said Lumamba in the interview. ""It's alarmism.""""",Kansanshi,Copperbelt,copper,,Governance || Governance,Transparency & Accountability || Reputation & Social License,Anti-corruption and bribery risks || Mining image and public perception
https://www.lusakatimes.com/2017/08/05/lack-interaction-lumwana-mine-kakahindu-community-causing-environmental-challenges-fodep/,20170805,Zambia : Lack of interaction between Lumwana Mine and Kakahindu community causing Environmental challenges -FODEP,live_ok_trafilatura,0.98,0.95,0.9,"Environmental | Land, Soil & Geology | Ground vibration and air overpressure (blasting impacts) -> ""most of the houses in Kakahindu have developed cracks and are on the verge of collapsing while others have collapsed due to blasting at the mining firm."" || Social | Health, Safety & Well-being | Public safety concerns from blasting, vibrations, fly rock -> ""most of the houses in Kakahindu have developed cracks and are on the verge of collapsing while others have collapsed due to blasting at the mining firm."" | ""The Executive Director has also called on the Mine and the Zambia Environmental Management Agency, ZEMA to find a ways of offsetting the cracking of houses in order to prevent houses from collapsing."" || Social | Living Conditions & Social Fabric | Social infrastructure and amenities (education, healthcare, public services, leisure) -> ""the school is lacking adequate services provision in the education sector as evident by low staffing levels as well as inadequate classroom blocks to cater for the growing population of pupils"" | ""We have 900 pupils against 9 teachers."" || Social | Livelihoods & Economy | Business opportunities (local supply chains, services) -> ""calls upon the government to explore a robust local industrialization policy that can enable local people to take advantage of Copper and other mineral resources to develop intermediate products such as geysers and solar panels among others unlike the current situation where copper and other minerals are exported in raw form."" || Governance | Stakeholder Engagement & Rights | Stakeholder inclusion in decision-making -> ""we feel there is little interaction between the Lumwana mines and the community regarding some of the environment effects that need to be addressed,""",Lumwana Mine,Kalumbila district (Kakahindu community),Copper,Lumwana Mine Company,Environmental || Social || Social || Social || Governance,"Land, Soil & Geology || Health, Safety & Well-being || Living Conditions & Social Fabric || Livelihoods & Economy || Stakeholder Engagement & Rights","Ground vibration and air overpressure (blasting impacts) || Public safety concerns from blasting, vibrations, fly rock || Social infrastructure and amenities (education, healthcare, public services, leisure) || Business opportunities (local supply chains, services) || Stakeholder inclusion in decision-making"
https://www.opendemocracy.net/uk/amy-hall/london-is-cloaking-environmental-racism-in-respectability-but-zambian-villagers-are-figh,20170803,London is cloaking environmental racism in respectability – but Zambian villagers are fighting back | openDemocracy,live_ok_newspaper,0.99,0.99,0.9,"Environmental | Water Resources | Acid mine drainage -> ""Hundreds of people living near Chingola were hospitalised due to water contamination from sulphuric acid and other chemicals from a KCM-owned mine in 2006."" || Environmental | Water Resources | Surface water pollution and quality degradation -> ""We have no water source apart from the river and it's totally polluted"" | ""Hundreds of people living near Chingola were hospitalised due to water contamination from sulphuric acid and other chemicals from a KCM-owned mine in 2006."" || Environmental | Water Resources | Freshwater ecotoxicity (heavy metals, pH changes, sensitive species) -> ""Hundreds of people living near Chingola were hospitalised due to water contamination from sulphuric acid and other chemicals from a KCM-owned mine in 2006."" | ""Most of us are very weak and have constant stomach pains. When we bathe using this water our skin itches."" || Social | Health, Safety & Well-being | Community exposure to dust, noise, pollution -> ""Hundreds of people living near Chingola were hospitalised due to water contamination from sulphuric acid and other chemicals from a KCM-owned mine in 2006."" | """"Most of us are very weak and have constant stomach pains. When we bathe using this water our skin itches."""" || Social | Health, Safety & Well-being | Accidents and fatalities (including structural failures such as tailings dams) -> ""Local people have also reported deaths after their relatives drank from a local river."" || Governance | Transparency & Accountability | Anti-corruption and bribery risks -> ""Vedanta has been accused of tax dodging in the past through under-pricing copper sold through KCM in order to pay less tax in Zambia.""",,Chingola,copper,Konkola Copper Mines,Environmental || Environmental || Environmental || Social || Social || Governance,"Water Resources || Water Resources || Water Resources || Health, Safety & Well-being || Health, Safety & Well-being || Transparency & Accountability","Acid mine drainage || Surface water pollution and quality degradation || Freshwater ecotoxicity (heavy metals, pH changes, sensitive species) || Community exposure to dust, noise, pollution || Accidents and fatalities (including structural failures such as tailings dams) || Anti-corruption and bribery risks"
