sourceurl,sqldate,title,scrape_status,in_zambia_confidence,mining_related_confidence,impact_confidence,impact_evidence,mine_name,region,mineral_type,mining_company,impact_level1,impact_level2,impact_level3
https://www.breitbart.com/africa/2025/03/24/chinese-copper-mine-causes-giant-acid-spill-in-zambia-major-river-totally-dead/,20250324,Chinese Copper Mine Causes Giant Acid Spill in Zambia: Major River 'Totally Dead',live_ok_trafilatura,0.99,0.99,0.9,"Environmental | Water Resources | Acid mine drainage -> ""dumped about fifty million liters of acid waste into the local water table"" || Environmental | Water Resources | Groundwater contamination -> ""dumped about fifty million liters of acid waste into the local water table"" || Environmental | Water Resources | Surface water pollution and quality degradation -> ""50 million liters of toxic slurry poured into a stream that connects to the vital Kafue River"" || Environmental | Water Resources | Freshwater ecotoxicity (heavy metals, pH changes, sensitive species) -> ""Huge numbers of dead fish began washing up on the river banks, wiping out the local fishing industry"" | ""Environmental activists called the toxic spill an ""environmental disaster of catastrophic consequences"" and pronounced the 930-mile-long Kafue River ""totally dead."""" || Environmental | Biodiversity & Ecosystems | Impacts on aquatic ecosystems and life below water -> ""Huge numbers of dead fish began washing up on the river banks, wiping out the local fishing industry"" | ""the 930-mile-long Kafue River ""totally dead."""" || Environmental | Biodiversity & Ecosystems | Loss of ecosystem services -> ""This river provides water for plants, fish, animals, and about 12 million human inhabitants"" | ""wiping out the local fishing industry. Crops watered by the river withered and died."" || Environmental | Land, Soil & Geology | Topsoil degradation and loss of soil fertility -> ""Crops watered by the river withered and died"" | ""Mike Mposha also ordered the company to supply safe drinking water to communities affected by the toxic spill, and to take all necessary measures to restore the local soil."" || Environmental | Water Resources | Water management challenges -> ""The Zambian military used planes and speedboats to dump hundreds of tons of lime into the river to neutralize the acid waste"" | ""Mposha ordered the company to ""engage an independent environmental consultant to continuously monitor both surface and groundwater quality"""" || Social | Health, Safety & Well-being | Accidents and fatalities (including structural failures such as tailings dams) -> ""On February 18, a tailings dam at the Sino-Metals Leach Zambia mine collapsed"" | ""A mine worker was killed at this second mine after falling into the acid."" || Social | Health, Safety & Well-being | Worker health and safety risks -> ""China's mining operations in Zambia have been frequently criticized for having poor safety, environmental, and labor standards"" | ""A mine worker was killed at this second mine after falling into the acid."" || Social | Livelihoods & Economy | Income generation and poverty reduction or exacerbation -> ""Huge numbers of dead fish began washing up on the river banks, wiping out the local fishing industry"" || Social | Living Conditions & Social Fabric | Livability (cost of living, food security, communication services) -> ""Crops watered by the river withered and died"" | ""This river provides water for plants, fish, animals, and about 12 million human inhabitants, including residents of the national capital, Lusaka."" || Governance | Regulation, Compliance & Institutions | Enforcement of environmental and social regulations -> ""On February 24, the Zambian government ordered Sino-Metals Leach Zambia Ltd. to halt operations at three of its tailing storage dams until their embankments have been fully repaired."" || Governance | Transparency & Accountability | Accountability for accidents and environmental damage -> ""Two managers from the second mine have been placed under arrest."" || Governance | Risk Management & Long-Term Stewardship | Tailings and waste governance -> ""On February 24, the Zambian government ordered Sino-Metals Leach Zambia Ltd. to halt operations at three of its tailing storage dams until their embankments have been fully repaired"" | ""Mposha ordered the company to ""engage an independent environmental consultant to continuously monitor both surface and groundwater quality"" and conduct a biodiversity assessment"" || Governance | Reputation & Social License | Mining image and public perception -> ""the Sino-Metals Leach Zambia disaster has pushed China-Zambia relations to the breaking point"" | """"will shine a very unflattering light on Chinese investment in Zambia,"" he said.""",Sino-Metals Leach Zambia,Copperbelt province,copper,Sino-Metals Leach Zambia Ltd.,Environmental || Environmental || Environmental || Environmental || Environmental || Environmental || Environmental || Environmental || Social || Social || Social || Social || Governance || Governance || Governance || Governance,"Water Resources || Water Resources || Water Resources || Water Resources || Biodiversity & Ecosystems || Biodiversity & Ecosystems || Land, Soil & Geology || Water Resources || Health, Safety & Well-being || Health, Safety & Well-being || Livelihoods & Economy || Living Conditions & Social Fabric || Regulation, Compliance & Institutions || Transparency & Accountability || Risk Management & Long-Term Stewardship || Reputation & Social License","Acid mine drainage || Groundwater contamination || Surface water pollution and quality degradation || Freshwater ecotoxicity (heavy metals, pH changes, sensitive species) || Impacts on aquatic ecosystems and life below water || Loss of ecosystem services || Topsoil degradation and loss of soil fertility || Water management challenges || Accidents and fatalities (including structural failures such as tailings dams) || Worker health and safety risks || Income generation and poverty reduction or exacerbation || Livability (cost of living, food security, communication services) || Enforcement of environmental and social regulations || Accountability for accidents and environmental damage || Tailings and waste governance || Mining image and public perception"
https://www.climatechangenews.com/2025/03/28/catastrophic-acid-spills-at-copper-mines-test-zambias-plans-to-boost-production/,20250328,An acid spill in Zambia tests the country's plans to boost production,live_ok_newspaper,0.99,0.98,0.9,"Environmental | Water Resources | Acid mine drainage -> ""the tailings dam holding mining waste from Chinese company Sino-Metals Leach Zambia burst its walls and released 50 million litres of acidic effluent into the river."" || Environmental | Water Resources | Surface water pollution and quality degradation -> ""four copper mining companies ... have been accused of releasing toxic mining waste into the Kafue River's watershed in one of the country's worst environmental disasters."" | ""the tailings dam ... released 50 million litres of acidic effluent into the river."" || Environmental | Water Resources | Freshwater ecotoxicity (heavy metals, pH changes, sensitive species) -> ""the tailings dam ... released 50 million litres of acidic effluent into the river."" | ""The pollution killed fish, burned maize and groundnut crops and led to the deaths of livestock, wiping out livelihoods"" || Environmental | Biodiversity & Ecosystems | Impacts on aquatic ecosystems and life below water -> ""The pollution killed fish, burned maize and groundnut crops and led to the deaths of livestock, wiping out livelihoods"" || Environmental | Land, Soil & Geology | Topsoil degradation and loss of soil fertility -> ""Traces of acidic effluent which left cracks in the ground on Kalusale farmland"" | ""A discoloured maize cob starts rotting after the plant was exposed to acidic water"" || Social | Health, Safety & Well-being | Mental and physical health impacts on communities -> ""People unknowingly drank contaminated water and ate affected maize. Now many are suffering from headaches, coughs, diarrhea, muscle cramps and even sores on their legs,"" || Social | Health, Safety & Well-being | Accidents and fatalities (including structural failures such as tailings dams) -> ""the director of a mine operated by Rongxing Investments was arrested this month after the Chinese company reportedly ignored a government order to halt its activities following the death of a worker, who allegedly fell into a pool of acid"" || Social | Livelihoods & Economy | Income generation and poverty reduction or exacerbation -> ""The pollution killed fish, burned maize and groundnut crops and led to the deaths of livestock, wiping out livelihoods and deepening the plight of struggling farmers."" || Social | Living Conditions & Social Fabric | Social infrastructure and amenities (education, healthcare, public services, leisure) -> ""In the days following the spill, the water supply to the nearby town of Kitwe was shut down."" || Governance | Risk Management & Long-Term Stewardship | Tailings and waste governance -> ""The Engineering Institution of Zambia ... dispatched a team of senior engineers to investigate the dam's collapse."" | ""The team also observed cracks, uncompacted walls and inconsistent wall thickness, which raises concerns about the integrity of the structure."" || Governance | Regulation, Compliance & Institutions | Mining permitting and licensing practices -> ""Zambia Environmental Management Agency has had to fast-track environmental permitting, further weakening oversight"" || Governance | Transparency & Accountability | Accountability for accidents and environmental damage -> ""Polluters often face minimal penalties, allowing them to continue their operations without meaningful consequences,""",Sino-Metals Leach Zambia,Kalusale,copper,Sino-Metals Leach Zambia,Environmental || Environmental || Environmental || Environmental || Environmental || Social || Social || Social || Social || Governance || Governance || Governance,"Water Resources || Water Resources || Water Resources || Biodiversity & Ecosystems || Land, Soil & Geology || Health, Safety & Well-being || Health, Safety & Well-being || Livelihoods & Economy || Living Conditions & Social Fabric || Risk Management & Long-Term Stewardship || Regulation, Compliance & Institutions || Transparency & Accountability","Acid mine drainage || Surface water pollution and quality degradation || Freshwater ecotoxicity (heavy metals, pH changes, sensitive species) || Impacts on aquatic ecosystems and life below water || Topsoil degradation and loss of soil fertility || Mental and physical health impacts on communities || Accidents and fatalities (including structural failures such as tailings dams) || Income generation and poverty reduction or exacerbation || Social infrastructure and amenities (education, healthcare, public services, leisure) || Tailings and waste governance || Mining permitting and licensing practices || Accountability for accidents and environmental damage"
https://www.dailymaverick.co.za/article/2025-03-25-massive-environmental-disaster-unfolding-as-poison-from-chinese-mine-flows-down-major-zambian-river/,20250325,Environmental disaster unfolding as poison from Chinese mine flows down major Zambian river,live_ok_trafilatura,0.98,0.98,0.9,"Environmental | Water Resources | Surface water pollution and quality degradation -> ""The spill released about 50Â million litres of acidic and highly toxic waste into the Kafue River ecosystem."" | ""the contamination is killing all aquatic life, poisoning water supplies and crippling agricultural activities."" || Environmental | Water Resources | Freshwater ecotoxicity (heavy metals, pH changes, sensitive species) -> ""It contained concentrated acid, heavy metals and dissolved solids from mining operations."" | ""the contamination is killing all aquatic life"" || Environmental | Water Resources | Groundwater contamination -> ""Agricultural crops along the river banks have been destroyed as mining waste seeps into the soil, potentially contaminating groundwater reservoirs."" || Environmental | Land, Soil & Geology | Tailings generation and management -> ""The disaster began on 18 February 2025 when a tailings dam collapsed at a Chinese corporation-owned copper mine in northern Zambia."" | ""The dam was owned by the Chinese company Sino-Metals Leach and was designed to store mining waste."" || Environmental | Land, Soil & Geology | Topsoil degradation and loss of soil fertility -> ""Agricultural crops along the river banks have been destroyed as mining waste seeps into the soil, potentially contaminating groundwater reservoirs."" || Environmental | Biodiversity & Ecosystems | Ecosystem degradation and habitat loss/fragmentation -> ""the contamination is killing all aquatic life, poisoning water supplies and crippling agricultural activities."" | ""Fish died and birdlife disappeared almost immediately. Now everything is dead, itâs like a totally dead river."" || Environmental | Biodiversity & Ecosystems | Impacts on aquatic ecosystems and life below water -> ""the contamination is killing all aquatic life"" | ""Dead fish are washing on to riverbeds and previously thriving birdlife has disappeared."" || Social | Health, Safety & Well-being | Community exposure to dust, noise, pollution -> ""the contamination is killing all aquatic life, poisoning water supplies and crippling agricultural activities."" | ""providing drinking water for more than five million people, including residents of Lusaka."" || Social | Livelihoods & Economy | Income generation and poverty reduction or exacerbation -> ""The river also supports fishing activities and agricultural irrigation for farmers, while supplying water for industrial operations."" | ""the contamination is killing all aquatic life, poisoning water supplies and crippling agricultural activities."" || Governance | Regulation, Compliance & Institutions | Enforcement of environmental and social regulations -> ""Zambian government spokesperson Cornelius Mweetwa announced that Sino-Metals Leach Zambia would be required to pay for all clean-up operations, with authorities ordering the suspension of the mineâs operations."" || Governance | Transparency & Accountability | Accountability for accidents and environmental damage -> ""Sino-Metals Leach Zambia would be required to pay for all clean-up operations"" | ""Daimone Siulapwa ... called the spill an act or terrorism and demanded immediate prosecution of Sino Metal executives."" || Governance | Risk Management & Long-Term Stewardship | Tailings and waste governance -> ""The disaster began on 18 February 2025 when a tailings dam collapsed at a Chinese corporation-owned copper mine in northern Zambia."" | ""The Zambian Air Force was deployed to release several hundred tons of lime in the river to neutralise the acidic contamination"" || Governance | Risk Management & Long-Term Stewardship | Long-term liability management (pollution, water treatment, land stability) -> ""Zambian government spokesperson Cornelius Mweetwa announced that Sino-Metals Leach Zambia would be required to pay for all clean-up operations""",,northern Zambia,copper,Sino-Metals Leach,Environmental || Environmental || Environmental || Environmental || Environmental || Environmental || Environmental || Social || Social || Governance || Governance || Governance || Governance,"Water Resources || Water Resources || Water Resources || Land, Soil & Geology || Land, Soil & Geology || Biodiversity & Ecosystems || Biodiversity & Ecosystems || Health, Safety & Well-being || Livelihoods & Economy || Regulation, Compliance & Institutions || Transparency & Accountability || Risk Management & Long-Term Stewardship || Risk Management & Long-Term Stewardship","Surface water pollution and quality degradation || Freshwater ecotoxicity (heavy metals, pH changes, sensitive species) || Groundwater contamination || Tailings generation and management || Topsoil degradation and loss of soil fertility || Ecosystem degradation and habitat loss/fragmentation || Impacts on aquatic ecosystems and life below water || Community exposure to dust, noise, pollution || Income generation and poverty reduction or exacerbation || Enforcement of environmental and social regulations || Accountability for accidents and environmental damage || Tailings and waste governance || Long-term liability management (pollution, water treatment, land stability)"
https://www.directorstalkinterviews.com/firering-strategic-minerals-expands-limecos-operations-with-1-5m-fundraise/4121188912,20250323,Firering Strategic Minerals Expands Limeco's Operations With £1.5m Fundraise,live_ok_newspaper,0.95,0.95,0.9,"Governance | Risk Management & Long-Term Stewardship | Tailings and waste governance -> ""This is a zero-waste project, with all waste streams being repurposed for ancillary products and services, such as aggregate production, underscoring Limeco's commitment to sustainable practices."" || Governance | Regulation, Compliance & Institutions | Compliance with national and international standards -> ""Limeco's project has a JORC-compliant MRE of 145.2Mt at 95.7% CaCO 3 , consisting of 11.8Mt in the Measured category, 55.4Mt in the Indicated category, and 78.0Mt in the Inferred category (November 2024)."" || Social | Livelihoods & Economy | Business opportunities (local supply chains, services) -> ""Ancillary products and services contribute positively to the project's cash flow. These include aggregate production, which, in December 2024 reached 42,000 tonnes, estimated to reach the nameplate capacity of around 350,000 tonnes per annum in 2025, with the product being sold to local industrial companies."" | ""Establishing local production could help stabilise prices and reduce dependency on external suppliers, particularly as demand rises with the country's copper production expansion.""",Limeco,,quicklime,Limeco,Governance || Governance || Social,"Risk Management & Long-Term Stewardship || Regulation, Compliance & Institutions || Livelihoods & Economy","Tailings and waste governance || Compliance with national and international standards || Business opportunities (local supply chains, services)"
https://www.directorstalkinterviews.com/firering-strategic-minerals-on-fundraising-and-limeco-outlook-lonfrg/4121189929,20250402,Firering Strategic Minerals On Fundraising And Limeco Outlook (LON:FRG),live_ok_newspaper,0.95,0.95,0.85,"Social | Livelihoods & Economy | Business opportunities (local supply chains, services) -> ""Our product is mainly at the moment directed towards the copper market in Zambia. The quick lime is used in the copper flotation process and that's where our focus is at the moment."" | ""At the moment, there is a shortage of quick lime in-country so that's the assurance that we can give to the market is that the fundamentals are there in-country at the moment and forecasts support quite a strong support in that going forwards.""",Limeco,,quick lime,Firering Strategic Minerals,Social,Livelihoods & Economy,"Business opportunities (local supply chains, services)"
https://www.downtoearth.org.in/africa/environmental-catastrophe-in-zambia-after-acid-leak-at-chinese-operated-copper-mine,20250320,Zambia Faces Environmental Disaster After Acid Leak at Chinese-Operated Copper Mine,live_ok_trafilatura,0.99,0.98,0.9,"Environmental | Water Resources | Surface water pollution and quality degradation -> ""has polluted a vital river"" | ""around 50 million litres of waste, containing strong acid, dissolved solids, and heavy metals, flowed into a tributary linked to the Kafue River"" | ""An Associated Press (AP) journalist visiting parts of the Kafue River observed dead fish along the banks nearly 100 kilometres from the mine"" || Environmental | Water Resources | Groundwater contamination -> ""Concerns are mounting that groundwater may also be contaminated as the toxic waste seeps into the soil and spreads to nearby areas."" || Environmental | Land, Soil & Geology | Tailings generation and management -> ""a dam storing acidic waste from a copper mine in northern Zambia collapsed."" | ""Investigators from the Engineering Institution of Zambia estimate that around 50 million litres of waste, containing strong acid, dissolved solids, and heavy metals, flowed into a tributary linked to the Kafue River"" || Environmental | Land, Soil & Geology | Topsoil degradation and loss of soil fertility -> ""The Ministry of Water Development and Sanitation reported ""severe damage,"" including the destruction of crops along the river."" | ""Concerns are mounting that groundwater may also be contaminated as the toxic waste seeps into the soil and spreads to nearby areas."" || Environmental | Biodiversity & Ecosystems | Impacts on aquatic ecosystems and life below water -> ""An Associated Press (AP) journalist visiting parts of the Kafue River observed dead fish along the banks nearly 100 kilometres from the mine"" | """"Now, it's completely dead. It's unbelievable. The river died overnight."""" || Social | Health, Safety & Well-being | Accidents and fatalities (including structural failures such as tailings dams) -> ""a worker fell into acid and died."" | ""The incident occurred on February 18 when a dam storing acidic waste from a copper mine in northern Zambia collapsed."" || Social | Health, Safety & Well-being | Community exposure to dust, noise, pollution -> ""has polluted a vital river"" | ""toxic waste seeps into the soil and spreads to nearby areas."" | ""The acid spill has led to the suspension of water supplies in Kitwe, a city with around 700,000 inhabitants."" || Governance | Regulation, Compliance & Institutions | Enforcement of environmental and social regulations -> ""Both mines have now been forced to cease operations following government orders."" | ""Two Chinese managers have been arrested."" || Governance | Transparency & Accountability | Accountability for accidents and environmental damage -> ""Sino-Metals Leach Zambia would cover the costs of the cleanup."" | ""Zhang Peiwen, chairman of Sino-Metals Leach Zambia, ... issued an apology."" || Governance | Risk Management & Long-Term Stewardship | Tailings and waste governance -> ""The incident occurred on February 18 when a dam storing acidic waste from a copper mine in northern Zambia collapsed.""",,northern Zambia,copper,Sino-Metals Leach Zambia,Environmental || Environmental || Environmental || Environmental || Environmental || Social || Social || Governance || Governance || Governance,"Water Resources || Water Resources || Land, Soil & Geology || Land, Soil & Geology || Biodiversity & Ecosystems || Health, Safety & Well-being || Health, Safety & Well-being || Regulation, Compliance & Institutions || Transparency & Accountability || Risk Management & Long-Term Stewardship","Surface water pollution and quality degradation || Groundwater contamination || Tailings generation and management || Topsoil degradation and loss of soil fertility || Impacts on aquatic ecosystems and life below water || Accidents and fatalities (including structural failures such as tailings dams) || Community exposure to dust, noise, pollution || Enforcement of environmental and social regulations || Accountability for accidents and environmental damage || Tailings and waste governance"
https://www.finanznachrichten.de/nachrichten-2025-03/64919454-bemetals-corp-bemetals-starts-new-core-drilling-program-at-pangeni-copper-project-zambia-200.htm,20250325,"BeMetals Corp.: BeMetals Starts New Core Drilling Program at Pangeni Copper Project, Zambia",live_ok_trafilatura,1.0,1.0,0.9,"Social | Livelihoods & Economy | Business opportunities (local supply chains, services) -> ""Field operations and management have been provided by RES an independent geological consulting and contracting company."" | ""The core drilling was conducted by Blurock Mining Services, of Kitwe, Zambia."" | ""The samples were analyzed by Intertek Genalysis, an independent and accredited laboratory. Samples were prepared at their facility in Kitwe, Zambia and analytical work conducted in Australia."" || Governance | Regulation, Compliance & Institutions | Compliance with national and international standards -> ""The technical information in this news release for BeMetals has been reviewed and approved by John Wilton, CGeol FGS, CEO and President of BeMetals, and a ""Qualified Person"" as defined under National Instrument 43-101.""",Pangeni Copper Project,Zambian Copperbelt,copper,BeMetals Corp.,Social || Governance,"Livelihoods & Economy || Regulation, Compliance & Institutions","Business opportunities (local supply chains, services) || Compliance with national and international standards"
https://www.globalconstructionreview.com/chinas-ccecc-to-invest-1-4bn-in-africas-tazara-line-for-30-year-concession/,20250321,China's CCECC to invest $1.4bn in Africa's Tazara line for 30-year concession - Global Construction Review,live_ok_trafilatura,0.9,0.95,0.8,"Social | Livelihoods & Economy | Business opportunities (local supply chains, services) -> """"The investment from CCECC will not only restore our railway infrastructure but also position Tazara as a key enabler of trade and economic growth between Tanzania and Zambia,"" he said."" | ""Its aim was to allow Zambia to export its copper and cobalt without going through colonial Rhodesia or apartheid South Africa.""",,Copperbelt,copper and cobalt,,Social,Livelihoods & Economy,"Business opportunities (local supply chains, services)"
