sourceurl,sqldate,title,scrape_status,in_zambia_confidence,mining_related_confidence,impact_confidence,impact_evidence,mine_name,region,mineral_type,mining_company,impact_level1,impact_level2,impact_level3
https://www.investegate.co.uk:443/announcement/rns/firering-strategic-minerals-di---frg/proposed-placing-subscription-/8792137,20250321,Proposed Placing & Subscription | Company Announcement | Investegate,live_ok_trafilatura,0.98,0.95,0.8,"Governance | Risk Management & Long-Term Stewardship | Tailings and waste governance -> ""This is a zero-waste project, with all waste streams being repurposed for ancillary products and services, such as aggregate production, underscoring Limeco's commitment to sustainable practices."" || Social | Livelihoods & Economy | Business opportunities (local supply chains, services) -> ""Ancillary products and services contribute positively to the project's cash flow. These include aggregate production, which, in December 2024 reached 42,000 tonnes, estimated to reach the nameplate capacity of around 350,000 tonnes per annum in 2025, with the product being sold to local industrial companies."" || Social | Living Conditions & Social Fabric | Livability (cost of living, food security, communication services) -> ""In Zambia, reliance on imported quicklime from South Africa results in higher costs due to transport and importation expenses. Establishing local production could help stabilise prices and reduce dependency on external suppliers, particularly as demand rises with the country's copper production expansion.""",Limeco,Central African Copperbelt,quicklime (limestone),Limeco,Governance || Social || Social,Risk Management & Long-Term Stewardship || Livelihoods & Economy || Living Conditions & Social Fabric,"Tailings and waste governance || Business opportunities (local supply chains, services) || Livability (cost of living, food security, communication services)"
https://www.lusakatimes.com/2025/03/22/union-calls-out-lumwana-mine-bosses-to-respect-countrys-laws/,20250322,Zambia : Union calls out Lumwana mine bosses to respect country's laws,live_ok_trafilatura,0.95,0.95,0.9,"Social | Equity, Rights & Vulnerable Groups | Stakeholder inclusion and community participation -> ""PAMUZ has more than 300 members and requested Lumwana Mine to establish a branch at the mine.The recognition agreement ought to have been signed within 3 months from 13th November 2024,"" | ""the mining company has showed unwillingness to sign the recognition agreement despite numerous correspondence on the matter."" | ""the company disregarded the Labour Commissioner's guidance to have the union recognised, in breach of Article 21 of the republican constitution which provides for the right to freedom of association"" || Social | Quality of Work Life | Labor conditions and workplace dignity -> ""Another issue pertains to the non-payment of overtime allowance to PAMUZ members who are working more than eight hours per shift while the Employment Code Act No. 3 of 2019 provides that normal working hours for an employee is eight hours, and any hours thereafter ought to be compensated by payment of overtime allowance,"" | ""These breaches of the law and human rights violations are so grave that the union demands Lumwana Mine to respect national laws and their worker's rights.""",Lumwana Mine,,,Barrick Gold Corporation,Social || Social,"Equity, Rights & Vulnerable Groups || Quality of Work Life",Stakeholder inclusion and community participation || Labor conditions and workplace dignity
https://www.lusakatimes.com/2025/03/27/mulenga-cries-for-locals-mine-benefits/,20250327,Zambia : Mulenga Cries For Locals Mine Benefits,live_ok_trafilatura,0.95,0.95,0.9,"Social | Livelihoods & Economy | Business opportunities (local supply chains, services) -> ""major mining firms are favouring foreign companies for business, disregarding corporate social investment in mining towns, putting local businesses last, and delaying supplier payments by up to 90 to 120 days."" || Social | Livelihoods & Economy | Employment creation and job security -> ""Local contractors, suppliers, and communities have been protesting over inadequate business opportunities and jobs in the mining sector."" || Social | Living Conditions & Social Fabric | Social infrastructure and amenities (education, healthcare, public services, leisure) -> ""These problems are made worse by the lack of substantial corporate social responsibility (CSR) programs, which deprive mining communities of vital investments in healthcare, education, and infrastructure."" || Governance | Regulation, Compliance & Institutions | Enforcement of environmental and social regulations -> ""Government action is urgently needed in response to the concerns expressed by Copperbelt suppliers, contractors, and other stakeholders about the activities of Mopani and KCM investors."" | ""In order to guarantee that a significant percentage of mining contracts are given to Zambian-owned companies, it should first enforce local procurement limits. Second, in order to avoid financial hardship for nearby companies, stringent payment rules that mandate mining companies complete payments with suppliers within 30 days must be implemented.""",,Copperbelt,copper,Mopani; KCM,Social || Social || Social || Governance,"Livelihoods & Economy || Livelihoods & Economy || Living Conditions & Social Fabric || Regulation, Compliance & Institutions","Business opportunities (local supply chains, services) || Employment creation and job security || Social infrastructure and amenities (education, healthcare, public services, leisure) || Enforcement of environmental and social regulations"
https://www.lusakatimes.com/2025/03/28/press-release-of-zccm-defense-political-interference-at-zccm-ih-responses-to-economist-lubinda-haabazoka/,20250328,Zambia : Press release of ZCCM Defense Political interference at ZCCM-IH : Responses to economist Lubinda Haabazoka,live_ok_trafilatura,0.99,0.95,0.88,"Governance | Transparency & Accountability | Anti-corruption and bribery risks -> ""Why did he not hold IDC CEO Cornwell Muleya to account when ZCCM Defense recently condemned his culpable inaction regarding the $120 million that went up in smoke in a very 2suspicious manner?"" | ""Why did Lubinda Haabazoka not relay the Committee on Parastatal Bodies' unheeded recommendation to prosecute the crooks?"" || Social | Equity, Rights & Vulnerable Groups | Crime and social disorder (corruption, violence, substance abuse) -> ""Worse still, the Zambian army was even accused of mining the gold during the long years of closure."" | ""In response to the uproar and accusations, three ZNS officers were fired for illegal gold mining (Appendix 9)."" || Social | Equity, Rights & Vulnerable Groups | Land ownership impacts and regional value changes -> ""For more than a year, The Zambia National Service has illegally seized and operates ZCCM-IH's Mushe Milling mill without any authorisation."" || Social | Livelihoods & Economy | Income generation and poverty reduction or exacerbation -> ""ZCCM-IH alone took on $1.5 billion in debt to acquire 90% of Mopani in 2021 at a staggering price on pressure of GRZ."" | ""when our company was on the verge of ruin because of the exorbitant interest charged by Glencore?"" || Social | Equity, Rights & Vulnerable Groups | Wealth distribution and inequality -> ""paltry 3.1% KMP royalty is peanuts compared to the 20% of KMP's colossal revenues that ZCCM-IH could have obtained"" || Governance | Transparency & Accountability | Corporate transparency and reporting -> ""Why did Lubinda Haabazoka not react when Mines Minister Paul Kabuswe refused to answer parliamentarians' questions about the details of the deal with IRH concerning Mopani?Why did Lubinda Haabazoka not question the GRZ when it refused to give the minority shareholders the documents they had requested on the astronomical purchase of the 90% stake in Mopani?""",Mopani; Konkola Copper Mines (KCM); Kasenseli gold mine; Mushe Milling mill,Ndola,copper,Glencore; First Quantum; Vedanta; ZCCM-IH; Carlisa Investments; IRH,Governance || Social || Social || Social || Social || Governance,"Transparency & Accountability || Equity, Rights & Vulnerable Groups || Equity, Rights & Vulnerable Groups || Livelihoods & Economy || Equity, Rights & Vulnerable Groups || Transparency & Accountability","Anti-corruption and bribery risks || Crime and social disorder (corruption, violence, substance abuse) || Land ownership impacts and regional value changes || Income generation and poverty reduction or exacerbation || Wealth distribution and inequality || Corporate transparency and reporting"
https://www.miningmx.com/news/markets/60570-china-to-invest-1-4bn-in-tanzania-zambia-railway/,20250326,China to invest $1.4bn in Tanzania-Zambia railway - Miningmx,live_ok_trafilatura,0.95,0.9,0.6,"Social | Livelihoods & Economy | Business opportunities (local supply chains, services) -> ""will invest $1.4bn to upgrade the Tanzania-Zambia railway, the line's operator said, improving a key route for copper exports from central Africa."" | ""also offers a way to bypass logistics bottlenecks in South Africa that have slowed copper and cobalt exports"" || Social | Livelihoods & Economy | Equipment and materials availability affecting local labor markets -> ""Some $1bn of CCECC's investment will go towards the rehabilitation of the TAZARA's rail tracks, while the balance will be used to purchase 32 new locomotives and 762 new wagons to boost capacity""",,,copper,,Social || Social,Livelihoods & Economy || Livelihoods & Economy,"Business opportunities (local supply chains, services) || Equipment and materials availability affecting local labor markets"
https://www.miningmx.com/trending/60570-china-to-invest-1-4bn-in-tanzania-zambia-railway/,20250321,China to invest $1.4bn in Tanzania-Zambia railway - Miningmx,live_ok_trafilatura,0.95,0.95,0.75,"Environmental | Land, Soil & Geology | Transport corridors and access road impacts -> ""THE China Civil Engineering Construction Corporation (CCECC) will invest $1.4bn to upgrade the Tanzania-Zambia railway, the line's operator said, improving a key route for copper exports from central Africa."" | ""Some $1bn of CCECC's investment will go towards the rehabilitation of the TAZARA's rail tracks, while the balance will be used to purchase 32 new locomotives and 762 new wagons to boost capacity, Ching'andu said in the Reuters report."" || Social | Livelihoods & Economy | Business opportunities (local supply chains, services) -> ""improving a key route for copper exports from central Africa."" | ""The railway... also offers a way to bypass logistics bottlenecks in South Africa that have slowed copper and cobalt exports, said Reuters in a report on Thursday."" | ""Some $1bn of CCECC's investment will go towards the rehabilitation of the TAZARA's rail tracks, while the balance will be used to purchase 32 new locomotives and 762 new wagons to boost capacity, Ching'andu said in the Reuters report."" || Governance | Regulation, Compliance & Institutions | Mining permitting and licensing practices -> """"The decision to grant a concession follows an in-depth evaluation of TAZARA's challenges over the years, which necessitated urgent intervention,"" TAZARA Authority CEO Bruno Ching'andu said in a statement."" | ""The 30-year concession will be structured into three years of construction work and 27 years of operation and maintenance, Ching'andu said, adding that negotiations between both sides have not yet been completed.""",,,copper,,Environmental || Social || Governance,"Land, Soil & Geology || Livelihoods & Economy || Regulation, Compliance & Institutions","Transport corridors and access road impacts || Business opportunities (local supply chains, services) || Mining permitting and licensing practices"
https://www.miningreview.com/magazine-article/mining-responsibly-a-shift-towards-sustainability/,20250328,,wayback_ok,0.98,0.98,0.9,"Environmental | Biodiversity & Ecosystems | Ecosystem recovery through reclamation and restoration (post-mining impact) -> ""The aim of the WLCP is to restore the ecosystem."" | ""West Lunga is being revitalised thanks to the efforts of FQM"" || Governance | Stakeholder Engagement & Rights | Stakeholder inclusion in decision-making -> ""The WLCP was incorporated in 2019 and now works with the DNPW and local FOCUS FEATURE | ENVIRONMENTAL SUSTAINABILITY communities to enhance the management of the West Lunga ecosystem with funding and support not only from FQM but also the World Wide Fund for Nature (WWF) and The Nature Conservancy (TNC)."" || Social | Livelihoods & Economy | Employment creation and job security -> ""FQM prioritises responsible resource extraction, sustainability, and social responsibility, ensuring long-term benefits for people and communities through employment, business development, education, training, and community investment."" || Social | Livelihoods & Economy | Human capital development (skills, training, workforce development) -> ""FQM prioritises responsible resource extraction, sustainability, and social responsibility, ensuring long-term benefits for people and communities through employment, business development, education, training, and community investment."" | ""It provides vital resources and training support to a team of 120 law enforcement personnel across West Lunga."" || Social | Living Conditions & Social Fabric | Social infrastructure and amenities (education, healthcare, public services, leisure) -> ""Its mission is to support social and ecological development in North-Western Province, Zambia, through health, education, agriculture, local business development, livelihood support, and wildlife and biodiversity conservation initiatives.""","Kansanshi, Sentinel, Enterprise",North-Western Province,copper; nickel,First Quantum Minerals,Environmental || Governance || Social || Social || Social,Biodiversity & Ecosystems || Stakeholder Engagement & Rights || Livelihoods & Economy || Livelihoods & Economy || Living Conditions & Social Fabric,"Ecosystem recovery through reclamation and restoration (post-mining impact) || Stakeholder inclusion in decision-making || Employment creation and job security || Human capital development (skills, training, workforce development) || Social infrastructure and amenities (education, healthcare, public services, leisure)"
https://www.preventionweb.net/news/paving-zambias-future-how-climate-resilient-roads-are-driving-change,20250401,Ζambia: How climate-resilient roads are driving change | PreventionWeb,live_ok_newspaper,0.99,0.85,0.75,"Environmental | Land, Soil & Geology | Transport corridors and access road impacts -> ""heavy rains can brutally cut off these crucial transport arteries."" | ""Copper—the country's economic lifeblood—makes up 80% of exports, most of which must travel by road or rail to reach seaports."" || Social | Livelihoods & Economy | Business opportunities (local supply chains, services) -> ""Over 800,000 people—including about 255,000 women—will benefit from these upgrades, with tangible impacts on safety, travel time, and economic opportunities."" | ""constructing a modern One Stop Border Post at Nakonde and establishing a SMART corridor between Lusaka and Nakonde to streamline the transport of goods and people."" | ""They connect smallholder farmers to bustling markets... and open gateways to trade with neighboring countries."" || Social | Living Conditions & Social Fabric | Livability (cost of living, food security, communication services) -> ""unreliable access can disrupt everything from school attendance to the timely delivery of food and medicine."" | ""Only 17% of the population resides within two kilometers of an all-season road"" || Governance | Stakeholder Engagement & Rights | Stakeholder inclusion in decision-making -> ""In addition, stakeholder dialogues convened everyone from government agencies to community leaders to discuss specific adaptation options and share lessons learned."" | ""An integral aspect of the project is gender-disaggregated analysis, ensuring the needs of women and girls are not overlooked.""",,Serenje–Mpika (Dar es Salaam corridor); Lusaka; Nakonde,copper,,Environmental || Social || Social || Governance,"Land, Soil & Geology || Livelihoods & Economy || Living Conditions & Social Fabric || Stakeholder Engagement & Rights","Transport corridors and access road impacts || Business opportunities (local supply chains, services) || Livability (cost of living, food security, communication services) || Stakeholder inclusion in decision-making"
https://www.scmp.com/news/china/diplomacy/article/3303353/will-zambian-mine-disaster-spill-over-destroy-relations-china,20250323,Will Zambian mine disaster spill over to destroy relations with China? | South China Morning Post,live_ok_trafilatura,0.99,0.99,0.9,"Environmental | Water Resources | Acid mine drainage -> ""A 50-million-litre acid spill from a Chinese-owned copper mine in Zambia"" || Environmental | Water Resources | Surface water pollution and quality degradation -> ""The river is a vital 1,576km (979-mile) waterway which is relied on by about 12 million people and provides drinking water to around five million – including residents in capital Lusaka."" | ""A 50-million-litre acid spill ... is now threatening to kill ties with Beijing"" || Environmental | Water Resources | Freshwater ecotoxicity (heavy metals, pH changes, sensitive species) -> ""The spill has also been devastating for wildlife, with reports of dead fish found floating up to 100km from the spill site."" || Environmental | Biodiversity & Ecosystems | Impacts on aquatic ecosystems and life below water -> ""The spill has also been devastating for wildlife, with reports of dead fish found floating up to 100km from the spill site."" || Social | Health, Safety & Well-being | Community exposure to dust, noise, pollution -> ""The river ... provides drinking water to around five million – including residents in capital Lusaka."" | ""Zambian President Hakainde Hichilema appealed for help from experts, calling the disaster ""a crisis that threatens people and wildlife along the Kafue""."" || Governance | Reputation & Social License | Mining image and public perception -> ""A 50-million-litre acid spill from a Chinese-owned copper mine in Zambia is now threatening to kill ties with Beijing"" | ""Emmanuel Matambo ... said the environmental catastrophe was certain to harm ties.""",,Kafue,copper,,Environmental || Environmental || Environmental || Environmental || Social || Governance,"Water Resources || Water Resources || Water Resources || Biodiversity & Ecosystems || Health, Safety & Well-being || Reputation & Social License","Acid mine drainage || Surface water pollution and quality degradation || Freshwater ecotoxicity (heavy metals, pH changes, sensitive species) || Impacts on aquatic ecosystems and life below water || Community exposure to dust, noise, pollution || Mining image and public perception"
https://www.thecooldown.com/outdoors/zambia-acid-spill-kafue-river-contaminated/,20250325,Government issues warning after millions of liters of acid are spilled into major waterway: 'Disaster',live_ok_trafilatura,0.95,0.95,0.9,"Water Resources | Surface water pollution and quality degradation | Surface water pollution and quality degradation -> ""investigators from the Engineering Institution of Zambia determined that an acid spill at a Chinese-owned copper mine on Feb. 18 caused around 50 million liters of waste ""containing concentrated acid, dissolved solids and heavy metals"" to flow into a stream that is connected to the Kafue River"" | ""dead fish washed ashore and signs of pollution were found at least 60 miles downstream from the site of the acid spill."" || Water Resources | Freshwater ecotoxicity (heavy metals, pH changes, sensitive species) | Freshwater ecotoxicity (heavy metals, pH changes, sensitive species) -> ""caused around 50 million liters of waste ""containing concentrated acid, dissolved solids and heavy metals"" to flow into a stream that is connected to the Kafue River"" | ""fish died and birdlife near him disappeared almost immediately after the acid spill."" || Water Resources | Groundwater contamination | Groundwater contamination -> ""authorities who now fear that the mining waste can seep into the earth or be carried to other areas."" || Biodiversity & Ecosystems | Impacts on aquatic ecosystems and life below water | Impacts on aquatic ecosystems and life below water -> ""dead fish washed ashore and signs of pollution were found at least 60 miles downstream from the site of the acid spill."" | """"Prior to the 18th of February this was a vibrant and alive river,"" Cornelius said. ""Now everything is dead, it's like a totally dead river. Unbelievable. Overnight, this river died."""" || Biodiversity & Ecosystems | Impacts on terrestrial ecotoxicity | Impacts on terrestrial ecotoxicity -> ""the acid spill also had a major environmental impact and caused deaths among marine wildlife as well as the destruction of crops along the river's banks."" || Social | Health, Safety & Well-being | Community exposure to dust, noise, pollution -> ""The river provides drinking water for around five million people"" | ""the water supply has already been completely shut down due to the acid leak from the copper mine run by Sino-Metals Leach Zambia"" || Social | Livelihoods & Economy | Income generation and poverty reduction or exacerbation -> ""In addition to affecting the livelihood of residents who depend on the Kafue River, the acid spill also had a major environmental impact"" | ""The river provides drinking water for around five million people and is a vital source for fishing, irrigation for agriculture and water for industry."" || Social | Living Conditions & Social Fabric | Livability (cost of living, food security, communication services) -> ""In the city of Kitwe, which is home to an estimated 700,000 people, the water supply has already been completely shut down due to the acid leak from the copper mine run by Sino-Metals Leach Zambia"" | ""The river provides drinking water for around five million people"" || Governance | Transparency & Accountability | Accountability for accidents and environmental damage -> ""a government spokesperson made it clear that Sino-Metals Leach Zambia would be on the hook to fund the cleanup operation, and chairman Zhang Peiwen met with government officials to apologize for the acid spill."" || Governance | Risk Management & Long-Term Stewardship | Long-term liability management (pollution, water treatment, land stability) -> ""a government spokesperson made it clear that Sino-Metals Leach Zambia would be on the hook to fund the cleanup operation"" | ""the company ""will go all out to restore the affected environment as quickly as possible.""""",,Kitwe,copper,Sino-Metals Leach Zambia,Water Resources || Water Resources || Water Resources || Biodiversity & Ecosystems || Biodiversity & Ecosystems || Social || Social || Social || Governance || Governance,"Surface water pollution and quality degradation || Freshwater ecotoxicity (heavy metals, pH changes, sensitive species) || Groundwater contamination || Impacts on aquatic ecosystems and life below water || Impacts on terrestrial ecotoxicity || Health, Safety & Well-being || Livelihoods & Economy || Living Conditions & Social Fabric || Transparency & Accountability || Risk Management & Long-Term Stewardship","Surface water pollution and quality degradation || Freshwater ecotoxicity (heavy metals, pH changes, sensitive species) || Groundwater contamination || Impacts on aquatic ecosystems and life below water || Impacts on terrestrial ecotoxicity || Community exposure to dust, noise, pollution || Income generation and poverty reduction or exacerbation || Livability (cost of living, food security, communication services) || Accountability for accidents and environmental damage || Long-term liability management (pollution, water treatment, land stability)"
