sourceurl,sqldate,title,scrape_status,in_zambia_confidence,mining_related_confidence,impact_confidence,impact_evidence,mine_name,region,mineral_type,mining_company,impact_level1,impact_level2,impact_level3
https://2paragraphs.com/2025/03/china-invests-1-4-billion-in-african-railway-rival-of-us-backed-railway/,20250320,China Invests $1.4 Billion in African Railway — Rival of US-Backed Railway,live_ok_trafilatura,0.95,0.95,0.8,"Social | Livelihoods & Economy | Business opportunities (local supply chains, services) -> ""a key route for exports including copper and minerals from central Africa."" | ""According to TAZARA Authority CEO Bruno Ching'andu, $1 billion of CCECC's investment will go towards rehabilitating the tracks, while $400 million will be spent on 32 new locomotives and 762 new wagons to boost capacity."" | ""It is poised to catalyze the much-needed revitalization of our infrastructure and rolling stock, positioning TAZARA to achieve its full potential.""",,Kitwe,copper,,Social,Livelihoods & Economy,"Business opportunities (local supply chains, services)"
https://chinadigitaltimes.net/2025/03/chinese-companys-acid-spill-pollutes-zambian-river-threatening-millions-of-local-residents/,20250325,"Chinese Company's Acid Spill Pollutes Zambian River, Threatening Millions of Local Residents",live_ok_trafilatura,1.0,1.0,0.9,"Environmental | Water Resources | Acid mine drainage -> ""An acidic waste spill by a Chinese company in Zambia has created a massive environmental crisis that threatens a river on which millions of Zambians rely."" | ""The spill happened on Feb. 18 when a tailings dam that holds acidic waste from a copper mine in the north of the country collapsed, according to investigators from the Engineering Institution of Zambia."" || Environmental | Water Resources | Surface water pollution and quality degradation -> ""The collapse allowed some 50 million liters of waste containing concentrated acid, dissolved solids and heavy metals to flow into a stream that links to the Kafue River, Zambia's most important waterway, the engineering institution said."" | ""Chinese Company's Acid Spill Pollutes Zambian River, Threatening Millions of Local Residents"" || Environmental | Water Resources | Groundwater contamination -> ""Zambia's Ministry of Water Development and Sanitation also feared its ""devastating consequences,"" including the contamination of groundwater that would poison crops."" || Environmental | Water Resources | Freshwater ecotoxicity (heavy metals, pH changes, sensitive species) -> ""The collapse allowed some 50 million liters of waste containing concentrated acid, dissolved solids and heavy metals to flow into a stream that links to the Kafue River, Zambia's most important waterway, the engineering institution said."" | ""The AP reported that dead fish washed up on the banks of the Kafue River 100 kilometers downstream from the mine."" || Environmental | Biodiversity & Ecosystems | Impacts on aquatic ecosystems and life below water -> ""The AP reported that dead fish washed up on the banks of the Kafue River 100 kilometers downstream from the mine."" | ""Zambian environmental activist Chilekwa Mumba said, ""It is an environmental disaster really of catastrophic consequences."""" || Social | Health, Safety & Well-being | Community exposure to dust, noise, pollution -> ""An acidic waste spill by a Chinese company in Zambia has created a massive environmental crisis that threatens a river on which millions of Zambians rely."" | ""Zambian President Hakainde Hichilema called for help from experts and called the leak ""a crisis that threatens people and wildlife along the Kafue."""" || Social | Health, Safety & Well-being | Accidents and fatalities (including structural failures such as tailings dams) -> ""The spill happened on Feb. 18 when a tailings dam that holds acidic waste from a copper mine in the north of the country collapsed, according to investigators from the Engineering Institution of Zambia."" | ""Local police said a mine worker died at that second mine after falling into acid and alleged that the mine continued to operate after being instructed to stop its operations by authorities."" || Social | Livelihoods & Economy | Income generation and poverty reduction or exacerbation -> ""About 60% of Zambia's 20 million people live in the Kafue River basin and depend on it in some way as a source of fishing, irrigation for agriculture and water for industry."" | ""The river supplies drinking water to about five million people, including in the capital, Lusaka."" || Governance | Risk Management & Long-Term Stewardship | Tailings and waste governance -> ""The spill happened on Feb. 18 when a tailings dam that holds acidic waste from a copper mine in the north of the country collapsed, according to investigators from the Engineering Institution of Zambia."" || Governance | Regulation, Compliance & Institutions | Enforcement of environmental and social regulations -> ""Zambian authorities shut down operations at the two Chinese mines where leaks had occurred."" | ""Two Chinese mine managers have been arrested, police said."" || Governance | Transparency & Accountability | Monitoring and disclosure of environmental and social performance -> ""None of those articles mentioned the acid waste spill in Zambia's Kafue River."" || Governance | Reputation & Social License | Social license to operate -> """"The acidic waste spill into the Kafue River will set back Zambia-China relations in a very damaging way,"" Matambo said."" | """"While [concern about environmental hazards associated with Chinese investment in African mining] had died down around the 2010s, the Kafue spillage will revive it, and will shine a very unflattering light on Chinese investment in Zambia,"" he said."" || Governance | Stakeholder Engagement & Rights | Conflict management between companies and communities -> ""Tension between Zambians and Chinese mining companies is not new. In 2010, Chinese managers of a mining company shot 11 Zambian workers who protested poor working conditions."" | ""Two years later, after alleging that their employer failed to pay them, workers at that same mine killed one Chinese manager and injured two others.""",,Kafue River basin,copper,Sino-Metals Leach Zambia,Environmental || Environmental || Environmental || Environmental || Environmental || Social || Social || Social || Governance || Governance || Governance || Governance || Governance,"Water Resources || Water Resources || Water Resources || Water Resources || Biodiversity & Ecosystems || Health, Safety & Well-being || Health, Safety & Well-being || Livelihoods & Economy || Risk Management & Long-Term Stewardship || Regulation, Compliance & Institutions || Transparency & Accountability || Reputation & Social License || Stakeholder Engagement & Rights","Acid mine drainage || Surface water pollution and quality degradation || Groundwater contamination || Freshwater ecotoxicity (heavy metals, pH changes, sensitive species) || Impacts on aquatic ecosystems and life below water || Community exposure to dust, noise, pollution || Accidents and fatalities (including structural failures such as tailings dams) || Income generation and poverty reduction or exacerbation || Tailings and waste governance || Enforcement of environmental and social regulations || Monitoring and disclosure of environmental and social performance || Social license to operate || Conflict management between companies and communities"
https://dailycaller.com/2025/03/20/chinese-company-sino-metals-leach-acidic-effluent-spill-kafue-river-zambia-emergency/,20250320,"China Kills A River In Foreign Country With Acidic Waste Spill, Leaving Millions In Emergency | The Daily Caller",live_ok_trafilatura,0.99,0.99,0.9,"Environmental | Land, Soil & Geology | Tailings generation and management -> ""A tailings dam — a large embankment dam that stores mining waste — owned by Sino-Metals Leach Zambia failed Feb. 18, spilling ""acidic effluent with high heavy metal content"" and leach residue from copper extraction into a tributary of the Kafue River, Zambia's Minister of Water Development and Sanitation Collins Nzovu told the country's Senate."" || Environmental | Water Resources | Acid mine drainage -> ""A massive acid leak from a Chinese-owned mine in Zambia contaminated the country's most important waterway, threatening the livelihood and health of more than half the country's population and forcing the Chinese company to apologize, according to reports."" | ""spilling ""acidic effluent with high heavy metal content"" and leach residue from copper extraction into a tributary of the Kafue River"" || Environmental | Water Resources | Surface water pollution and quality degradation -> ""contaminated the country's most important waterway"" | ""They also shut down the mine, ordered immediate repairs to stem the spill, and began a mass education campaign against public consumption of the contaminated water and dead fish from the river, he added."" || Environmental | Water Resources | Freshwater ecotoxicity (heavy metals, pH changes, sensitive species) -> ""spilling ""acidic effluent with high heavy metal content"""" | ""The tributary reached the acidity level of a concentrated acid"" | ""fish died and birds disappeared."" || Environmental | Biodiversity & Ecosystems | Impacts on aquatic ecosystems and life below water -> """"Prior to the 18th of February this was a vibrant and alive river,"" Sean Cornelius, who lives near the river, told the AP, adding that fish died and birds disappeared. ""Now everything is dead, it's like a totally dead river. Unbelievable. Overnight, this river died."""" || Environmental | Biodiversity & Ecosystems | Loss of ecosystem services -> ""Some 12,000,000-odd Zambians — about 60% of the country's population — live in the Kafue River basin, with the river providing potable water and sustaining fishing, farming, and industrial activities, the AP noted."" || Social | Health, Safety & Well-being | Community exposure to dust, noise, pollution -> ""threatening the livelihood and health of more than half the country's population"" | ""began a mass education campaign against public consumption of the contaminated water and dead fish from the river"" || Social | Health, Safety & Well-being | Accidents and fatalities (including structural failures such as tailings dams) -> ""A tailings dam — a large embankment dam that stores mining waste — owned by Sino-Metals Leach Zambia failed Feb. 18"" || Social | Livelihoods & Economy | Income generation and poverty reduction or exacerbation -> ""threatening the livelihood and health of more than half the country's population"" | ""the river providing potable water and sustaining fishing, farming, and industrial activities"" || Social | Living Conditions & Social Fabric | Livability (cost of living, food security, communication services) -> ""They also shut down the mine, ordered immediate repairs to stem the spill, and began a mass education campaign against public consumption of the contaminated water and dead fish from the river, he added."" | ""Some 12,000,000-odd Zambians — about 60% of the country's population — live in the Kafue River basin, with the river providing potable water and sustaining fishing, farming, and industrial activities, the AP noted."" || Governance | Regulation, Compliance & Institutions | Enforcement of environmental and social regulations -> ""They also shut down the mine, ordered immediate repairs to stem the spill"" | ""Environmental pollution could attract a fine of 280,000 Zambian kwacha (more than 9700 U.S. dollars) with the possibility of jail time, according to the country's Environmental Management Act, Nzovu told the Senate."" || Governance | Risk Management & Long-Term Stewardship | Tailings and waste governance -> ""A tailings dam — a large embankment dam that stores mining waste — owned by Sino-Metals Leach Zambia failed Feb. 18, spilling ""acidic effluent with high heavy metal content"" and leach residue from copper extraction into a tributary of the Kafue River"" | """"Sino Metals should not just end at taking responsibility for what has happened, but should ensure that the pollution is thoroughly cleaned up and the affected people are properly compensated,"" Nzovu said in a separate statement."" || Governance | Transparency & Accountability | Accountability for accidents and environmental damage -> ""Zhang Peiwen, Sino Metals' Chairman, apologized at a press conference to President Hichilema and all affected Zambians, according to the Zambian National Broadcasting Corporation."" | """"Sino Metals should not just end at taking responsibility for what has happened, but should ensure that the pollution is thoroughly cleaned up and the affected people are properly compensated,"" Nzovu said in a separate statement."" || Governance | Reputation & Social License | Mining image and public perception -> ""The situation reportedly incensed many Zambians, who were already disgruntled by reports of Chinese companies' disregard for Zambian safety and labor laws.""",,Copperbelt Province,copper,Sino-Metals Leach Zambia,Environmental || Environmental || Environmental || Environmental || Environmental || Environmental || Social || Social || Social || Social || Governance || Governance || Governance || Governance,"Land, Soil & Geology || Water Resources || Water Resources || Water Resources || Biodiversity & Ecosystems || Biodiversity & Ecosystems || Health, Safety & Well-being || Health, Safety & Well-being || Livelihoods & Economy || Living Conditions & Social Fabric || Regulation, Compliance & Institutions || Risk Management & Long-Term Stewardship || Transparency & Accountability || Reputation & Social License","Tailings generation and management || Acid mine drainage || Surface water pollution and quality degradation || Freshwater ecotoxicity (heavy metals, pH changes, sensitive species) || Impacts on aquatic ecosystems and life below water || Loss of ecosystem services || Community exposure to dust, noise, pollution || Accidents and fatalities (including structural failures such as tailings dams) || Income generation and poverty reduction or exacerbation || Livability (cost of living, food security, communication services) || Enforcement of environmental and social regulations || Tailings and waste governance || Accountability for accidents and environmental damage || Mining image and public perception"
https://energycapitalandpower.africa-newsroom.com/press/zambia-bolsters-copper-exploration-ahead-of-2031-target,20250402,Energy Capital & Power / Press release | Zambia Bolsters Copper Exploration Ahead of 2031 Target,live_ok_trafilatura,0.95,0.95,0.8,"Governance | Regulation, Compliance & Institutions | Mining permitting and licensing practices -> ""the country announced a non-compliance monitoring project, which led to the repossession of over 1,000 mining licenses"" | ""These licenses are now being reallocated to new investors to accelerate exploration efforts and help achieve its 2031 production goal."" | ""Zambia has also recorded a 79% increase in mining licenses granted in 2024 compared to 2023, according to the Ministry of Mines and Minerals Development."" || Governance | Regulation, Compliance & Institutions | Legislative and regulatory framework effectiveness -> ""Zambia has launched a series of strategic initiatives in 2025 to accelerate copper drilling ... the country introduced the Zambia Integrated Mining Information System (www.MMMD.Gov.zm), a digital platform designed to enhance efficiency and transparency in mining license management."" || Social | Livelihoods & Economy | Business opportunities (local supply chains, services) -> ""reopening previously inactive mining operations, including Mopani and Konkola Copper Mines, unlocking new opportunities for exploration."" | ""the system is expected to streamline the approval process and help Zambia attract more investors and fast-track exploration."" || Social | Livelihoods & Economy | Human capital development (skills, training, workforce development) -> ""On January 16, 2025, the country signed a cooperation agreement with Saudi Arabia to facilitate human capital development, technology transfer and investments in copper exploration and production.""",Lumwana; Mopani; Konkola Copper Mines,northern Zambia,copper,Barrick Gold; Jubilee Metals Group; Handa Resources; Arc Minerals; Anglo American,Governance || Governance || Social || Social,"Regulation, Compliance & Institutions || Regulation, Compliance & Institutions || Livelihoods & Economy || Livelihoods & Economy","Mining permitting and licensing practices || Legislative and regulatory framework effectiveness || Business opportunities (local supply chains, services) || Human capital development (skills, training, workforce development)"
https://finance.yahoo.com/news/ivanhoe-mines-commences-giant-copper-105700226.html,20250402,Ivanhoe Mines Commences Giant Copper Exploration Program in Zambia,live_ok_trafilatura,0.99,0.99,0.9,"Social | Livelihoods & Economy | Employment creation and job security -> """"This new investment in copper exploration is not only about achieving our government's vision of over 3 million tonnes of copper production by 2031, it's also about unlocking opportunities, empowering communities, and ensuring that our resources benefit every Zambian."""" | """"Today, we welcome Ivanhoe Mines' new chapter into Zambia's mining industry -one that promises jobs, growth, and prosperity for our people."""" || Social | Livelihoods & Economy | Income generation and poverty reduction or exacerbation -> """"Today, we welcome Ivanhoe Mines' new chapter into Zambia's mining industry -one that promises jobs, growth, and prosperity for our people."""" | """"unlocking opportunities, empowering communities, and ensuring that our resources benefit every Zambian."""" || Social | Livelihoods & Economy | Business opportunities (local supply chains, services) -> """"Ivanhoe Mines looks forward to contributing to Zambia's economic development, supporting local communities, and furthering our goal of finding the world's next major copper deposits."""" || Governance | Regulation, Compliance & Institutions | Mining permitting and licensing practices -> """"Ivanhoe will appoint environmental consultants in the second quarter of 2025 to complete key environmental baseline studies and produce an Environmental Management Plan (EMP) for approval by the Zambia Environmental Management Agency (ZEMA)."""" || Governance | Stakeholder Engagement & Rights | Community consent and consultation (FPIC – Free, Prior and Informed Consent) -> """"Initial engagements with local communities will also be undertaken prior to the mobilization of field teams for ground surveys and drilling in the second half of the year."""" || Governance | Reputation & Social License | Trust between mining companies, government, and communities -> """"we are particularly encouraged by the proactive support and collaborative approach demonstrated by the Zambian government, underscoring the country's commitment to fostering a stable and investor-friendly mining environment.""""",,North-Western Province,copper,Ivanhoe Mines,Social || Social || Social || Governance || Governance || Governance,"Livelihoods & Economy || Livelihoods & Economy || Livelihoods & Economy || Regulation, Compliance & Institutions || Stakeholder Engagement & Rights || Reputation & Social License","Employment creation and job security || Income generation and poverty reduction or exacerbation || Business opportunities (local supply chains, services) || Mining permitting and licensing practices || Community consent and consultation (FPIC – Free, Prior and Informed Consent) || Trust between mining companies, government, and communities"
https://foreignpolicy.com/2025/03/18/china-zambia-copper-acid-spill-kafue-river/?tpcc=recirc_trending062921,20250222,China Faces PR Challenge in Zambia – Foreign Policy,live_ok_trafilatura,0.95,0.95,0.9,"Environmental | Water Resources | Surface water pollution and quality degradation -> ""An acidic waste spill from a Chinese-owned copper mine has contaminated the country's most important waterway."" | ""A massive acid spill at a Chinese-run mine in Zambia last month has contaminated the Kafue River, the country's most important waterway."" | ""The damage from 50 million liters of acidic waste is visible far downstream, with devastating effects."" || Environmental | Water Resources | Freshwater ecotoxicity (heavy metals, pH changes, sensitive species) -> ""An acidic waste spill from a Chinese-owned copper mine has contaminated the country's most important waterway."" | ""The damage from 50 million liters of acidic waste is visible far downstream, with devastating effects."" | ""Copper has long been a dirty industry; mercury and lead often leak from mines, leading soil to acidify."" || Social | Health, Safety & Well-being | Community exposure to dust, noise, pollution -> ""Roughly 60 percent of Zambians depend on the Kafue; the water supply to 700,000 people in the city of Kitwe was cut off shortly after the spill—though it was later partially restored."" | ""An acidic waste spill from a Chinese-owned copper mine has contaminated the country's most important waterway."" | ""Anglo American South Africa Ltd., which operated a copper mine in Zambia from 1925 to 1974, faces a class-action lawsuit over as many as 140,000 cases of lead poisoning in neighboring communities."" || Governance | Regulation, Compliance & Institutions | Enforcement of environmental and social regulations -> ""In Zambia, an environmental bill that was being held up by mining interests is likely to move forward, and the Zambian government has begun to halt production elsewhere."" || Governance | Reputation & Social License | Mining image and public perception -> ""The Kafue River disaster, however, is likely to become a new rallying point for anti-Chinese sentiment not only in Zambia, but also throughout Africa."" | ""China's investments in Zambia have made it both an ally to the country's leaders and a popular target for the opposition, with politicians often flip flopping once they take power."" || Governance | Reputation & Social License | Social license to operate -> ""The Kafue River disaster, however, is likely to become a new rallying point for anti-Chinese sentiment not only in Zambia, but also throughout Africa."" | ""Early investments saw clashes with miners over unfair pay and conditions. In 2018, there were riots in Kitwe, Zambia, against Chinese businesses, reflecting growing anti-China sentiment.""",,Kitwe,copper,,Environmental || Environmental || Social || Governance || Governance || Governance,"Water Resources || Water Resources || Health, Safety & Well-being || Regulation, Compliance & Institutions || Reputation & Social License || Reputation & Social License","Surface water pollution and quality degradation || Freshwater ecotoxicity (heavy metals, pH changes, sensitive species) || Community exposure to dust, noise, pollution || Enforcement of environmental and social regulations || Mining image and public perception || Social license to operate"
https://taxjustice.net/2025/03/31/strengthening-africas-tax-governance-reflections-on-the-lusaka-country-by-country-reporting-workshop/,20250331,Strengthening Africa's tax governance: reflections on the Lusaka country by country reporting workshop - Tax Justice Network,live_ok_trafilatura,0.95,0.9,0.7,"Governance | Transparency & Accountability | Corporate transparency and reporting -> ""By requiring large multinational enterprises to disclose financial data across jurisdictions, country by country reporting provides tax authorities with detailed insights into multinational enterprises' global corporate activities, enabling better detection of profit shifting and cross-border tax abuse."" | ""This was followed by case studies from the extractive industries, assessing the risks posed by corporate structures in high-risk sectors such as oil and mining."" | ""Recognising the importance of equipping tax officials with the necessary technical skills to use the country by country reporting data effectively, a workshop on its application in risk assessment and profit shifting detection was held from 4–6 March 2025 in Lusaka, Zambia."" || Governance | Regulation, Compliance & Institutions | Compliance with national and international standards -> ""Moreover, implementing the proposal requires robust technical expertise and access to corporate tax data, such as the country by country reporting, to ensure compliance."" | ""Discussions covered withholding taxes, thin capitalisation rules, and the challenges of applying transfer pricing controls in the absence of comparable data, especially in the extractive sector in Africa."" | ""Ghana, Zambia, and Tanzania shared their experiences and best practices for tackling cross-border tax abuse.""",,Lusaka,oil and mining,,Governance || Governance,"Transparency & Accountability || Regulation, Compliance & Institutions",Corporate transparency and reporting || Compliance with national and international standards
