sourceurl,sqldate,title,scrape_status,in_zambia_confidence,mining_related_confidence,impact_confidence,impact_evidence,mine_name,region,mineral_type,mining_company,impact_level1,impact_level2,impact_level3
http://en.people.cn/n3/2023/0801/c90000-20052522.html,20230801,"Tanzania-Zambia Railway: a railway of friendship, prosperity - People's Daily Online",live_ok_trafilatura,0.98,0.9,0.85,"Social | Livelihoods & Economy | Income generation and poverty reduction or exacerbation -> ""For Zambia, a landlocked country, building a railway leading to the port of Dar es Salaam, Tanzaniaâs biggest city, would help it expand its copper exports and enlarge its source of income."" | ""Juma, a retired engineer of TAZARA, called the Tanzania-Zambia Railway an economic corridor that helps his people get rid of poverty.""",,Kapiri Mposhi,copper,,Social,Livelihoods & Economy,Income generation and poverty reduction or exacerbation
https://en.haberler.com/uk-announces-3-8b-fund-to-support-to-zambia-s-1861268/,20230803,"UK Announces $3.8B Fund To Support To Zambia's Green Energy, Mining Industries",live_ok_trafilatura,1.0,1.0,0.9,"Social | Livelihoods & Economy | Employment creation and job security -> ""aims to drive investment in Zambia's green economy, strengthen economic partnerships, tackle climate change, and create jobs and business opportunities in both countries."" | ""creating jobs in both countries and improving environmental and social standards,"" || Social | Livelihoods & Economy | Business opportunities (local supply chains, services) -> ""The new targets include generating up to £2.5 billion in British private sector investment in Zambia's mining, minerals, and renewable energy sectors, delivering up to £500 million in UK government-backed investments, and mobilizing up to £150 million in private sector investment in small and medium-sized enterprises,"" | ""The commercial opportunities will benefit both UK and Zambian firms, thereby growing the economies of both countries, he added.""",,Lusaka,"copper, cobalt",,Social || Social,Livelihoods & Economy || Livelihoods & Economy,"Employment creation and job security || Business opportunities (local supply chains, services)"
https://jerseyeveningpost.com/morenews/uknews/2023/08/03/uk-and-zambia-strengthen-green-partnership-with-new-investment-targets/,20230802,UK and Zambia strengthen green partnership with new investment targets - Jersey Evening Post,live_ok_trafilatura,0.95,0.95,0.9,"Social | Livelihoods & Economy | Employment creation and job security -> """"The UK-Zambia Green Growth Compact and our landmark agreement on critical minerals will support investment between UK and Zambian business, creating jobs in both countries, and improving environmental and social standards."""" || Social | Livelihoods & Economy | Business opportunities (local supply chains, services) -> ""The partnership will also aim to mobilise up to £150 million of private sector investment into small to medium-sized enterprises (SMEs)."" | ""The new targets will be delivered through the UK-Zambia Green Growth Compact, which was signed in 2021 and has already seen more than £78 million mobilised for Zambian SMEs."" || Governance | Regulation, Compliance & Institutions | Compliance with national and international standards -> """"The UK-Zambia Green Growth Compact and our landmark agreement on critical minerals will support investment between UK and Zambian business, creating jobs in both countries, and improving environmental and social standards.""""",,,critical minerals,,Social || Social || Governance,"Livelihoods & Economy || Livelihoods & Economy || Regulation, Compliance & Institutions","Employment creation and job security || Business opportunities (local supply chains, services) || Compliance with national and international standards"
https://www.alwihdainfo.com/Tanzania-Zambia-Railway-a-railway-of-friendship-prosperity_a125253.html,20230802,"Tanzania-Zambia Railway: a railway of friendship, prosperity",live_ok_trafilatura,0.95,0.9,0.85,"Social | Livelihoods & Economy | Income generation and poverty reduction or exacerbation -> ""building a railway leading to the port of Dar es Salaam, its biggest city, would help it expand its copper exports and enlarge its source of income."" | ""Juma, a retired engineer of TAZARA, called the Tanzania-Zambia Railway an economic corridor that helps his people get rid of poverty."" || Social | Livelihoods & Economy | Employment creation and job security -> ""helping the African country enhance its transport capacity and creating massive jobs for local communities."" | ""China offered interest-free loans for the two countries, and dispatched over 50,000 engineers and technicians to Africa to assist the building of the railway."" || Social | Livelihoods & Economy | Business opportunities (local supply chains, services) -> ""building a railway leading to the port of Dar es Salaam, its biggest city, would help it expand its copper exports and enlarge its source of income."" | ""The Tanzania-Zambia Railway has tremendously reduced the shipping time and cost, and also improved customer satisfaction."" || Social | Livelihoods & Economy | Human capital development (skills, training, workforce development) -> ""The retired engineer studied railway engineering in China twice. He said the railway changed his life, turning him from a farmer's son to a respected engineer."" | ""China ... dispatched over 50,000 engineers and technicians to Africa to assist the building of the railway.""",,Kapiri Mposhi,copper,,Social || Social || Social || Social,Livelihoods & Economy || Livelihoods & Economy || Livelihoods & Economy || Livelihoods & Economy,"Income generation and poverty reduction or exacerbation || Employment creation and job security || Business opportunities (local supply chains, services) || Human capital development (skills, training, workforce development)"
https://www.cnbcafrica.com/2023/britain-agrees-deals-on-clean-energy-critical-minerals-with-zambia/,20230803,"Britain agrees deals on clean energy, critical minerals with Zambia - CNBC Africa",live_ok_trafilatura,0.95,0.95,0.9,"Social | Livelihoods & Economy | Employment creation and job security -> """"The UK-Zambia Green Growth Compact and our landmark agreement on critical minerals will support investment between UK and Zambian business, creating jobs in both countries,"" Cleverly said."" || Social | Livelihoods & Economy | Business opportunities (local supply chains, services) -> ""The foreign ministry said Cleverly would agree a UK-Zambia Green Growth Compact, aimed at generating 2.5 billion pounds ($3.17 billion) of British private sector investment in Zambia's mining, minerals and renewable energy sectors alongside 500 million pounds of government-backed investments."" | """"The UK-Zambia Green Growth Compact and our landmark agreement on critical minerals will support investment between UK and Zambian business, creating jobs in both countries,"" Cleverly said."" || Environmental | Air & Climate | Clean/renewable energy integration (mitigation-related impact) -> ""The foreign ministry said Cleverly would agree a UK-Zambia Green Growth Compact, aimed at generating 2.5 billion pounds ($3.17 billion) of British private sector investment in Zambia's mining, minerals and renewable energy sectors alongside 500 million pounds of government-backed investments."" || Governance | Regulation, Compliance & Institutions | Compliance with national and international standards -> ""Cleverly will visit a copper mine in Zambia and sign a memorandum of understanding (MoU) on critical minerals, which Britain said would ""lay the foundation for further UK support for the responsible mining of copper, cobalt and other metals essential to the global clean energy transition.""""",,,copper,,Social || Social || Environmental || Governance,"Livelihoods & Economy || Livelihoods & Economy || Air & Climate || Regulation, Compliance & Institutions","Employment creation and job security || Business opportunities (local supply chains, services) || Clean/renewable energy integration (mitigation-related impact) || Compliance with national and international standards"
https://www.faceofmalawi.com/2023/08/01/angry-mob-attacks-minister-in-zambia/,20230801,Angry mob attacks Minister in Zambia – Face of Malawi,live_ok_trafilatura,0.99,0.98,0.85,"Social | Equity, Rights & Vulnerable Groups | Crime and social disorder (corruption, violence, substance abuse) -> ""An angry mob of youths led by Sub-Chief Kunda Mfumu ambushed a team led by Minister of Green Economy and Environment, Collins Nzovu, on suspicion of!llegally mining Sug!lite."" || Governance | Regulation, Compliance & Institutions | Enforcement of environmental and social regulations -> ""The team had just concluded inspections at Muombe mine in Chembe district, Luapula province, where Sug!lite was being !llegally mined."" | ""The Minister was accompanied by Luapula Province Permanent Secretary, Mighty Mumba and officers from the Zambia Environmental Management Authority (ZEMA)."" | ""Currently, no mining operations are taking place at the site, as it is heavily guarded by state security.""",Muombe mine,"Chembe district, Luapula province",Sug!lite,,Social || Governance,"Equity, Rights & Vulnerable Groups || Regulation, Compliance & Institutions","Crime and social disorder (corruption, violence, substance abuse) || Enforcement of environmental and social regulations"
https://www.herald.co.zw/zim-firms-seek-to-grow-market-at-zambia-agric-show/,20230801,,wayback_ok,0.95,0.8,0.8,"Social | Livelihoods & Economy | Business opportunities (local supply chains, services) -> ""we will engage with buyers from leading mines and other industries, who have already expressed interest to source from Zimbabwe,"" | ""expand beyond the capital, into the Copperbelt region where there are a lot of opportunities around the mining activities.""",,Copperbelt region,,,Social,Livelihoods & Economy,"Business opportunities (local supply chains, services)"
https://www.impartialreporter.com/news/national/23697698.uk-zambia-strengthen-green-partnership-new-investment-targets/,20230803,UK and Zambia strengthen green partnership with new investment targets | Impartial Reporter,live_ok_trafilatura,0.98,0.98,0.85,"Social | Livelihoods & Economy | Employment creation and job security -> ""support investment between UK and Zambian business, creating jobs in both countries, and improving environmental and social standards."" || Social | Livelihoods & Economy | Business opportunities (local supply chains, services) -> ""aim to mobilise up to",,,"copper, cobalt",,Social || Social || Governance,"Livelihoods & Economy || Livelihoods & Economy || Regulation, Compliance & Institutions","Employment creation and job security || Business opportunities (local supply chains, services) || Compliance with national and international standards"
https://www.independent.co.uk/news/uk/james-cleverly-zambia-african-nigeria-ghana-b2386699.html,20230803,UK and Zambia strengthen green partnership with new investment targets | The Independent,live_ok_trafilatura,0.99,0.95,0.9,"Social | Livelihoods & Economy | Employment creation and job security -> """"The UK-Zambia Green Growth Compact and our landmark agreement on critical minerals will support investment between UK and Zambian business, creating jobs in both countries, and improving environmental and social standards."""" || Social | Livelihoods & Economy | Business opportunities (local supply chains, services) -> """"The UK-Zambia Green Growth Compact and our landmark agreement on critical minerals will support investment between UK and Zambian business, creating jobs in both countries, and improving environmental and social standards."""" || Governance | Regulation, Compliance & Institutions | Enforcement of environmental and social regulations -> """"The UK-Zambia Green Growth Compact and our landmark agreement on critical minerals will support investment between UK and Zambian business, creating jobs in both countries, and improving environmental and social standards.""""",,,"copper, cobalt",,Social || Social || Governance,"Livelihoods & Economy || Livelihoods & Economy || Regulation, Compliance & Institutions","Employment creation and job security || Business opportunities (local supply chains, services) || Enforcement of environmental and social regulations"
https://www.irishnews.com/news/uknews/2023/08/02/news/uk_and_zambia_strengthen_green_partnership_with_new_investment_targets-3494501/,20230803,UK and Zambia strengthen green partnership with new investment targets – The Irish News,live_ok_trafilatura,0.95,0.95,0.8,"Social | Livelihoods & Economy | Employment creation and job security -> ""support investment between UK and Zambian business, creating jobs in both countries, and improving environmental and social standards."" | ""creating jobs in both countries"" || Social | Livelihoods & Economy | Business opportunities (local supply chains, services) -> ""mobilise up to",,,"copper, cobalt",,Social || Social || Governance || Environmental,"Livelihoods & Economy || Livelihoods & Economy || Regulation, Compliance & Institutions || Air & Climate","Employment creation and job security || Business opportunities (local supply chains, services) || Compliance with national and international standards || Clean/renewable energy integration (mitigation-related impact)"
https://www.lusakatimes.com/2023/07/28/first-quantum-minerals-fqm-hands-over-bwana-mkubwa-mine-land-in-ndola/,20230728,Zambia : First Quantum Minerals (FQM) hands over Bwana Mkubwa Mine land in Ndola,live_ok_trafilatura,1.0,1.0,0.9,"Environmental | Land, Soil & Geology | Land disturbance and land-use change -> ""The land handover comes as part of FQM's exit plan following the closure of its Bwana Mkubwa mine site, where it had been conducting mining activities since the 1990s."" | ""Minister Matambo highlighted the importance of prioritizing the well-being of the people as FQM surrendered its land to the government and Chiwala Chiefdom."" || Social | Equity, Rights & Vulnerable Groups | Land ownership impacts and regional value changes -> ""First Quantum Minerals Limited (FQM) handed over approximately 517 hectares of land to various recipients, including the government, Chief Chiwala, the community, and its employees."" | ""Bwana Mkubwa Member of Parliament, Warren Mwambazi, expressed hope that the land handover would help resolve land wrangles in Munkulungwe Ward."" || Social | Living Conditions & Social Fabric | Cultural impacts (tangible and intangible heritage, traditions, identity) -> ""In addition to the land allocation, FQM Country Manager, Dr. Godwin Beene, emphasized that the company was also preserving certain heritage sites in the area, showing their commitment to environmental and cultural preservation."" || Governance | Regulation, Compliance & Institutions | Enforcement of environmental and social regulations -> ""Minister Muchima issued a stern warning against any illegal land allocation and stressed the need for proper land management."" | ""He emphasized that surveyors would analyze the land, and those engaging in unlawful activities could face serious consequences."" || Governance | Risk Management & Long-Term Stewardship | Closure planning and post-mining reclamation governance -> ""The land handover comes as part of FQM's exit plan following the closure of its Bwana Mkubwa mine site, where it had been conducting mining activities since the 1990s."" || Governance | Stakeholder Engagement & Rights | Stakeholder inclusion in decision-making -> ""First Quantum Minerals Limited (FQM) handed over approximately 517 hectares of land to various recipients, including the government, Chief Chiwala, the community, and its employees."" | ""Lands and Natural Resources Minister, Elijah Muchima, presided over the land handover ceremony in Munkulungwe Ward of Bwana Mkubwa Constituency.""",Bwana Mkubwa,Ndola,,First Quantum Minerals,Environmental || Social || Social || Governance || Governance || Governance,"Land, Soil & Geology || Equity, Rights & Vulnerable Groups || Living Conditions & Social Fabric || Regulation, Compliance & Institutions || Risk Management & Long-Term Stewardship || Stakeholder Engagement & Rights","Land disturbance and land-use change || Land ownership impacts and regional value changes || Cultural impacts (tangible and intangible heritage, traditions, identity) || Enforcement of environmental and social regulations || Closure planning and post-mining reclamation governance || Stakeholder inclusion in decision-making"
https://www.lusakatimes.com/2023/07/31/body-of-illegal-miner-still-missing-zimba/,20230731,Zambia : Body of illegal miner still missing-Zimba,live_ok_trafilatura,0.99,0.99,0.9,"Social | Health, Safety & Well-being | Accidents and fatalities (including structural failures such as tailings dams) -> ""Mwangala Mwakoi died in Mapatizya area on July 27 around 03:00 hours after being buried alive, following the collapse of a pit under which he was allegedly digging amethyst."" || Governance | Regulation, Compliance & Institutions | Mining permitting and licensing practices -> ""Mr. Banda says all those who want to engage in mining, need to formalize processes and ensure safety is upheld."" || Governance | Regulation, Compliance & Institutions | Enforcement of environmental and social regulations -> ""Southern Region Mines and Minerals Development Officer Dickson Banda, has called on people living in mining areas to desist from illegal mining activities.""",,"Mapatizya, Zimba District, Southern Region",amethyst,,Social || Governance || Governance,"Health, Safety & Well-being || Regulation, Compliance & Institutions || Regulation, Compliance & Institutions",Accidents and fatalities (including structural failures such as tailings dams) || Mining permitting and licensing practices || Enforcement of environmental and social regulations
https://www.lusakatimes.com/2023/08/01/ctpd-calls-for-the-inclusion-of-community-development-agreements-cdas-in-the-legal-frameworks/,20230802,Zambia : CTPD Calls for the Inclusion of Community Development Agreements (CDAs) in the Legal Frameworks,live_ok_trafilatura,0.95,0.9,0.85,"Environmental | Biodiversity & Ecosystems | Ecosystem degradation and habitat loss/fragmentation -> ""With the government encouraging investments in sectors such as mining and agriculture, there is a growing concern about the adverse effects on the environment and the livelihoods of communities living in the project areas."" | ""Large-Scale Land Investments (LSLBIs) have witnessed a surge in recent times, leading to issues like human rights violations, environmental degradation, and land alienation without adequate compensation."" || Social | Livelihoods & Economy | Income generation and poverty reduction or exacerbation -> ""With the government encouraging investments in sectors such as mining and agriculture, there is a growing concern about the adverse effects on the environment and the livelihoods of communities living in the project areas."" || Social | Equity, Rights & Vulnerable Groups | Land ownership impacts and regional value changes -> ""Large-Scale Land Investments (LSLBIs) have witnessed a surge in recent times, leading to issues like human rights violations, environmental degradation, and land alienation without adequate compensation."" || Social | Equity, Rights & Vulnerable Groups | Freedom and justice impacts in nearby communities -> ""Large-Scale Land Investments (LSLBIs) have witnessed a surge in recent times, leading to issues like human rights violations, environmental degradation, and land alienation without adequate compensation."" || Social | Equity, Rights & Vulnerable Groups | Wealth distribution and inequality -> ""CDAs offer an avenue for equitable revenue-sharing arrangements and provide a legal basis for communities to solidify their agreements with mineral rightsholders in the mining sector."" || Governance | Stakeholder Engagement & Rights | Community consent and consultation (FPIC – Free, Prior and Informed Consent) -> ""At present, several legal frameworks concerning LSLBIs lack clear mechanisms for community engagement or consensus-building. Companies often engage with impacted communities on a case-by-case basis, leading to inconsistent and non-binding arrangements that fail to provide adequate protection to local communities."" || Governance | Stakeholder Engagement & Rights | Stakeholder inclusion in decision-making -> ""By encouraging access to information and enabling community-defined development outcomes, CDAs empower local communities to have a say in the distribution of royalty payments, infrastructure development, and other social benefits contributed by investors."" || Governance | Regulation, Compliance & Institutions | Legislative and regulatory framework effectiveness -> ""The Centre for Trade Policy and Development (CTPD)... has issued a call to the government for the inclusion of Community Development Agreements (CDAs) in the legal frameworks."" | ""The CTPD urges the government to establish appropriate measures and mechanisms to ensure consistency, accountability, and responsibility in company practices."" || Social | Living Conditions & Social Fabric | Social infrastructure and amenities (education, healthcare, public services, leisure) -> ""By encouraging access to information and enabling community-defined development outcomes, CDAs empower local communities to have a say in the distribution of royalty payments, infrastructure development, and other social benefits contributed by investors.""",,,,,Environmental || Social || Social || Social || Social || Governance || Governance || Governance || Social,"Biodiversity & Ecosystems || Livelihoods & Economy || Equity, Rights & Vulnerable Groups || Equity, Rights & Vulnerable Groups || Equity, Rights & Vulnerable Groups || Stakeholder Engagement & Rights || Stakeholder Engagement & Rights || Regulation, Compliance & Institutions || Living Conditions & Social Fabric","Ecosystem degradation and habitat loss/fragmentation || Income generation and poverty reduction or exacerbation || Land ownership impacts and regional value changes || Freedom and justice impacts in nearby communities || Wealth distribution and inequality || Community consent and consultation (FPIC – Free, Prior and Informed Consent) || Stakeholder inclusion in decision-making || Legislative and regulatory framework effectiveness || Social infrastructure and amenities (education, healthcare, public services, leisure)"
https://www.lusakatimes.com/2023/08/01/negotiations-for-new-mopani-kcm-mine-owners-still-ongoing/,20230801,Zambia : Negotiations for new Mopani/KCM mine owners still ongoing,live_ok_trafilatura,0.95,0.95,0.8,"Governance | Regulation, Compliance & Institutions | Legislative and regulatory framework effectiveness -> ""government will continue to stiffen laws regarding the management of mines and minerals in the country to stop illegal mining activities."" || Governance | Regulation, Compliance & Institutions | Enforcement of environmental and social regulations -> ""his Ministry is coming up with the minerals Commission, which will act as a regulator for the minerals in the country."" || Social | Equity, Rights & Vulnerable Groups | Crime and social disorder (corruption, violence, substance abuse) -> ""his Ministry is tying all the loose-ends in a bid to manage the mineral resources which are illegally mined by a few unscrupulous individuals."" | ""government will continue to stiffen laws regarding the management of mines and minerals in the country to stop illegal mining activities.""",Mopani; KCM,,copper,,Governance || Governance || Social,"Regulation, Compliance & Institutions || Regulation, Compliance & Institutions || Equity, Rights & Vulnerable Groups","Legislative and regulatory framework effectiveness || Enforcement of environmental and social regulations || Crime and social disorder (corruption, violence, substance abuse)"
https://www.lusakatimes.com/2023/08/01/unresolved-mopani-kcm-negotiations-raises-concerns/,20230801,Zambia : Unresolved Mopani/KCM negotiations raises concerns,live_ok_trafilatura,1.0,1.0,0.85,"Social | Livelihoods & Economy | Income generation and poverty reduction or exacerbation -> ""the people on the Copperbelt are depressed economically and socially because of the poor performance of the two mines."" || Social | Living Conditions & Social Fabric | Livability (cost of living, food security, communication services) -> ""the people on the Copperbelt are depressed economically and socially because of the poor performance of the two mines.""",Mopani; Konkola Copper Mines,Copperbelt,copper,Mopani; Konkola Copper Mines,Social || Social,Livelihoods & Economy || Living Conditions & Social Fabric,"Income generation and poverty reduction or exacerbation || Livability (cost of living, food security, communication services)"
