sourceurl,sqldate,title,scrape_status,in_zambia_confidence,mining_related_confidence,impact_confidence,impact_evidence,mine_name,region,mineral_type,mining_company,impact_level1,impact_level2,impact_level3
https://www.lusakatimes.com/2023/08/02/middle-management-at-mopani-copper-mines-demands-salary-increment-as-per-contract/,20230802,Zambia : Middle Management at Mopani Copper Mines Demands Salary Increment as Per Contract,live_ok_trafilatura,0.99,0.99,0.85,"Social | Livelihoods & Economy | Income generation and poverty reduction or exacerbation -> ""Members of middle management at Mopani Copper Mines in Kitwe and Mufulira are demanding a salary increment which they say was supposed to be effected in January 2023 as stipulated in their contracts."" || Social | Quality of Work Life | Labor conditions and workplace dignity -> ""The workers said they are not being considered for standby allowances and overtime despite their extra working hours."" || Social | Equity, Rights & Vulnerable Groups | Wealth distribution and inequality -> ""The aggrieved senior workers have requested adjustment of remuneration while bemoaning the salary margins between middle management and top management saying it is too wide."" | ""The salary margins between middle management and top management is too wide, therefore there is urgent need to harmonize salaries in order to at least reduce the existing gap."" || Governance | Stakeholder Engagement & Rights | Stakeholder inclusion in decision-making -> ""There is no formal communication allowed to air remuneration concerns to higher management thereby leaving middle management in suspense on having their issues resolved year in, year out."" || Governance | Transparency & Accountability | Corporate transparency and reporting -> ""Meanwhile, Mopani Head of Public Relations Manager Nebert Mulenga said management was handling the complaints by the senior staff internally."" | ""And ZCCM IH Public Relations Manager Loisa Kakoma said she was not aware of the complaints by members of middle management at Mopani.""",,Kitwe and Mufulira,copper,Mopani Copper Mines,Social || Social || Social || Governance || Governance,"Livelihoods & Economy || Quality of Work Life || Equity, Rights & Vulnerable Groups || Stakeholder Engagement & Rights || Transparency & Accountability",Income generation and poverty reduction or exacerbation || Labor conditions and workplace dignity || Wealth distribution and inequality || Stakeholder inclusion in decision-making || Corporate transparency and reporting
https://www.lusakatimes.com/2023/08/02/numaw-president-calls-on-miners-to-be-patient/,20230802,Zambia : NUMAW President calls on miners to be patient,live_ok_trafilatura,0.98,0.98,0.8,"Social | Livelihoods & Economy | Income generation and poverty reduction or exacerbation -> ""We believe that the Head of State (Hakainde Hichilema) understands the impact or the consequences of KCM and Mopani not running to the expected levels and the impact on the national economy."" || Social | Livelihoods & Economy | Business opportunities (local supply chains, services) -> ""He added that NUMAW is expecting the decision of KCM and Mopani to be of great benefit to the mining sector.""",Mopani Copper Mines; Konkola Copper Mines (KCM),,copper,,Social || Social,Livelihoods & Economy || Livelihoods & Economy,"Income generation and poverty reduction or exacerbation || Business opportunities (local supply chains, services)"
https://www.lusakatimes.com/2023/08/04/2-5-billion-pounds-uk-investment-in-zambian-mining-sector/,20230804,Zambia : 2.5 billion pounds UK investment in Zambian mining sector,live_ok_trafilatura,0.99,0.98,0.75,"Social | Livelihoods & Economy | Business opportunities (local supply chains, services) -> ""Mr Siame said UK and Zambia firms are expected to benefit from the commercial opportunities and contribute to the growth of both economies."" | ""the funds to be generated from the British private sector are to be invested in Zambias mining sector.""",,Lusaka,,,Social,Livelihoods & Economy,"Business opportunities (local supply chains, services)"
https://www.lusakatimes.com/2023/08/04/uk-foreign-secretary-meets-president-hichilema-to-strengthen-bilateral-ties/,20230804,Zambia : UK Foreign Secretary Meets President Hichilema to Strengthen Bilateral Ties,live_ok_trafilatura,0.95,0.9,0.9,"Social | Livelihoods & Economy | Employment creation and job security -> ""By adding value to these resources, Zambia aims to create more employment opportunities for its citizens and generate increased revenue for the nation's development."" || Social | Livelihoods & Economy | Income generation and poverty reduction or exacerbation -> ""By adding value to these resources, Zambia aims to create more employment opportunities for its citizens and generate increased revenue for the nation's development.""",,,,,Social || Social,Livelihoods & Economy || Livelihoods & Economy,Employment creation and job security || Income generation and poverty reduction or exacerbation
https://www.lusakatimes.com/2023/08/07/two-juveniles-die-in-landslide-while-digging-quarry-stones/,20230807,Zambia : Two juveniles die in landslide while digging quarry stones,live_ok_trafilatura,0.99,0.9,0.9,"Environmental | Land, Soil & Geology | Slope instability and landslides -> ""He explained that a landslide or soft land collapsed on them while digging for quarry stones"" || Social | Health, Safety & Well-being | Accidents and fatalities (including structural failures such as tailings dams) -> ""Two male juveniles have died after being buried alive whilst digging quarry stones"" | ""they died, after they were buried alive whilst digging Quarry stones"" || Social | Equity, Rights & Vulnerable Groups | Child labor and forced labor risks -> ""his son Kapemba Kapya Wilfred aged 16, also a grade eight pupil... and his friend Moffati Makaza aged 16 years... died, after they were buried alive whilst digging Quarry stones"" | ""an unknown person gave the deceased the piece work of digging the Quarry stones""",,"Kalumbila district, North-western province",quarry stones,,Environmental || Social || Social,"Land, Soil & Geology || Health, Safety & Well-being || Equity, Rights & Vulnerable Groups",Slope instability and landslides || Accidents and fatalities (including structural failures such as tailings dams) || Child labor and forced labor risks
https://www.miningmx.com/news/energy/54066-goviex-says-uranium-offtake-secure-as-niger-coup-risks-scuttling-debt-plans/,20230803,Goviex eases uranium offtake fears as Niger coup puts debt plans at risk - Miningmx,live_ok_trafilatura,0.9,0.98,0.7,"Governance | Regulation, Compliance & Institutions | Mining permitting and licensing practices -> ""its ""mine permitted uranium project in Zambia"" – Muntanga – which was ""operating as normal showcasing our global presence and operational resilience"".""",Muntanga,,uranium,Goviex,Governance,"Regulation, Compliance & Institutions",Mining permitting and licensing practices
https://www.miningmx.com/top-story/54066-goviex-says-uranium-offtake-secure-as-niger-coup-risks-scuttling-debt-plans/,20230802,Goviex eases uranium offtake fears as Niger coup puts debt plans at risk - Miningmx,live_ok_trafilatura,0.8,0.95,0.9,"Governance | Regulation, Compliance & Institutions | Mining permitting and licensing practices -> ""mine permitted uranium project in Zambia""",Muntanga,,uranium,Goviex,Governance,"Regulation, Compliance & Institutions",Mining permitting and licensing practices
https://www.miningmx.com/trending/54088-zambia-agrees-deals-with-uk-on-clean-energy-critical-minerals/,20230803,"Zambia agrees deals with UK on clean energy, critical minerals - Miningmx",live_ok_trafilatura,0.95,0.95,0.85,"Social | Livelihoods & Economy | Employment creation and job security -> """"The UK-Zambia Green Growth Compact and our landmark agreement on critical minerals will support investment between UK and Zambian business, creating jobs in both countries,"" Cleverly said."" || Social | Livelihoods & Economy | Business opportunities (local supply chains, services) -> """"The UK-Zambia Green Growth Compact and our landmark agreement on critical minerals will support investment between UK and Zambian business, creating jobs in both countries,"" Cleverly said.""",,,copper,,Social || Social,Livelihoods & Economy || Livelihoods & Economy,"Employment creation and job security || Business opportunities (local supply chains, services)"
https://www.openaccessgovernment.org/uk-pledges-3-billion-to-support-green-growth-in-zambia/164759/,20230807,UK pledges £3 billion to support green growth in Zambia,live_ok_newspaper,1.0,1.0,0.8,"Social | Livelihoods & Economy | Employment creation and job security -> ""This partnership seeks to combat climate change, create job opportunities, and stimulate business growth in both nations."" | ""The UK commits to generating up to £2.5 billion in private-sector funding from British companies, which will be channelled into Zambia's mining, minerals, and renewable energy sectors."" || Social | Livelihoods & Economy | Business opportunities (local supply chains, services) -> ""This partnership seeks to ... stimulate business growth in both nations."" | ""Additionally, up to £500 million in UK government-backed investments and up to £150 million of private sector funding for small- to medium-sized enterprises (SMEs) will be mobilised, driving economic prosperity in both countries."" | ""The UK commits to generating up to £2.5 billion in private-sector funding from British companies, which will be channelled into Zambia's mining, minerals, and renewable energy sectors."" || Social | Livelihoods & Economy | Income generation and poverty reduction or exacerbation -> ""Additionally, up to £500 million in UK government-backed investments and up to £150 million of private sector funding for small- to medium-sized enterprises (SMEs) will be mobilised, driving economic prosperity in both countries."" | ""The UK commits to generating up to £2.5 billion in private-sector funding from British companies, which will be channelled into Zambia's mining, minerals, and renewable energy sectors."" || Governance | Regulation, Compliance & Institutions | Compliance with national and international standards -> ""James Cleverly will sign a memorandum of understanding on critical minerals as part of the UK's dedication to green growth in Zambia."" | ""This cooperation will ensure sustainable sourcing and improve environmental and social welfare standards.""",,Ndola,"copper, cobalt",,Social || Social || Social || Governance,"Livelihoods & Economy || Livelihoods & Economy || Livelihoods & Economy || Regulation, Compliance & Institutions","Employment creation and job security || Business opportunities (local supply chains, services) || Income generation and poverty reduction or exacerbation || Compliance with national and international standards"
https://www.thenationalnews.com/world/uk-news/2023/08/02/uk-and-zambia-to-expand-clean-energy-partnership-with-green-investment-targets/,20230802,UK and Zambia to expand clean energy partnership with green investment targets | The National,live_ok_trafilatura,0.95,0.95,0.8,"Social | Livelihoods & Economy | Employment creation and job security -> ""support investment between UK and Zambian business, creating jobs in both countries and improving environmental and social standards."" || Social | Livelihoods & Economy | Business opportunities (local supply chains, services) -> ""support investment between UK and Zambian business"" | ""up to £150 million of private sector investment into small to medium-sized enterprises (SMEs) in the country."" || Environmental | Air & Climate | Clean/renewable energy integration (mitigation-related impact) -> ""expand the UK's clean energy partnership with the African country."" | ""Working together with our partners in Zambia, the UK is driving the clean energy transition"" | ""critical minerals such as copper, cobalt and others essential to the global clean energy transition.""",,,"copper, cobalt",,Social || Social || Environmental,Livelihoods & Economy || Livelihoods & Economy || Air & Climate,"Employment creation and job security || Business opportunities (local supply chains, services) || Clean/renewable energy integration (mitigation-related impact)"
https://www.torontotelegraph.com/news/273917562/bemetals-announces-c33-million-convertible-debenture-private-placement-with-a-commitment-for-potential-additional-funding-of-c2-million-from-strategic-investor-b2gold-corp,20230801,BeMetals Announces C$3.3 million Convertible Debenture Private Placement with a Commitment for Potential Additional Funding of C$2 Million from Strategic Investor B2Gold Corp,live_ok_newspaper,0.95,0.95,0.85,"Governance | Regulation, Compliance & Institutions | Legislative and regulatory framework effectiveness -> ""'each constitute a 'related party transaction' within the meaning of Multilateral Instrument 61-101 - Protection of Minority Security holders in Special Transactions ('MI 61-101'). The Company is relying on exemptions from the requirements to obtain a formal valuation for the transactions based on section 5.5(b) of MI 61-101.'"" | ""'The Additional Funding will be subject to TSX Venture Exchange approval prior to completing.'"" | ""'The Offering is subject to acceptance for filing by the TSX Venture Exchange...'"" || Governance | Transparency & Accountability | Corporate transparency and reporting -> ""'A copy of the Early Warning report filed by B2Gold in connection with the acquisition will be available on BeMetals' SEDAR profile.'"" | ""'The Company will be seeking minority shareholder approval for the Offering and for the Additional Funding at its shareholder meeting set for September 6, 2023.'""",Pangeni Copper Project,Zambian Copperbelt,copper,BeMetals,Governance || Governance,"Regulation, Compliance & Institutions || Transparency & Accountability",Legislative and regulatory framework effectiveness || Corporate transparency and reporting
