sourceurl,sqldate,title,scrape_status,in_zambia_confidence,mining_related_confidence,impact_confidence,impact_evidence,mine_name,region,mineral_type,mining_company,impact_level1,impact_level2,impact_level3
http://allafrica.com/stories/201712200826.html,20171220,,wayback_ok,1.0,0.95,0.87,"Social | Livelihoods & Economy | Employment creation and job security -> ""the Chinese government's stated policy is to abide by local laws and emphasise to Chinese companies the need to create local employment."" || Social | Livelihoods & Economy | Business opportunities (local supply chains, services) -> ""The perception and reality of the use of Chinese workers, Chinese competition with small businesses and Chinese labour practices have somehow strained the friendship."" || Social | Quality of Work Life | Labor conditions and workplace dignity -> ""the Zambian Government is trying to balance its desire for Chinese investment, expertise and infrastructure with its citizens' desires for fair competition and decent wages and working conditions."" || Social | Equity, Rights & Vulnerable Groups | Crime and social disorder (corruption, violence, substance abuse) -> ""On the social front, the coming of the Chinese has spawned several concerns like crime which needs attention from both parties.""",,Copperbelt Province,,China Nonferrous Metal Mining Group,Social || Social || Social || Social,"Livelihoods & Economy || Livelihoods & Economy || Quality of Work Life || Equity, Rights & Vulnerable Groups","Employment creation and job security || Business opportunities (local supply chains, services) || Labor conditions and workplace dignity || Crime and social disorder (corruption, violence, substance abuse)"
http://axisoflogic.com/artman/publish/Article_78277.shtml,20171218,Corporate Self-Regulation Is a Global Crisis | World View |Axisoflogic.com,live_ok_newspaper,1.0,0.95,0.9,"Environmental | Air & Climate | Air quality degradation (dust, diesel exhaust, blasting emissions) -> ""For more than a century, Kabwe was home to an enormous lead smelting plant that belched its dust into the air and poisoned the soil for miles in all directions, heedless of the damage it was causing."" || Environmental | Air & Climate | Dust generation -> ""For more than a century, Kabwe was home to an enormous lead smelting plant that belched its dust into the air and poisoned the soil for miles in all directions, heedless of the damage it was causing."" || Environmental | Land, Soil & Geology | Topsoil degradation and loss of soil fertility -> ""For more than a century, Kabwe was home to an enormous lead smelting plant that belched its dust into the air and poisoned the soil for miles in all directions, heedless of the damage it was causing."" || Social | Health, Safety & Well-being | Mental and physical health impacts on communities -> ""Residents — particularly children — have continued to get sick and even die from lead poisoning in terrifying numbers."" || Social | Health, Safety & Well-being | Community exposure to dust, noise, pollution -> ""For more than a century, Kabwe was home to an enormous lead smelting plant that belched its dust into the air and poisoned the soil for miles in all directions, heedless of the damage it was causing."" || Governance | Risk Management & Long-Term Stewardship | Closure planning and post-mining reclamation governance -> ""The plant closed in 1994, but not much has been done to clean up the worst of it."" || Governance | Risk Management & Long-Term Stewardship | Long-term liability management (pollution, water treatment, land stability) -> ""The plant closed in 1994, but not much has been done to clean up the worst of it.""",,Kabwe,lead,,Environmental || Environmental || Environmental || Social || Social || Governance || Governance,"Air & Climate || Air & Climate || Land, Soil & Geology || Health, Safety & Well-being || Health, Safety & Well-being || Risk Management & Long-Term Stewardship || Risk Management & Long-Term Stewardship","Air quality degradation (dust, diesel exhaust, blasting emissions) || Dust generation || Topsoil degradation and loss of soil fertility || Mental and physical health impacts on communities || Community exposure to dust, noise, pollution || Closure planning and post-mining reclamation governance || Long-term liability management (pollution, water treatment, land stability)"
http://www.4-traders.com/GOVIEX-URANIUM-INC-20708274/news/GoviEx-Uranium-Closes-C-5-385-Million-Private-Placement-Financing-25715044/,20171223,,wayback_ok,0.95,0.98,0.6,"Social | Health, Safety & Well-being | Accidents and fatalities (including structural failures such as tailings dams) -> ""(vii) accidents, labour disputes, or the materialization of similar risks;"" || Social | Quality of Work Life | Labor conditions and workplace dignity -> ""(vii) accidents, labour disputes, or the materialization of similar risks;""",Mutanga Project,,uranium,GoviEx Uranium Inc.,Social || Social,"Health, Safety & Well-being || Quality of Work Life",Accidents and fatalities (including structural failures such as tailings dams) || Labor conditions and workplace dignity
https://www.lusakatimes.com/2017/12/15/jerabos-excited-prospect-getting-back-kitwes-black-mountain/,20171215,"Zambia : Jerabos excited with the prospect of getting back Kitwe's ""Black Mountain""",live_ok_trafilatura,0.99,0.99,0.9,"Social | Livelihoods & Economy | Employment creation and job security -> ""the ""Black Mountain"" would create 3, 200 jobs for young people."" || Social | Livelihoods & Economy | Income generation and poverty reduction or exacerbation -> ""the government would reduce vulnerability and poverty levels not just on the Copperbelt but in the country, owing to the fact that the ""Black Mountain"" would create 3, 200 jobs for young people."" | ""small-scale miners would also contribute to the growth of the Gross Domestic Product from the 3.9 percent growth 4.7 percent in 2018."" || Social | Livelihoods & Economy | Human capital development (skills, training, workforce development) -> ""by investing in its population, the government would have more skilled professionals both to create local businesses as well as an easily accessible workforce for companies entering Zambia."" || Social | Living Conditions & Social Fabric | Education and training opportunities -> ""We want to see the Department of Mines safety department to come in and train our people before commencement of mining operations.""",Black Mountain,"Kitwe, Copperbelt",,,Social || Social || Social || Social,Livelihoods & Economy || Livelihoods & Economy || Livelihoods & Economy || Living Conditions & Social Fabric,"Employment creation and job security || Income generation and poverty reduction or exacerbation || Human capital development (skills, training, workforce development) || Education and training opportunities"
https://www.lusakatimes.com/2017/12/15/successful-implementation-eiti-will-help-enhance-revenue-collection-yaluma/,20171215,Zambia : Successful implementation of EITI will help enhance revenue collection-Yaluma,live_ok_trafilatura,0.95,0.95,0.9,"Governance | Transparency & Accountability | Corporate transparency and reporting -> ""the Extractive Industries Transparency Initiative -EITI- will help enhance revenue collection."" | ""the EITI is an independent global standard that promotes transparency and accountability in natural resource governance."" | ""EITI will avail company registration details and ownership of mining companies for easy tax collections.""",,Lusaka,,,Governance,Transparency & Accountability,Corporate transparency and reporting
https://www.lusakatimes.com/2017/12/15/zambia-within-reach-50b-climate-energy-fund/,20171215,"Zambia : Zambia within reach of $50b Climate, energy fund",live_ok_trafilatura,1.0,0.8,0.7,"Social | Livelihoods & Economy | Income generation and poverty reduction or exacerbation -> ""Businesses across the economy from mining to barbershops were hard hit forcing government to import power at great cost to the treasury."" || Environmental | Water Resources | Water management challenges -> ""The lack of investment and Zambia's vulnerability to Mother Nature was acutely illustrated in the 2015 power outages that came about as a result of low water levels."" | ""Businesses across the economy from mining to barbershops were hard hit forcing government to import power at great cost to the treasury.""",,,,,Social || Environmental,Livelihoods & Economy || Water Resources,Income generation and poverty reduction or exacerbation || Water management challenges
https://www.lusakatimes.com/2017/12/19/pf-transforming-copperbelt-province-lusambo/,20171219,Zambia : PF is transforming Copperbelt Province-Lusambo,live_ok_trafilatura,1.0,0.9,0.9,"Social | Living Conditions & Social Fabric | Social infrastructure and amenities (education, healthcare, public services, leisure) -> ""the mining houses in the province have agreed to reconstruct the gutted Kapalala Market in Ndola into a modern start of the art market as part of their Corporate Social Responsibility.""",,Copperbelt Province,,,Social,Living Conditions & Social Fabric,"Social infrastructure and amenities (education, healthcare, public services, leisure)"
https://www.lusakatimes.com/2017/12/20/analysis-lands-acquisition-act-cap-296-1970-chitimukulu/,20171220,Zambia : An Analysis of the Lands (Acquisition) ACT CAP 296 of 1970 - Chitimukulu,live_ok_trafilatura,1.0,0.9,0.7,"Social | Livelihoods & Economy | Business opportunities (local supply chains, services) -> ""However, when the mines were opened in 1932, there was demand for the production of food to feed mostly the African population working on the mines and the related industries."" || Environmental | Land, Soil & Geology | Land disturbance and land-use change -> ""However, when the mines were opened in 1932, there was demand for the production of food to feed mostly the African population working on the mines and the related industries. And hence, this therefore attracted white South Africa farmers to come and grow maize. And they established their farms in central Province, which became known as maize-belt."" || Social | Equity, Rights & Vulnerable Groups | Land ownership impacts and regional value changes -> ""The Northern Rhodesia (Crown Lands Reserves) Orders of 1928 created crown or state land which was 6% out of the total landmass for the white settlers. This, of course, left 94% for the local people. We must note that the 6% was land mainly covering the copper-belt since the British South African company was only interested in the mining of copper."" | ""In fact, the white farmers bought those farms at 3 ngwee per acre, but when the new government wanted to buy the farms back, the owners demanded K100 per acre."" || Governance | Regulation, Compliance & Institutions | Legislative and regulatory framework effectiveness -> ""The laws which protected their land rights have been altered so as to make it possible for the Protectorate Government to alienate land."" | ""I must, however, make it clear that according to Professor Michelo Hansungule's paper, Simplification of the 1995 Land Act stated in Article 7.15: .. there is no provision in the law for the President to compulsorily acquire customary land, the powers of acquisition can only be invoked for leasehold land…."" || Governance | Stakeholder Engagement & Rights | Stakeholder inclusion in decision-making -> ""There was, however, a provision for government to consult traditional leaders before land in the Trust Land was accessed for any purpose."" || Social | Livelihoods & Economy | Employment creation and job security -> ""there was demand for the production of food to feed mostly the African population working on the mines and the related industries."" | ""Mr. Lawrence Chola Katilungu, President of the African Mine workers Union.""",,copper-belt,copper,British South African Company,Social || Environmental || Social || Governance || Governance || Social,"Livelihoods & Economy || Land, Soil & Geology || Equity, Rights & Vulnerable Groups || Regulation, Compliance & Institutions || Stakeholder Engagement & Rights || Livelihoods & Economy","Business opportunities (local supply chains, services) || Land disturbance and land-use change || Land ownership impacts and regional value changes || Legislative and regulatory framework effectiveness || Stakeholder inclusion in decision-making || Employment creation and job security"
https://www.lusakatimes.com/2017/12/25/6-illegal-miners-shot-breaking-chinese-owned-mine/,20171225,Zambia : 6 illegal miners shot after breaking into a Chinese owned mine,live_ok_trafilatura,0.95,0.95,0.9,"Social | Health, Safety & Well-being | Worker health and safety risks -> ""Two illegal miners of Lufwanyama are nursing bullet wounds at Kitwe Teaching Hospital (KTH) while four have been treated and discharged after allegedly being shot at Chinese-owned Ebenezer Tubombeshe Mine."" | """"The six were taken to Kitwe Teaching Hospital and treated. Four were discharged while, Nsama Bwalya and Kauseni Chulu are still admitted to Kitwe Teaching Hospital in Kafue ward, bed 37 and 38 and their conditions are stable,"" said Katanga."" || Governance | Stakeholder Engagement & Rights | Conflict management between companies and communities -> ""The shooting took place in an area between Ebenezer Mine and Gemsfields Mine in Chief Lumpuma's area, where the illegal miners, who were in a group, were scavenging for emeralds."" | """"Police have gone to lufwanyama on investigations led by one victim who was discharged. Police are yet to ascertain whether the said Chinese or the victims committed a criminal offence."""" | ""Copperbelt Provincial Minister Bowman Lusambo expressed shock that the Chinese could use live ammunition to scare away suspected thieves."" | """"Why would you guys use live ammunition? That is the question you should answer when you come to my office tomorrow. So tomorrow I order you to come to my office together with the victims,"" Lusambo said.""",Ebenezer Tubombeshe Mine,Lufwanyama,emeralds,,Social || Governance,"Health, Safety & Well-being || Stakeholder Engagement & Rights",Worker health and safety risks || Conflict management between companies and communities
