sourceurl,sqldate,title,scrape_status,in_zambia_confidence,mining_related_confidence,impact_confidence,impact_evidence,mine_name,region,mineral_type,mining_company,impact_level1,impact_level2,impact_level3
https://www.lusakatimes.com/2017/01/08/copperbelt-can-feed-entire-sadc-region-lusambo/,20170108,Zambia : Copperbelt can feed entire SADC region-Lusambo,live_ok_trafilatura,0.99,0.95,0.8,"Social | Livelihoods & Economy | Income generation and poverty reduction or exacerbation -> ""deliberating on how best the province can move forward in light of the economic challenges arising from the fall in metal prices."" || Governance | Transparency & Accountability | Anti-corruption and bribery risks -> ""Mr Lusambo also cautioned the Province to guard against what he called dubious investors flocking the province."" | ""He warned that the province will not allow dubious investors to come and exploit the resources just to enrich themselves saying the province is a no-go zone area for dubious investors."" || Governance | Stakeholder Engagement & Rights | Stakeholder inclusion in decision-making -> ""resolved to strengthen coordination between Government's provincial and district planning departments and the private sector in order to accelerate development in the province."" | ""called for strengthened coordination between technocrats working in Government, political leaders and other stakeholders.""",,Copperbelt Province,copper,,Social || Governance || Governance,Livelihoods & Economy || Transparency & Accountability || Stakeholder Engagement & Rights,Income generation and poverty reduction or exacerbation || Anti-corruption and bribery risks || Stakeholder inclusion in decision-making
https://www.lusakatimes.com/2017/01/09/proflight-launch-direct-flights-ndola-solwezi/,20170109,Zambia : Proflight to launch direct flights between Ndola and Solwezi,live_ok_trafilatura,1.0,0.95,0.85,"Social | Livelihoods & Economy | Business opportunities (local supply chains, services) -> ""The new direct route will attract more investment in the mining sector and bring to life the tourism industry in North-Western province, said the airline."" | ""The flight will not only contribute greatly to the investment potential in the province..."" || Social | Living Conditions & Social Fabric | Tourism attraction or decline -> ""The new direct route will attract more investment in the mining sector and bring to life the tourism industry in North-Western province, said the airline."" | ""Proflight will increase traffic for tourists coming to visit the West Lunga park and other wildlife attractions, by flying them on its Ndola-Solwezi direct flight.""",,Ndola; Solwezi; North-Western Province; Copperbelt Province,,,Social || Social,Livelihoods & Economy || Living Conditions & Social Fabric,"Business opportunities (local supply chains, services) || Tourism attraction or decline"
https://www.lusakatimes.com/2017/01/10/former-mines-minister-sentenced-2-years-prison-stealing-bycycles/,20170109,Zambia : Former Mines Minister sentenced to 2 years in prison for stealing bycycles,live_ok_trafilatura,1.0,0.85,0.8,"Governance | Transparency & Accountability | Anti-corruption and bribery risks -> ""FORMER Mines minister Maxwell Mwale and his former deputy Boniface Nkhata have been sentenced to two years imprisonment each with hard labour by a Lusaka magistrates' court after they were found guilty of stealing 40 bicycles."" | ""Mwale and Nkhata were charged with two counts of theft by public servant each, involving 40 bicycles valued at K22,000 in 2010."" || Social | Livelihoods & Economy | Equipment and materials availability affecting local labor markets -> ""and 40 of these bicycles were expected to be taken to Chipata to distribute them to the small-scale miners but ended up in Mapatizya.""",,Chipata,,,Governance || Social,Transparency & Accountability || Livelihoods & Economy,Anti-corruption and bribery risks || Equipment and materials availability affecting local labor markets
https://www.lusakatimes.com/2017/01/12/900-million-may-required-fully-revamp-tazara-mushimba/,20170111,Zambia : $900 million may be required to fully revamp TAZARA-Mushimba,live_ok_trafilatura,1.0,0.9,0.85,"Social | Livelihoods & Economy | Business opportunities (local supply chains, services) -> """"Chinese firms who have interest in mining want to run the railway to move mining products and equipment through the railway but we can only allow that through a management contract arrangement with specific terms and conditions unlike the 30-year concession contract,"" he said."" || Governance | Regulation, Compliance & Institutions | Mining permitting and licensing practices -> """"Chinese firms who have interest in mining want to run the railway to move mining products and equipment through the railway but we can only allow that through a management contract arrangement with specific terms and conditions unlike the 30-year concession contract,"" he said."" | ""Recently, China expressed interest in taking over TAZARA through a 30-year concession arrangement although the governments of Zambia and Tanzania are not keen about the arrangement but prefer a three to five years management contract arrangement.""",,,,,Social || Governance,"Livelihoods & Economy || Regulation, Compliance & Institutions","Business opportunities (local supply chains, services) || Mining permitting and licensing practices"
https://www.thenews.com.pk/print/177025-Copper-eases,20170106,Copper eases,live_ok_trafilatura,0.95,0.95,0.9,"Social | Quality of Work Life | Labor conditions and workplace dignity -> ""Traders said news that Zambian workers had downed tools at a mine and copper processing plant belonging to Konkola Copper Mines over wage talks, was insufficient to raise concerns over supply.""",,,copper,Konkola Copper Mines,Social,Quality of Work Life,Labor conditions and workplace dignity
https://www.yahoo.com/news/zambia-vedanta-mine-workers-strike-over-delayed-pay-072703550--finance.html,20170104,Zambia Vedanta mine workers strike over delayed pay talks: union,live_ok_trafilatura,0.95,0.99,0.7,"Social | Livelihoods & Economy | Employment creation and job security -> ""Zambian workers have downed tools at a mine and copper processing plant belonging to Konkola Copper Mines (KCM), a unit of Vedanta Resources, in a dispute over the pace of wage talks,"" | """"The day shift workers have not entered the plant, they are protesting the slow pace of salary negotiations,"""" || Social | Livelihoods & Economy | Income generation and poverty reduction or exacerbation -> ""Zambian workers have downed tools at a mine and copper processing plant belonging to Konkola Copper Mines (KCM), a unit of Vedanta Resources, in a dispute over the pace of wage talks,"" | """"The day shift workers have not entered the plant, they are protesting the slow pace of salary negotiations,""""",Konkola Copper Mines (KCM),Lusaka,copper,Vedanta Resources,Social || Social,Livelihoods & Economy || Livelihoods & Economy,Employment creation and job security || Income generation and poverty reduction or exacerbation
https://www.yahoo.com/news/zambia-vedanta-mine-workers-strike-over-delayed-pay-073540380--finance.html,20170104,Zambia Vedanta mine workers strike over delayed pay talks: union,live_ok_trafilatura,0.99,0.99,0.9,"Social | Livelihoods & Economy | Income generation and poverty reduction or exacerbation -> ""Zambian workers have downed tools at a mine and copper processing plant belonging to Konkola Copper Mines (KCM), a unit of Vedanta Resources, in a dispute over the pace of wage talks"" | """"The day shift workers have not entered the plant, they are protesting the slow pace of salary negotiations,"""" || Social | Quality of Work Life | Labor conditions and workplace dignity -> ""Zambian workers have downed tools at a mine and copper processing plant belonging to Konkola Copper Mines (KCM), a unit of Vedanta Resources, in a dispute over the pace of wage talks"" | """"The day shift workers have not entered the plant, they are protesting the slow pace of salary negotiations,""""",,,copper,Konkola Copper Mines,Social || Social,Livelihoods & Economy || Quality of Work Life,Income generation and poverty reduction or exacerbation || Labor conditions and workplace dignity
