sourceurl,sqldate,title,scrape_status,in_zambia_confidence,mining_related_confidence,impact_confidence,impact_evidence,mine_name,region,mineral_type,mining_company,impact_level1,impact_level2,impact_level3
https://www.directorstalkinterviews.com/jubilee-metals-expands-copper-operations-in-zambia-with-project-g-acquisition/4121173948,20241016,Jubilee Metals Expands Copper Operations In Zambia With Project G Acquisition,live_ok_newspaper,0.98,0.99,0.9,"Environmental | Air & Climate | Clean/renewable energy integration (mitigation-related impact) -> ""The Company's Zambian operations have now fully transitioned its power requirements onto renewable energy sources."" | ""We are equally pleased to have converted our entire power supply requirement to renewable energy in the form of hydro and solar power in future which is vital for the green energy transition to ensure that the copper we produce has as low a carbon footprint as possible."" || Environmental | Air & Climate | Energy demand and consumption -> ""The Company has increased the allocation of power under the recently announced (23 September 2024) private power purchase agreement to secure an additional 2MW of power in order to ensure that all of the Zambian operations are fully supplied under the LHPC agreement."" | ""The increased power allocation allows the Roan Concentrator to operate at full capacity in respect of its newly commissioned front-end module and its existing milling and floatation plant."" || Environmental | Land, Soil & Geology | Land disturbance and land-use change -> ""Project G, an open pit copper mining operation in Zambia"" | ""Project G and Project Munkoyo open-pit mines are located within 55 kilometres of the Sable."" | ""The project plan for Project G targets to expand the existing open-pit operations to achieve an initial mining rate of 10 000 tonnes per month by February 2025."" || Environmental | Land, Soil & Geology | Transport corridors and access road impacts -> ""Project G targeted to commence operations and delivery of pre-concentrated run-of-mine to the Sable Refinery by December 2024"" | ""delivery of an additional 350 copper units per month (4 200 per annum) to Sable for further refining"" | ""Project G and Project Munkoyo open-pit mines are located within 55 kilometres of the Sable."" || Governance | Regulation, Compliance & Institutions | Mining permitting and licensing practices -> ""Under the transaction agreement Jubilee is appointed manager and operator of the open-pit operations. Under the Agreement Jubilee will pay a total of US$2 million dollars of which US$1 million payment is deferred until after the transfer of the mining licences.""",Project G,,copper,Jubilee Metals Group plc,Environmental || Environmental || Environmental || Environmental || Governance,"Air & Climate || Air & Climate || Land, Soil & Geology || Land, Soil & Geology || Regulation, Compliance & Institutions",Clean/renewable energy integration (mitigation-related impact) || Energy demand and consumption || Land disturbance and land-use change || Transport corridors and access road impacts || Mining permitting and licensing practices
https://www.eurasiareview.com/12102024-__trashed/,20241012,,wayback_ok,0.9,0.95,0.8,"Social | Livelihoods & Economy | Employment creation and job security -> ""Florindo Chivucute, Executive Director of Friends of Angola, told ISS Today there is hope that the corridor will create more jobs, but 'time will tell.'"" || Social | Livelihoods & Economy | Income generation and poverty reduction or exacerbation -> ""While the corridor promises long-term economic benefits, its immediate impact on the livelihoods of ordinary Angolans – one out of three of whom live in severe poverty – is uncertain.""",,Central African Copperbelt,copper and cobalt,,Social || Social,Livelihoods & Economy || Livelihoods & Economy,Employment creation and job security || Income generation and poverty reduction or exacerbation
https://www.finanznachrichten.de/nachrichten-2024-10/63497519-midnight-sun-mining-corp-midnight-sun-receives-further-extension-for-completion-of-verification-report-296.htm,20241010,Midnight Sun Mining Corp.: Midnight Sun Receives Further Extension For Completion of Verification Report,live_ok_trafilatura,0.95,0.95,0.85,"Governance | Regulation, Compliance & Institutions | Mining permitting and licensing practices -> ""the Ministry of Mines and Minerals Development has issued an additional 14 day extension to allow additional time for the Geological Survey Department of Zambia (the ""GSD"") to perform a site visit and complete the associated site verification report regarding the Company's Large Scale Exploration Licence 21509-HQ-LEL (the ""Licence"")."" | ""there can be no guarantee that the site verification report will be completed and submitted within the timeframe provided or that further time extensions would be granted, nor is there any guarantee that the site verification report will be accepted by the Ministry and the Licence renewed."" || Governance | Transparency & Accountability | Monitoring and disclosure of environmental and social performance -> ""complete the associated site verification report regarding the Company's Large Scale Exploration Licence 21509-HQ-LEL (the ""Licence"")."" | ""Submission of the site verification report is dependent in part on the availability of third parties and there is no assurance that such persons will be available.""",Solwezi Project,Solwezi,copper,Midnight Sun Mining Corp.,Governance || Governance,"Regulation, Compliance & Institutions || Transparency & Accountability",Mining permitting and licensing practices || Monitoring and disclosure of environmental and social performance
https://www.juancole.com/2024/10/the-climate-colonialism.html,20241011,The New Climate Colonialism,live_ok_trafilatura,0.95,0.95,0.9,"Social | Health, Safety & Well-being | Worker health and safety risks -> ""exposed the wretchedness inside Zambia's Chinese-owned mines: 18-hour work days, unsafe working environments, rampant anti-union activities, and fatal workplace accidents."" | """"Friends tell you that there's a danger as they're coming out of shift,"" a miner who was injured while working for a Chinese company told HRW. ""You'll be fired if you refuse, they threaten this all the time… The main accidents are from rock falls, but you also have electrical shocks, people hit by mining trucks underground, people falling from platforms that aren't stable…"""" || Social | Health, Safety & Well-being | Accidents and fatalities (including structural failures such as tailings dams) -> ""An explosion at one mine killed 51 workers in 2005 and things have only devolved since then. Ten workers died in 2018 at an illegal copper extraction site. In 2019, three mineworkers were burned to death in an underground shaft fire and a landslide at an open-pit copper mine in Zambia killed more than 30 miners in 2023."" || Environmental | Water Resources | Surface water pollution and quality degradation -> ""The Kafue River runs for more than 1,500 kilometers, making it Zambia's longest river and now probably its most polluted as well. Going north to south, its waters flow through the Copperbelt, carrying with them cadmium, lead, and mercury from KCM's mine."" || Environmental | Water Resources | Freshwater ecotoxicity (heavy metals, pH changes, sensitive species) -> """"[T]here was some environmental degradation going on as a result of the mining activities. As we found, there were times when the acid levels of water was so high,"" explained Mumba."" | """"So there were very specific complaints about stomach issues from children. Children just really wander around the villages and if they are thirsty, they don't think about what's happening, they'll just get a cup and take their drink of water from the river. That's how they live. So they'll usually get diseases."""" || Environmental | Land, Soil & Geology | Topsoil degradation and loss of soil fertility -> ""In Zambia, his copper mines have wrecked farmlands and waterways that once supplied fish and drinking water to thousands of villagers."" || Social | Health, Safety & Well-being | Mental and physical health impacts on communities -> """"So there were very specific complaints about stomach issues from children... So they'll usually get diseases."""" || Social | Living Conditions & Social Fabric | Livability (cost of living, food security, communication services) -> ""In Zambia, his copper mines have wrecked farmlands and waterways that once supplied fish and drinking water to thousands of villagers."" || Equity, Rights & Vulnerable Groups | Wealth distribution and inequality | Wealth distribution and inequality -> """"The value of copper that has left Zambia is in the hundreds of billions of dollars. Hold that figure in your mind, and then look around yourself in Zambia,"" says Zambian economist Grieve Chelwa. ""The link between resource and benefit is severed."""" || Governance | Regulation, Compliance & Institutions | Enforcement of environmental and social regulations -> ""Sadly enough, though, despite that important legal victory, little has changed in Zambia, where environmental regulations remain weak and nearly impossible to enforce, which leaves mining companies like KCM to regulate themselves."" || Governance | Transparency & Accountability | Accountability for accidents and environmental damage -> ""The British Supreme Court then found Vedanta liable, and the company was forced to pay an undisclosed settlement, likely in the millions of dollars.""",,Copperbelt,copper,Konkola Copper Mines,"Social || Social || Environmental || Environmental || Environmental || Social || Social || Equity, Rights & Vulnerable Groups || Governance || Governance","Health, Safety & Well-being || Health, Safety & Well-being || Water Resources || Water Resources || Land, Soil & Geology || Health, Safety & Well-being || Living Conditions & Social Fabric || Wealth distribution and inequality || Regulation, Compliance & Institutions || Transparency & Accountability","Worker health and safety risks || Accidents and fatalities (including structural failures such as tailings dams) || Surface water pollution and quality degradation || Freshwater ecotoxicity (heavy metals, pH changes, sensitive species) || Topsoil degradation and loss of soil fertility || Mental and physical health impacts on communities || Livability (cost of living, food security, communication services) || Wealth distribution and inequality || Enforcement of environmental and social regulations || Accountability for accidents and environmental damage"
https://www.lusakatimes.com/2024/10/06/former-kasama-mp-kelvin-bwalya-sampa-and-two-others-detained-for-usd-80000-gold-scam/,20241006,"Zambia : Former Kasama MP Kelvin Bwalya Sampa and Two Others Detained for USD 80,000 Gold Scam",live_ok_trafilatura,0.95,0.95,0.85,"Governance | Transparency & Accountability | Anti-corruption and bribery risks -> ""former Kasama Member of Parliament (MP) Kelvin Bwalya Sampa has been detained by the Zambia Police Service, alongside two accomplices, for allegedly scamming a Japanese businessman out of USD 80,000."" | ""falsely claiming he had access to genuine gold sellers in Zambia."" || Governance | Reputation & Social License | Mining image and public perception -> ""false promises of a lucrative gold deal"" | ""However, his involvement in this brazen fraud scheme has cast a long shadow over his legacy, raising serious questions about integrity, trust, and corruption within Zambia's elite.""",,Lusaka,gold,,Governance || Governance,Transparency & Accountability || Reputation & Social License,Anti-corruption and bribery risks || Mining image and public perception
https://www.lusakatimes.com/2024/10/07/kcm-partners-with-local-suppliers-to-strengthen-zambian-economy/,20241007,Zambia : KCM Partners with Local Suppliers to Strengthen Zambian Economy,live_ok_trafilatura,0.99,0.99,0.9,"Social | Livelihoods & Economy | Business opportunities (local supply chains, services) -> ""KCM has invited numerous local suppliers to participate in the tendering process for providing goods and services."" | ""By opening up opportunities for local contractors, KCM not only strengthens the local supply chain but also contributes to the growth of small and medium-sized enterprises (SMEs) in Zambia."" || Social | Livelihoods & Economy | Human capital development (skills, training, workforce development) -> ""SMEs are often recognized as a backbone for economic development, driving innovation, job creation, and skills development in the broader economy."" | ""Moreover, this engagement with local suppliers could result in improved skills transfer, boosting local capacity and providing long-term benefits for the industry as a whole."" || Social | Livelihoods & Economy | Employment creation and job security -> ""SMEs are often recognized as a backbone for economic development, driving innovation, job creation, and skills development in the broader economy."" | ""retaining wealth within the country and boosting local employment."" || Social | Livelihoods & Economy | Income generation and poverty reduction or exacerbation -> ""By opening up opportunities for local contractors, KCM not only strengthens the local supply chain but also contributes to the growth of small and medium-sized enterprises (SMEs) in Zambia."" | ""Mr. Mwaba revealed that all suppliers who provide goods and services to KCM will now be paid within 30 days of delivering their products or completing their services."" | ""Timely payments will help local suppliers maintain liquidity, sustain their operations, and continue participating in the mining industry without unnecessary financial strain."" || Governance | Stakeholder Engagement & Rights | Stakeholder inclusion in decision-making -> ""KCM has invited numerous local suppliers to participate in the tendering process for providing goods and services."" | ""The Association of Mine Suppliers and Contractors has expressed optimism about the evolving relationship between local suppliers and Konkola Copper Mines (KCM)."" || Social | Equity, Rights & Vulnerable Groups | Wealth distribution and inequality -> ""The shift could lead to a more equitable distribution of mining wealth, ensuring that Zambians are active participants in their country's mineral resources sector."" | ""the benefits of such partnerships extend beyond the immediate economic gain for suppliers, as they also contribute to national development by retaining wealth within the country and boosting local employment.""",,,copper,Konkola Copper Mines,Social || Social || Social || Social || Governance || Social,"Livelihoods & Economy || Livelihoods & Economy || Livelihoods & Economy || Livelihoods & Economy || Stakeholder Engagement & Rights || Equity, Rights & Vulnerable Groups","Business opportunities (local supply chains, services) || Human capital development (skills, training, workforce development) || Employment creation and job security || Income generation and poverty reduction or exacerbation || Stakeholder inclusion in decision-making || Wealth distribution and inequality"
https://www.lusakatimes.com/2024/10/09/president-hichilema-hosts-saudi-delegation-for-mining-and-investment-discussions/,20241009,Zambia : President Hichilema Hosts Saudi Delegation for Mining and Investment Discussions,live_ok_trafilatura,0.95,0.95,0.8,"Social | Livelihoods & Economy | Business opportunities (local supply chains, services) -> ""The discussions focused on joint investments in sectors like mining, energy, tourism, and agriculture"" | ""with a commitment to ensuring that Zambians benefit from natural resource endowment through value addition."" || Social | Livelihoods & Economy | Income generation and poverty reduction or exacerbation -> ""with a commitment to ensuring that Zambians benefit from natural resource endowment through value addition."" | ""The President highlighted Zambia's eagerness to learn from Saudi Arabia's successful management of its natural resources ... to improve the welfare of its citizens.""",,Lusaka,,,Social || Social,Livelihoods & Economy || Livelihoods & Economy,"Business opportunities (local supply chains, services) || Income generation and poverty reduction or exacerbation"
https://www.lusakatimes.com/2024/10/09/zambia-hosts-2024-mining-and-investment-insaka-celebrating-100-years-of-mining/,20241009,"Zambia : Zambia Hosts 2024 Mining and Investment Insaka, Celebrating 100 Years of Mining",live_ok_trafilatura,0.99,0.99,0.9,"Social | Health, Safety & Well-being | Accidents and fatalities (including structural failures such as tailings dams) -> ""President Hichilema also expressed concern on the rising numbers of people dying due to illegal and unsafe mining."" || Governance | Regulation, Compliance & Institutions | Mining permitting and licensing practices -> ""so far over 500 licences have been issued to Zambians to embark on mining operations."" | ""government is putting in place a number of measures to ensure that small scale miners operate legally and in a safe way"" || Social | Livelihoods & Economy | Employment creation and job security -> ""the association, which has about 20 companies operating in the mining sector in Zambia and has created more than 15,000 jobs"" || Governance | Regulation, Compliance & Institutions | Legislative and regulatory framework effectiveness -> ""reiterating the right policies and reforms that government has put in place to make sure that there is sustainable growth and development in the sector."" | ""He further pledged government's continued support towards stable and predictable policies that will attract more investments to the mining sector"" || Governance | Stakeholder Engagement & Rights | Stakeholder inclusion in decision-making -> ""The Insaka offers a critical platform for discussion and action, aimed at shaping the future of mining in Zambia for the benefit of all, especially its citizens."" | ""President Hakainde Hichilema emphasized the importance of collaboration, encouraging stakeholders to explore sustainable growth in the sector.""",,Lusaka Province,copper,Konkola Copper Mines,Social || Governance || Social || Governance || Governance,"Health, Safety & Well-being || Regulation, Compliance & Institutions || Livelihoods & Economy || Regulation, Compliance & Institutions || Stakeholder Engagement & Rights",Accidents and fatalities (including structural failures such as tailings dams) || Mining permitting and licensing practices || Employment creation and job security || Legislative and regulatory framework effectiveness || Stakeholder inclusion in decision-making
https://www.marketscreener.com/news/latest/Ten-dead-five-injured-after-Zambia-mine-collapses-48017211/,20241007,"Ten dead, five injured after Zambia mine collapses | MarketScreener",live_ok_trafilatura,0.98,0.98,0.9,"Environmental | Land, Soil & Geology | Surface ground instability and subsidence -> ""Rescue efforts were underway after a mine pit collapsed in Zambia's Mumbwa District, killing 10 people and injuring five, police said on Monday."" | """"During the course of their mining activities, the earth collapsed on them,"" Zambian police said in a statement."" || Social | Health, Safety & Well-being | Accidents and fatalities (including structural failures such as tailings dams) -> ""Rescue efforts were underway after a mine pit collapsed in Zambia's Mumbwa District, killing 10 people and injuring five, police said on Monday."" | """"An unknown number of people went to conduct mining activities at the pit this morning. During the course of their mining activities, the earth collapsed on them,"" Zambian police said in a statement."" || Governance | Transparency & Accountability | Accountability for accidents and environmental damage -> """"We will do everything possible to provide assistance and ensure a thorough investigation,"" local politician Collins Nzovu said in a statement.""",,Mumbwa District,,,Environmental || Social || Governance,"Land, Soil & Geology || Health, Safety & Well-being || Transparency & Accountability",Surface ground instability and subsidence || Accidents and fatalities (including structural failures such as tailings dams) || Accountability for accidents and environmental damage
https://www.marketscreener.com/quote/stock/FIRST-QUANTUM-MINERALS-LT-1410017/news/Exclusive-Saudi-s-Manara-in-advanced-talks-to-buy-stake-in-First-Quantum-s-Zambian-mines-48088342/,20241016,Exclusive-Saudi's Manara in advanced talks to buy stake in First Quantum's Zambian mines | MarketScreener,live_ok_trafilatura,0.99,0.98,0.85,"Social | Livelihoods & Economy | Income generation and poverty reduction or exacerbation -> ""The Zambian mines contributed $1.08 billion to First Quantum's revenue in the second quarter of this year."" || Social | Equity, Rights & Vulnerable Groups | Wealth distribution and inequality -> ""Zambian state firm ZCCM-IH owns 20% of Kansanshi.""",Kansanshi; Sentinel; Enterprise,,copper; nickel,First Quantum Minerals,Social || Social,"Livelihoods & Economy || Equity, Rights & Vulnerable Groups",Income generation and poverty reduction or exacerbation || Wealth distribution and inequality
https://www.miningmx.com/trending/58525-barrick-launches-lumwana-copper-expansion-project/,20241003,Barrick launches Lumwana copper expansion project - Miningmx,live_ok_trafilatura,0.99,0.99,0.6,"Environmental | Land, Soil & Geology | Land disturbance and land-use change -> ""BARRICK on Wednesday started the development of its Lumwana super pit, a development that comes ahead of a $2bn expansion that is waiting on a final investment decision."" || Social | Livelihoods & Economy | Income generation and poverty reduction or exacerbation -> ""Mining plays a key role in Zambia's economic structure and our partnership with Barrick is creating one team with a shared vision to develop a new economic frontier in the North-Western Province of the country and beyond,"" | ""annual operating cash flow and free cash flow are projected to improve by as much as 85% and 60%, respectively, based on the long-term copper price consensus,"" || Governance | Reputation & Social License | Social license to operate -> """"Mining plays a key role in Zambia's economic structure and our partnership with Barrick is creating one team with a shared vision to develop a new economic frontier in the North-Western Province of the country and beyond,"" said Zambian president Hakainde Hichilema who attended an official launch of the project.""",Lumwana,North-Western Province,copper,Barrick,Environmental || Social || Governance,"Land, Soil & Geology || Livelihoods & Economy || Reputation & Social License",Land disturbance and land-use change || Income generation and poverty reduction or exacerbation || Social license to operate
https://www.miningweekly.com/article/barrick-kicks-off-lumwanas-journey-to-top-25-global-copper-producers-2024-10-03,20241003,Barrick kicks off Lumwana's journey to top 25 global copper producers,live_ok_newspaper,1.0,1.0,0.95,"Social | Livelihoods & Economy | Employment creation and job security -> ""The project would require 550 additional workers over the next five years, as well as 2 500 construction workers during the peak three-year period leading up to 2028."" || Social | Livelihoods & Economy | Business opportunities (local supply chains, services) -> ""We are also planning to build critical infrastructure, including an airstrip and an industrial supplier park."" | ""This will enable key suppliers to establish themselves in the area, creating an economic hub that will further fuel growth and development in the wider region"" | ""the Super Pit Expansion would leave a sustainable legacy by developing local capacity and supporting the region's communities and businesses throughout construction and operation."" || Social | Livelihoods & Economy | Human capital development (skills, training, workforce development) -> ""the Super Pit Expansion would leave a sustainable legacy by developing local capacity and supporting the region's communities and businesses throughout construction and operation."" || Social | Living Conditions & Social Fabric | Social infrastructure and amenities (education, healthcare, public services, leisure) -> ""We are also planning to build critical infrastructure, including an airstrip and an industrial supplier park."" || Social | Livelihoods & Economy | Income generation and poverty reduction or exacerbation -> ""creating an economic hub that will further fuel growth and development in the wider region"" || Governance | Stakeholder Engagement & Rights | Stakeholder inclusion in decision-making -> ""Canada-headquartered Barrick Gold officially launched the development of a Super Pit at its Lumwana copper mine in Zambia on Wednesday, with President Hakainde Hichilema and members of his Cabinet in attendance."" | ""Hichilema highlighted the importance of mining in Zambia's economic structure, noting that Barrick's partnership with the government was creating a shared vision to develop a new economic frontier in the country's North-Western province and beyond.""",Lumwana,North-Western province,copper,Barrick Gold,Social || Social || Social || Social || Social || Governance,Livelihoods & Economy || Livelihoods & Economy || Livelihoods & Economy || Living Conditions & Social Fabric || Livelihoods & Economy || Stakeholder Engagement & Rights,"Employment creation and job security || Business opportunities (local supply chains, services) || Human capital development (skills, training, workforce development) || Social infrastructure and amenities (education, healthcare, public services, leisure) || Income generation and poverty reduction or exacerbation || Stakeholder inclusion in decision-making"
