sourceurl,sqldate,title,scrape_status,in_zambia_confidence,mining_related_confidence,impact_confidence,impact_evidence,mine_name,region,mineral_type,mining_company,impact_level1,impact_level2,impact_level3
https://www.marketscreener.com/quote/commodity/LME-COPPER-CASH-16161/news/Zambia-set-to-negotiate-bigger-stakes-in-new-mining-projects-45895475/,20240206,Zambia set to negotiate bigger stakes in new mining projects | MarketScreener,live_ok_trafilatura,0.95,0.95,0.6,"Social | Living Conditions & Social Fabric | Social infrastructure and amenities (education, healthcare, public services, leisure) -> ""Zambia is keen to negotiate larger holdings in new mining projects in order to raise its revenue and boost spending by investors on social projects, mines minister Paul Kabuswe said."" | """"we also want to make sure that there's social impact,"" he added."" || Social | Livelihoods & Economy | Income generation and poverty reduction or exacerbation -> ""Zambia is keen to negotiate larger holdings in new mining projects in order to raise its revenue and boost spending by investors on social projects, mines minister Paul Kabuswe said.""",Mopani Copper Mines; Konkola Copper Mines,,copper,ZCCM-IH; Barrick Gold; Vedanta Resources; First Quantum Minerals; International Holding Company; Glencore,Social || Social,Living Conditions & Social Fabric || Livelihoods & Economy,"Social infrastructure and amenities (education, healthcare, public services, leisure) || Income generation and poverty reduction or exacerbation"
https://www.miningweekly.com/article/kamoa-kakula-trafigura-become-first-lobito-railway-corridor-customers-2024-02-07,20230207,"Kamoa-Kakula, Trafigura become first Lobito railway corridor customers",live_ok_newspaper,0.6,0.99,0.75,"Environmental | Air & Climate | Greenhouse gas emissions (GHGs) -> ""The Lobito Atlantic railway corridor is expected to significantly improve the logistical costs and reduce the Scope 3 emissions carbon footprint of Kamoa-Kakula copper exports, especially once the rail spur has been built connecting the line directly to Kamoa-Kakula."" || Environmental | Air & Climate | Energy demand and consumption -> ""Moreover, transportation by rail is significantly quicker and less energy-intensive."" || Environmental | Land, Soil & Geology | Transport corridors and access road impacts -> ""The Lobito Corridor will also reduce congestion on the DRC's other logistics corridors and significantly reduce the cost of exporting from and importing into the DRC Copperbelt."" || Social | Livelihoods & Economy | Business opportunities (local supply chains, services) -> ""We admire the hard work of the Lobito Corridor consortium and [commodities trading company] Trafigura, working with their partners in the DRC and Angola, to build a new supply chain that is fast becoming one of the most important trade routes for vital copper metal in the world,"" Friedland said."" | ""He added that the transformative economic corridor would unlock more copper projects owing to the lower logistical costs."" || Social | Livelihoods & Economy | Income generation and poverty reduction or exacerbation -> ""The DRC, Angola and Zambia will benefit from accelerated social and economic development as a direct consequence of this support.""",Kamoa-Kakula Copper Complex,,copper,Ivanhoe Mines,Environmental || Environmental || Environmental || Social || Social,"Air & Climate || Air & Climate || Land, Soil & Geology || Livelihoods & Economy || Livelihoods & Economy","Greenhouse gas emissions (GHGs) || Energy demand and consumption || Transport corridors and access road impacts || Business opportunities (local supply chains, services) || Income generation and poverty reduction or exacerbation"
https://www.miningweekly.com/article/mingomba-discovery-highlights-value-of-konkola-west-by-proximity-2024-02-07,20240207,Mingomba discovery highlights value of Konkola West by proximity,live_ok_newspaper,1.0,1.0,0.9,"Governance | Regulation, Compliance & Institutions | Mining permitting and licensing practices -> ""As announced on December 19, subject to government approvals, KoBold is planning to drill test the projected down dip extensions to the copper ore shale that hosts its new discovery."" | ""where KoBold has also signed a definitive earn-in agreement.""",Konkola West,,copper,Tertiary Minerals,Governance,"Regulation, Compliance & Institutions",Mining permitting and licensing practices
https://www.miningweekly.com/article/zambia-set-to-negotiate-bigger-stakes-in-new-mining-projects-2024-02-07,20240207,Zambia set to negotiate bigger stakes in new mining projects,live_ok_newspaper,0.99,0.98,0.85,"Social | Livelihoods & Economy | Income generation and poverty reduction or exacerbation -> ""Zambia is keen to negotiate larger holdings in new mining projects in order to raise its revenue and boost spending by investors on social projects, mines minister Paul Kabuswe said."" || Social | Living Conditions & Social Fabric | Social infrastructure and amenities (education, healthcare, public services, leisure) -> """"we also want to make sure that there's social impact,"" he added."" | ""Zambia is keen to negotiate larger holdings in new mining projects in order to raise its revenue and boost spending by investors on social projects, mines minister Paul Kabuswe said."" || Social | Livelihoods & Economy | Business opportunities (local supply chains, services) -> ""Lusaka also plans to start buying minerals such as copper from projects it has stakes in to trade on its own, he said.""",Mopani Copper Mines; Konkola Copper Mines,Lusaka,copper,Barrick Gold; Vedanta Resources; First Quantum Minerals; International Holding Company; Glencore,Social || Social || Social,Livelihoods & Economy || Living Conditions & Social Fabric || Livelihoods & Economy,"Income generation and poverty reduction or exacerbation || Social infrastructure and amenities (education, healthcare, public services, leisure) || Business opportunities (local supply chains, services)"
https://www.miningweekly.com/article/zambia-to-start-trading-its-own-copper-competing-with-glencore-2024-02-06,20240206,"Zambia to start trading its own copper, competing with Glencore",live_ok_newspaper,0.95,0.98,0.8,"Social | Livelihoods & Economy | Income generation and poverty reduction or exacerbation -> ""Zambia joins neighbors including Botswana and Democratic Republic of Congo in trying to secure greater economic benefits from its mineral wealth through getting access to the commodities to sell directly to buyers."" | ""While the government has shareholdings in some mines, it's argued for decades that state revenues from them are too low."" || Social | Livelihoods & Economy | Human capital development (skills, training, workforce development) -> ""The government will hire the necessary expertise to start trading its copper"" || Social | Livelihoods & Economy | Business opportunities (local supply chains, services) -> ""To say that we can come as a commercial player to compete with the other commodity traders, to make financing available for the mines for us to have a fair share of the resource."" || Social | Equity, Rights & Vulnerable Groups | Wealth distribution and inequality -> ""We've reached the point where we have to be disruptive. Our benefits from the sector has been quite minimal,"" Kayumba said."" | ""There's a lot of financial engineering, call it creative accounting — transfer pricing reduces our chances of getting a good dividend."" || Governance | Transparency & Accountability | Corporate transparency and reporting -> ""The move will open a window into the financial world of commodity trading and help the government see how much profit from its copper remains abroad"" | """"It gives us transparency,"" Kayumba said. ""We'll see 'Ah! That's what happened in Switzerland'.""""",,,copper,First Quantum Minerals; Barrick Gold,Social || Social || Social || Social || Governance,"Livelihoods & Economy || Livelihoods & Economy || Livelihoods & Economy || Equity, Rights & Vulnerable Groups || Transparency & Accountability","Income generation and poverty reduction or exacerbation || Human capital development (skills, training, workforce development) || Business opportunities (local supply chains, services) || Wealth distribution and inequality || Corporate transparency and reporting"
https://www.nbcnewyork.com/news/business/money-report/bill-gates-and-jeff-bezos-backed-startup-discovers-large-scale-copper-deposit-in-zambia/5106075/,20240205,Bill Gates- and Jeff Bezos-backed startup discovers large-scale copper deposit in Zambia – NBC New York,live_ok_trafilatura,0.95,0.95,0.7,"Environmental | Air & Climate | Clean/renewable energy integration (mitigation-related impact) -> ""The rare discovery of a large-scale copper deposit could help in the global race to secure a supply of materials critical to the energy transition."" | ""Copper is in high demand due to its use in renewable energy and electric vehicles."" || Social | Livelihoods & Economy | Income generation and poverty reduction or exacerbation -> ""KoBold Metals has said it aims to start producing copper at its mine in Zambia within 10 years, in a project that could have significant economic ramifications for the African nation."" | """"There is a lot that we as Zambians can look forward to in terms of the announcement of their mine development which should be coming on stream,"" Kayumba said in a video posted Monday on social media site X.""",Mingomba copper project,,copper,KoBold Metals,Environmental || Social,Air & Climate || Livelihoods & Economy,Clean/renewable energy integration (mitigation-related impact) || Income generation and poverty reduction or exacerbation
https://www.railwaygazette.com/freight/lobito-atlantic-railway-freight-capacity-contracts-signed/65870.article,20240207,Lobito Atlantic Railway freight capacity contracts signed | News | Railway Gazette International,live_ok_trafilatura,1.0,1.0,0.9,"Environmental | Air & Climate | Greenhouse gas emissions (GHGs) -> ""This aims to provide a more efficient and lower-carbon route to market for metals including copper and cobalt.""",Kamoa-Kakula,Copperbelt,copper,Ivanhoe Mines,Environmental,Air & Climate,Greenhouse gas emissions (GHGs)
https://www.theconstructionindex.co.uk/the-digger-blog/view/battery-rigid-dump-truck-shipped-to-zambian-mine,20240206,Battery rigid dump truck shipped to Zambian mine,live_ok_trafilatura,0.98,0.99,0.8,"Environmental | Air & Climate | Energy demand and consumption -> ""the regenerative braking system charges the battery, which reduces the charging load when the truck is connected to the trolley."" | ""This creates a virtuous circle that reduces the energy used by the dump truck.""",Kansanshi,Kansanshi,copper and gold,First Quantum Minerals,Environmental,Air & Climate,Energy demand and consumption
