sourceurl,sqldate,title,scrape_status,in_zambia_confidence,mining_related_confidence,impact_confidence,impact_evidence,mine_name,region,mineral_type,mining_company,impact_level1,impact_level2,impact_level3
http://www.chinaview.cn/africa/20240204/cf25649b409e486c93a828cc19a304dc/c.html,20240204,Zambian gov't upbeat on currency stability-Xinhua,live_ok_trafilatura,0.99,0.99,0.9,"Social | Livelihoods & Economy | Employment creation and job security -> ""the resumption of operations by two of the country's biggest mining firms, Konkola Copper Mines and Mopani Copper Mines, will result in increased foreign exchange inflows into the country's economy, a situation that will have positive effects on the foreign exchange market."" | ""He said enhanced growth of various sectors will result in higher economic growth, a situation that will see more jobs being created and more resources for public service."" || Social | Livelihoods & Economy | Income generation and poverty reduction or exacerbation -> ""the resumption of operations by two of the country's biggest mining firms, Konkola Copper Mines and Mopani Copper Mines, will result in increased foreign exchange inflows into the country's economy, a situation that will have positive effects on the foreign exchange market."" | ""the minister said the lack of operations at the two mines has affected revenue collection."" | ""Copper is the biggest economic mainstay for Zambia and accounts for over 70 percent in foreign exchange earnings."" || Social | Living Conditions & Social Fabric | Livability (cost of living, food security, communication services) -> ""The Zambian government on Friday expressed optimism that the local currency, the Kwacha, which has depreciated significantly in recent months, will stabilize this year."" | """"The Kwacha is facing too much pressure due to lack of dollars in circulation but the situation will change when new investors inject more liquidity in the two mining companies,"" he said.""",Konkola Copper Mines; Mopani Copper Mines,Lusaka,copper,Konkola Copper Mines; Mopani Copper Mines,Social || Social || Social,Livelihoods & Economy || Livelihoods & Economy || Living Conditions & Social Fabric,"Employment creation and job security || Income generation and poverty reduction or exacerbation || Livability (cost of living, food security, communication services)"
https://finance.yahoo.com/news/jeff-bezos-bill-gates-backed-000020399.html,20240207,A Jeff Bezos- and Bill Gates-backed metals company has discovered a massive copper reserve in Zambia,live_ok_trafilatura,0.95,0.98,0.8,"Environmental | Air & Climate | Clean/renewable energy integration (mitigation-related impact) -> ""The discovery is a key development for the clean energy transition which needs a lot of copper."" | ""KoBold's find could provide a boost to the supply of copper which is needed for solar panels, wind turbines, electric vehicles, and more."" || Social | Livelihoods & Economy | Income generation and poverty reduction or exacerbation -> ""Copper makes up over 70% of the country's export revenues."" | ""Last year, Zambia's copper output fell to a 14-year low amid a debt crisis, which further pinched the copper-reliant Zambian economy.""",Mingomba,,copper,KoBold Metals,Environmental || Social,Air & Climate || Livelihoods & Economy,Clean/renewable energy integration (mitigation-related impact) || Income generation and poverty reduction or exacerbation
https://fortune.com/2024/02/05/bill-gates-jeff-bezos-jack-ma-breakthrough-energy-venture-kobold-metal-copper-deposit-discovery/,20230205,Bill Gates and Jeff Bezos made a bet on mining startup KoBold—now they've struck gold | Fortune,live_ok_trafilatura,0.98,0.98,0.65,"Environmental | Land, Soil & Geology | Land disturbance and land-use change -> ""began mining in Mingomba just over 12 months ago following an investment of $150 million. Since then it has grown its infrastructure from one drilling rig to six, usually drilling to 1,800 to 2,000 meters deep. Thus far, nearly 34,000 meters have been drilled within a year.""",Mingomba,northern Zambia,copper,KoBold,Environmental,"Land, Soil & Geology",Land disturbance and land-use change
https://news.yahoo.com/blinken-hails-progress-construction-angolas-161040139.html,20240125,Blinken hails progress in construction of Angola's Lobito rail corridor,live_ok_trafilatura,0.8,0.95,0.7,"Social | Livelihoods & Economy | Business opportunities (local supply chains, services) -> """"Blinken said the expansion of the corridor would secure critical minerals supply chains and spur investment in telecommunications, agriculture and other sectors.""""",,Copperbelt,copper and cobalt,,Social,Livelihoods & Economy,"Business opportunities (local supply chains, services)"
https://news.yahoo.com/blinken-sees-growing-partner-angola-035621451.html,20240125,,wayback_ok,0.99,0.95,0.6,"Social | Livelihoods & Economy | Business opportunities (local supply chains, services) -> """"This project has genuinely transformative potential for this nation, for this region and, I would argue, for the world,"""" | """"The route will transport resources critical to the global economy including copper and cobalt, a vital component of smartphones.""""",,,copper and cobalt,,Social,Livelihoods & Economy,"Business opportunities (local supply chains, services)"
https://thebftonline.com/2024/01/26/blinken-tackling-u-s-policy-weaknesses-in-africa-2/,20240127,Blinken tackling U.S. policy weaknesses in Africa - The Business & Financial Times,live_ok_trafilatura,0.9,0.8,0.7,"Environmental | Land, Soil & Geology | Transport corridors and access road impacts -> ""revitalize and guarantee the $1 billion rail project for Angola's Lobito Corridor, which would eventually link Angola with mineral-rich parts of the Republic of Zambia and the Democratic Republic of Congo.""",,Republic of Zambia,,,Environmental,"Land, Soil & Geology",Transport corridors and access road impacts
https://www.bignewsnetwork.com/news/274115209/zambian-govt-upbeat-on-currency-stability,20240203,Zambian gov't upbeat on currency stability,live_ok_newspaper,0.99,0.95,0.9,"Social | Livelihoods & Economy | Employment creation and job security -> """"He said enhanced growth of various sectors will result in higher economic growth, a situation that will see more jobs being created and more resources for public service."""" || Social | Livelihoods & Economy | Income generation and poverty reduction or exacerbation -> ""the resumption of operations by two of the country's biggest mining firms, Konkola Copper Mines and Mopani Copper Mines, will result in increased foreign exchange inflows into the country's economy, a situation that will have positive effects on the foreign exchange market."" | ""the lack of operations at the two mines has affected revenue collection."" | ""Copper is the biggest economic mainstay for Zambia and accounts for over 70 percent in foreign exchange earnings.""",,,copper,Konkola Copper Mines; Mopani Copper Mines,Social || Social,Livelihoods & Economy || Livelihoods & Economy,Employment creation and job security || Income generation and poverty reduction or exacerbation
https://www.bignewsnetwork.com/news/274116832/zambian-president-vows-to-position-mining-on-growth-path,20240205,Zambian president vows to position mining on growth path,live_ok_newspaper,0.96,0.95,0.85,"Environmental | Air & Climate | Energy demand and consumption -> ""The government, he said, was also working with local and international partners to boost Zambia's energy and transport infrastructure which will help support the country's mining ambitions."" | ""The president noted that the government has opened up the energy market to private sector players through the open access regime and facilitated off-taker guarantee financing, allowing mining companies to finance captive power to fuel their expansion projects."" || Governance | Regulation, Compliance & Institutions | Legislative and regulatory framework effectiveness -> ""According to him, Zambia has a stable and predictable legal, regulatory and fiscal regime in the mining sector.""",,Lusaka,copper,,Environmental || Governance,"Air & Climate || Regulation, Compliance & Institutions",Energy demand and consumption || Legislative and regulatory framework effectiveness
https://www.bloomberg.com/news/articles/2024-02-05/zambia-to-start-trading-its-own-copper-competing-with-glencore,20240205,,wayback_ok,1.0,1.0,0.9,"Governance | Transparency & Accountability | Corporate transparency and reporting -> ""Country says trading the metal will boost pricing transparency"" || Social | Equity, Rights & Vulnerable Groups | Wealth distribution and inequality -> ""Government could receive copper instead of mining royalties""",,,copper,,Governance || Social,"Transparency & Accountability || Equity, Rights & Vulnerable Groups",Corporate transparency and reporting || Wealth distribution and inequality
https://www.business-standard.com/world-news/vedanta-weighs-sale-of-minority-stake-holding-in-zambian-copper-assets-124020701725_1.html,20240207,,live_ok_newspaper,0.99,0.99,0.8,"Governance | Regulation, Compliance & Institutions | Mining permitting and licensing practices -> ""Ties between Zambia and Vedanta soured after former President Edgar Lungu's government orchestrated the seizure of the KCM assets and forced liquidation in May 2019, after accusing the company of failing to meet plans to invest in increasing mining output."" || Governance | Reputation & Social License | Mining image and public perception -> ""Zambia agreed last September to return control of KCM to Vedanta, which is owned by Indian billionaire Anil Agarwal, ending a row over the ownership of the assets that erupted in 2019 when authorities seized the mines."" | ""Ties between Zambia and Vedanta soured after former President Edgar Lungu's government orchestrated the seizure of the KCM assets and forced liquidation in May 2019, after accusing the company of failing to meet plans to invest in increasing mining output.""",Konkola Copper Mines,,copper,Vedanta,Governance || Governance,"Regulation, Compliance & Institutions || Reputation & Social License",Mining permitting and licensing practices || Mining image and public perception
https://www.cnbc.com/2024/02/05/bill-gates-backed-miner-discovers-large-scale-copper-deposit-in-zambia.html,20240205,Bill Gates-backed miner discovers large-scale copper deposit in Zambia,live_ok_trafilatura,0.99,0.99,0.7,"Social | Livelihoods & Economy | Income generation and poverty reduction or exacerbation -> ""KoBold Metals has said it aims to start producing copper at its mine in Zambia within 10 years, in a project that could have significant economic ramifications for the African nation."" | """"There is a lot that we as Zambians can look forward to in terms of the announcement of their mine development which should be coming on stream,"" Kayumba said in a video posted Monday on social media site X.""",Mingomba copper project,,copper,KoBold Metals,Social,Livelihoods & Economy,Income generation and poverty reduction or exacerbation
https://www.cnbcafrica.com/media/6346343417112/-kabuswe-zambia-sees-massive-investment-interest-in-mining-sector-/,20240206,Kabuswe: Zambia sees massive investment interest in mining sector - CNBC Africa,live_ok_trafilatura,0.99,0.95,0.75,"Social | Livelihoods & Economy | Income generation and poverty reduction or exacerbation -> ""The Minister highlighted the importance of ensuring social impact and benefits for local communities in mining projects"" || Governance | Stakeholder Engagement & Rights | Stakeholder inclusion in decision-making -> ""emphasizing the need for a holistic approach to negotiations that includes considerations for Environmental, Social, and Governance (ESG) factors.""",Lumwana Mine,,Cobalt,,Social || Governance,Livelihoods & Economy || Stakeholder Engagement & Rights,Income generation and poverty reduction or exacerbation || Stakeholder inclusion in decision-making
https://www.cnbcafrica.com/media/6346402404112/lubamba-zambia-looking-to-partner-more-with-investors/,20240207,Lubamba: Zambia looking to partner more with investors - CNBC Africa,live_ok_trafilatura,0.99,0.95,0.85,"Environmental | Air & Climate | Fossil fuel consumption -> ""While traditional fossil fuels remain a part of the energy mix"" || Environmental | Air & Climate | Clean/renewable energy integration (mitigation-related impact) -> ""the transition towards decarbonization underscores the importance of responsible development and funding allocation"" || Social | Livelihoods & Economy | Business opportunities (local supply chains, services) -> ""Stanbic Bank Zambia, one of the largest funders in the mining sector, has actively participated in major projects while eyeing more partnerships in the future."" | ""Guarantee schemes and risk-sharing mechanisms aim to mitigate financial risks and attract commercial financing into the sector."" || Governance | Stakeholder Engagement & Rights | Stakeholder inclusion in decision-making -> ""the shift towards formalization, supported by government initiatives and collaboration with private sector lenders, is key to unlocking financial support for smaller operations.""",,,cobalt,First Quantum,Environmental || Environmental || Social || Governance,Air & Climate || Air & Climate || Livelihoods & Economy || Stakeholder Engagement & Rights,"Fossil fuel consumption || Clean/renewable energy integration (mitigation-related impact) || Business opportunities (local supply chains, services) || Stakeholder inclusion in decision-making"
https://www.dailymaverick.co.za/article/2024-02-06-zambian-mining-gets-huge-investment-boost-under-hichilema-7bn-in-two-years/,20240206,Investment in Zambian mining surges under Hichilema,live_ok_trafilatura,0.99,0.98,0.8,"Governance | Regulation, Compliance & Institutions | Legislative and regulatory framework effectiveness -> ""Zambia has a stable and predictable mining, legal, regulatory and fiscal regime; as we committed to you during the 2022 mining indaba."" || Social | Livelihoods & Economy | Business opportunities (local supply chains, services) -> ""- First Quantum Minerals is also making strong progress with the s3 expansion of the Kansanshi mine and smelter, investing more than $1-billion and boosting downstream beneficiation;"" | ""He cited, for instance, Zambiaâs memorandum of understanding with the Democratic Republic of Congo and the US to develop an integrated value chain for the production of electric vehicle batteries in both countries."" || Environmental | Air & Climate | Clean/renewable energy integration (mitigation-related impact) -> ""- The UK-Zambia green growth compact, opening up $3-billion in private-sector and government funding for renewable energy projects across Zambia;"" | ""- The Copperbelt Energy Company $200-million green bond issued, to finance solar, wind and other renewable energy projects;"" || Environmental | Air & Climate | Energy demand and consumption -> ""- Opening up the energy market to private-sector players through the open-access regime including facilitating off-taker guarantee financing, allowing mining companies to finance captive power to fuel their expansion projects;"" || Environmental | Land, Soil & Geology | Transport corridors and access road impacts -> ""Lining up infrastructure projects such as the Zambia-Lobito rail line and upgrading the Tazara railway line to provide a smoother route to markets for mining operations."" || Governance | Stakeholder Engagement & Rights | Conflict management between companies and communities -> ""International Resources Holding and Vedanta Resources have invested a combined $2.3-billion into Mopani Mine and Konkola Copper Mines, helping Zambia to âmake substantial progress in resolving the legacy issuesâ, Hichilema said, referring to the paralysing disputes which the foreign investors in these two ânational assetsâ had had with Lungu.""",Enterprise Nickel Mine; Kansanshi; Mimbula; Mingomba; Lumwana; Luanshya; Mopani Mine; Konkola Copper Mines,Copperbelt,copper,First Quantum Minerals; Moxico Resources; Kobold Metals; Barrick Gold Corporation; China Nonferrous Mining Corporation; International Resources Holding; Vedanta Resources; Gemfields; Copperbelt Energy Company,Governance || Social || Environmental || Environmental || Environmental || Governance,"Regulation, Compliance & Institutions || Livelihoods & Economy || Air & Climate || Air & Climate || Land, Soil & Geology || Stakeholder Engagement & Rights","Legislative and regulatory framework effectiveness || Business opportunities (local supply chains, services) || Clean/renewable energy integration (mitigation-related impact) || Energy demand and consumption || Transport corridors and access road impacts || Conflict management between companies and communities"
https://www.finanznachrichten.de/nachrichten-2024-02/61310210-zccm-ih-notice-of-egm-650.htm,20240202,ZCCM-IH Notice of EGM,live_ok_trafilatura,0.98,0.98,0.85,"Governance | Stakeholder Engagement & Rights | Stakeholder inclusion in decision-making -> ""NOTICE IS HEREBY GIVEN that the Extraordinary Meeting of the shareholders of ZCCM-IH will be held on Friday 23rd February 2024 ..."" | ""The Extraordinary Meeting is convened by ZCCM-IH to: - Seek the approval of the shareholders of ZCCM-IH for the transaction relating to up to a US$1.1 billion investment by International Resources Holding RSC Limited (""IRH""), through its wholly owned subsidiary, Delta Mining Limited (""Delta""), for a 51% interest in Mopani Copper Mines plc (""Mopani"")."" | ""As a Category 1 transaction under the LuSE Listing Rules, Shareholder approval is required for the Transaction."" || Governance | Transparency & Accountability | Corporate transparency and reporting -> ""The Circular includes: - Salient terms of the Transaction;. - A Competent Persons Report prepared by an independent consultant; and - An Independent Reporting Accountants Report"" | ""The Circular will be available to Shareholders electronically on the following link: https://zccm-ih.financifi.com/download/zccm-ih_mopani_transaction_circular/ from 2nd February 2024.""",Mopani Copper Mines plc,,copper,Mopani Copper Mines plc,Governance || Governance,Stakeholder Engagement & Rights || Transparency & Accountability,Stakeholder inclusion in decision-making || Corporate transparency and reporting
https://www.lusakatimes.com/2024/01/25/barrick-lumwana-mine-expands-operations-in-zambia-boosting-copper-production-and-job-opportunities/,20240125,"Zambia : Barrick Lumwana Mine Expands Operations in Zambia, Boosting Copper Production and Job Opportunities",live_ok_trafilatura,0.95,0.95,0.9,"Social | Livelihoods & Economy | Employment creation and job security -> ""the expansion to create approximately 1,000 jobs during the construction phase and an additional 600 direct jobs upon project completion."" || Social | Livelihoods & Economy | Income generation and poverty reduction or exacerbation -> ""The mine has injected almost $3 billion into the Zambian economy through royalties, taxes, salaries, and local procurement."" || Social | Livelihoods & Economy | Business opportunities (local supply chains, services) -> ""Local procurement has been a cornerstone of Lumwana's contribution, with over $472 million in 2023, representing more than 81% of the total spend for the mine."" | ""Barrick has also initiated a Business Accelerator Program, aiming to enhance the business capacity of Zambian contractors in its supply chain."" || Governance | Regulation, Compliance & Institutions | Mining permitting and licensing practices -> ""Discussions with the Ministry of Green Economy and Environment are underway to facilitate licensing""",Lumwana copper mine,"Solwezi, Copperbelt",copper,Barrick,Social || Social || Social || Governance,"Livelihoods & Economy || Livelihoods & Economy || Livelihoods & Economy || Regulation, Compliance & Institutions","Employment creation and job security || Income generation and poverty reduction or exacerbation || Business opportunities (local supply chains, services) || Mining permitting and licensing practices"
https://www.lusakatimes.com/2024/01/26/gpz-president-jackson-silavwe-proposes-economic-revitalization-measures-for-zambia/,20240126,Zambia : GPZ President Jackson Silavwe Proposes Economic Revitalization Measures for Zambia,live_ok_trafilatura,0.99,0.97,0.88,"Governance | Regulation, Compliance & Institutions | Legislative and regulatory framework effectiveness -> ""Declare sugilite, gold, and lithium as state assets through an act of parliament."" | ""Enact laws to prohibit the exportation of unprocessed minerals from mining."" | ""Gradually minimize and eliminate tax holidays for foreign companies operating in Zambia."" | ""Increase taxes on the mining sector."" | ""Enhance government revenue generated from the mining sector."" | ""Deposit sugilite and gold in the Bank of Zambia (BOZ) as part of the strategic national reserves."" || Governance | Transparency & Accountability | Corporate transparency and reporting -> ""Cap the externalization of profits by foreign mining companies."" || Social | Livelihoods & Economy | Business opportunities (local supply chains, services) -> ""Award large contracts to local Zambian companies."" | ""Create incentives for local small and medium businesses."" | ""Provide tax, levies, and statutory incentives to local small and medium businesses."" | ""Construct government-owned gold and lithium processing plants.""",,,"gold, lithium, sugilite",,Governance || Governance || Social,"Regulation, Compliance & Institutions || Transparency & Accountability || Livelihoods & Economy","Legislative and regulatory framework effectiveness || Corporate transparency and reporting || Business opportunities (local supply chains, services)"
https://www.lusakatimes.com/2024/01/27/barrick-lumwana-mine-fires-20-drunk-workers/,20240127,Zambia : Barrick Lumwana Mine Fires 20 Drunk Workers,live_ok_trafilatura,0.9,0.98,0.85,"Social | Health, Safety & Well-being | Worker health and safety risks -> ""Barrick Lumwana Mine has reaffirmed its commitment to a zero alcohol tolerance policy on the mine site, leading to the dismissal of twenty employees found in violation of this policy throughout the year 2023."" | ""Musonda emphasized the mine's unwavering stance on maintaining a work environment free from the influence of alcohol, with any employee testing positive for alcohol being subject to immediate termination."" | ""This initiative aims to create a workplace environment with zero accidents and incidents, aligning with the mine's dedication to prioritizing the well-being and safety of its workforce."" || Social | Livelihoods & Economy | Employment creation and job security -> ""leading to the dismissal of twenty employees found in violation of this policy throughout the year 2023."" | ""out of the twenty dismissed individuals, five were direct employees of Barrick Lumwana Mine, while the remaining fifteen were employees of contracted companies working at the mine."" || Governance | Regulation, Compliance & Institutions | Enforcement of environmental and social regulations -> ""Chileshe acknowledged that enforcing the zero alcohol policy posed challenges, particularly among employees of mine contractors."" | ""He highlighted the need for heightened compliance awareness and efforts to ensure that all individuals working on the mine site adhere to the established safety protocols and regulations.""",Lumwana Mine,,,Barrick,Social || Social || Governance,"Health, Safety & Well-being || Livelihoods & Economy || Regulation, Compliance & Institutions",Worker health and safety risks || Employment creation and job security || Enforcement of environmental and social regulations
https://www.lusakatimes.com/2024/02/03/government-anticipates-kwacha-stabilization/,20240203,Zambia : Government Anticipates Kwacha Stabilization,live_ok_trafilatura,0.99,0.99,0.8,"Social | Livelihoods & Economy | Business opportunities (local supply chains, services) -> ""the investor in KCM has already infused $80 million to pay creditors and suppliers""",Konkola Copper Mines (KCM); Mopani Copper Mines,,copper,,Social,Livelihoods & Economy,"Business opportunities (local supply chains, services)"
https://www.lusakatimes.com/2024/02/06/kobold-metals-unveils-monumental-copper-discovery-in-zambia/,20240206,Zambia : KoBold Metals Unveils Monumental Copper Discovery in Zambia,live_ok_trafilatura,0.99,0.99,0.9,"Governance | Reputation & Social License | Mining image and public perception -> ""The monumental copper discovery at Mingomba has the potential to significantly boost Zambia's standing in the global mining industry."" | ""As Zambia positions itself as a key player in meeting the escalating demand for critical metals, the fast-tracking of the KoBold Metals project represents a pivotal moment in the nation's mining history.""",Mingomba,,copper,KoBold Metals,Governance,Reputation & Social License,Mining image and public perception
