sourceurl,sqldate,title,scrape_status,in_zambia_confidence,mining_related_confidence,impact_confidence,impact_evidence,mine_name,region,mineral_type,mining_company,impact_level1,impact_level2,impact_level3
https://www.news24.com/fin24/economy/africa/ethereum-founder-is-backing-zambias-bid-to-be-africas-tech-hub-20220328,20220328,Ethereum founder is backing Zambia's bid to be Africa's tech hub | News24,live_ok_newspaper,1.0,0.85,0.6,"Social | Livelihoods & Economy | Employment creation and job security -> ""attracting tech firms could be a means of delivering on one of his key election pledges -- boosting employment."" | ""help ease dependence on copper, which accounts for 75% of export earnings."" || Social | Livelihoods & Economy | Income generation and poverty reduction or exacerbation -> ""help ease dependence on copper, which accounts for 75% of export earnings."" | ""More than one in four Zambians under the age of 24 have no income, according to data from the International Labour Organization, and the ratio has been worsening since 2013."" || Social | Livelihoods & Economy | Human capital development (skills, training, workforce development) -> ""Governments ""risk missing the proverbial boat by over-investing in extractives and under-investing in software. Tech uplifts multitudes of people and the barrier to entry is very, very low."""" | ""He has since created the Ministry of Technology and Science as part of a drive to support the sector and help ease dependence on copper""",,Lusaka,copper,,Social || Social || Social,Livelihoods & Economy || Livelihoods & Economy || Livelihoods & Economy,"Employment creation and job security || Income generation and poverty reduction or exacerbation || Human capital development (skills, training, workforce development)"
https://www.newzimbabwe.com/zim-tech-preneur-among-early-movers-as-zambia-bids-to-be-africas-tech-hub/,20220328,Zim Tech-preneur Among Early Movers As Zambia Bids To Be Africa's Tech Hub - NewZimbabwe.com,live_ok_trafilatura,0.95,0.95,0.7,"Governance | Reputation & Social License | Mining image and public perception -> ""ZAMBIA may be better known for mining copper than crypto"" || Social | Livelihoods & Economy | Income generation and poverty reduction or exacerbation -> ""help ease dependence on copper, which accounts for 75% of export earnings.""",,,copper,,Governance || Social,Reputation & Social License || Livelihoods & Economy,Mining image and public perception || Income generation and poverty reduction or exacerbation
https://www.polity.org.za/article/zambias-copper-potential-coming-to-fore-again-as-castillo-survey-shows-upside-2022-04-05,20220405,Zambia's copper potential coming to fore again as Castillo survey shows upside,live_ok_newspaper,0.99,0.99,0.9,"Environmental | Land, Soil & Geology | Tailings generation and management -> ""Zambia's copper tailings on surface in waste deposits are also being targeted as a means of recovering copper at comparatively low cost."" || Environmental | Biodiversity & Ecosystems | Ecosystem recovery through reclamation and restoration (post-mining impact) -> ""This is part of the world's new circular economy thinking, with copper-containing waste removal also uplifting the environment."" || Social | Livelihoods & Economy | Income generation and poverty reduction or exacerbation -> ""copper remained a major contributor to Zambia's national treasury, and by regaining ground in copper, the country would earn substantial foreign exchange for the benefit of the Zambian people.""",Mkushi,Mkushi; Luanshya; Lumwana North; Lumwana South; Mwansa; Copperbelt,copper,Castillo Copper,Environmental || Environmental || Social,"Land, Soil & Geology || Biodiversity & Ecosystems || Livelihoods & Economy",Tailings generation and management || Ecosystem recovery through reclamation and restoration (post-mining impact) || Income generation and poverty reduction or exacerbation
https://www.scirp.org/journal/paperinformation.aspx?paperid=116367,20220402,Economic Growth and Its Pro-Poorness in Zambia 2006-2015: To What Extent?,live_ok_trafilatura,1.0,0.98,0.85,"Social | Livelihoods & Economy | Income generation and poverty reduction or exacerbation -> ""Their findings indicate that returning to copper-led growth path is not pro-poor and that non-mining urban growth combined with diversification through an agriculture-led development strategy is likely to prove most pro-poor."" | ""The positive economic growth was largely attributed to key sectors including construction, mining, manufacturing, electricity gas and water, transport, storage, and communication (Government of Zambia, 2007-2016)."" | ""Despite the high GDP growth rates recorded, one realises that poverty in Zambia is pervasive and seems to be on the higher side over the years with a rural face...""",,,"copper, cobalt, gold",,Social,Livelihoods & Economy,Income generation and poverty reduction or exacerbation
https://www.timeslive.co.za/sunday-times-daily/world/2022-03-27-zambia-all-aflutter-as-it-sets-about-outing-extractives-to-wave-in-fintech/,20220327,Zambia all aflutter as it sets about outing extractives to wave in fintech,live_ok_trafilatura,0.99,0.9,0.75,"Social | Livelihoods & Economy | Employment creation and job security -> ""attracting tech firms could be a means of delivering on one of his key election pledges — boosting employment."" || Social | Livelihoods & Economy | Income generation and poverty reduction or exacerbation -> ""Tech uplifts multitudes of people and the barrier to entry is very, very low.""",,Lusaka,copper,,Social || Social,Livelihoods & Economy || Livelihoods & Economy,Employment creation and job security || Income generation and poverty reduction or exacerbation
