sourceurl,sqldate,title,scrape_status,in_zambia_confidence,mining_related_confidence,impact_confidence,impact_evidence,mine_name,region,mineral_type,mining_company,impact_level1,impact_level2,impact_level3
https://morningstaronline.co.uk/article/b/zambia-set-to-take-british-mine-in-house,20190522,Zambia set to take British mine in house | Morning Star,live_ok_newspaper,0.99,0.99,0.8,"Governance | Stakeholder Engagement & Rights | Stakeholder inclusion in decision-making -> ""following demands from trade unionists."" | ""appears to have heeded their calls over Vedanta Resources""",,,copper,Vedanta Resources,Governance,Stakeholder Engagement & Rights,Stakeholder inclusion in decision-making
https://news.yahoo.com/zambia-seeks-investor-vedanta-controlled-copper-miner-114402831--finance.html,20180520,Zambia seeks 'divorce' from Vedanta over alleged mining breaches,live_ok_trafilatura,1.0,1.0,0.9,"Governance | Regulation, Compliance & Institutions | Mining permitting and licensing practices -> ""Zambia plans to strip Vedanta-controlled Konkola Copper Mines (KCM) of its mining licence and bring a new investor into the operation"" | ""a notice had been issued to KCM in April last year over a number of breaches of the terms of its licence and it had not convinced the government it should keep the licence"" || Social | Livelihoods & Economy | Unemployment risks post-closure -> ""Some miners have already reduced or threatened to cut output, although First Quantum said it had abandoned plans to lay off workers."" | ""Union leaders on Monday called on Glencore to reverse its decision to close two shafts."" || Social | Livelihoods & Economy | Business opportunities (local supply chains, services) -> ""Zambia, Africa's second-biggest copper producer, has also proposed tax changes that Lungu says he will push through, despite opposition from international miners which say they will deter investment that Zambia desperately needs."" || Governance | Reputation & Social License | Social license to operate -> ""Demonstrators marched in Chingola in Zambia's copper belt to welcome the decision to bring in another investor."" | ""with public opinion turning against China's extensive asset ownership in the country""",Konkola Copper Mines,Chingola,copper,Vedanta,Governance || Social || Social || Governance,"Regulation, Compliance & Institutions || Livelihoods & Economy || Livelihoods & Economy || Reputation & Social License","Mining permitting and licensing practices || Unemployment risks post-closure || Business opportunities (local supply chains, services) || Social license to operate"
https://www.business-standard.com/article/companies/vedanta-willing-to-invest-in-zambia-copper-mine-seeks-right-framework-119052900896_1.html,20190529,,live_ok_newspaper,1.0,1.0,0.9,"Social | Livelihoods & Economy | Employment creation and job security -> """"I am prepared to invest what is required to increase production safely and sustainably to 400,000 tonnes, creating another 10,000 jobs at KCM and more social benefits,"" he said."" | ""KCM is one of Zambia's largest employees, creating work for around 13,000 people."" || Social | Livelihoods & Economy | Unemployment risks post-closure -> ""Glencore has said it is closing shafts that are no longer economic."" | ""First Quantum said it had abandoned plans to lay off workers, but Glencore has said it is closing shafts that are no longer economic."" | ""he said a lot of mining companies were considering leaving Zambia."" || Governance | Regulation, Compliance & Institutions | Mining permitting and licensing practices -> ""Vedanta is fighting Zambia's decision this month to name a provisional liquidator to run Vedanta Resources' KCM business."" | ""The government has accused KCM of breaching its operating licence."" || Governance | Reputation & Social License | Mining image and public perception -> ""Agarwal said ""the current position"" of the Zambian government would harm the country's ""investor-friendly status"" and he said a lot of mining companies were considering leaving Zambia.""",KCM,,,Vedanta Resources,Social || Social || Governance || Governance,"Livelihoods & Economy || Livelihoods & Economy || Regulation, Compliance & Institutions || Reputation & Social License",Employment creation and job security || Unemployment risks post-closure || Mining permitting and licensing practices || Mining image and public perception
https://www.business-standard.com/article/pti-stories/zambia-appoints-administrator-for-vedanta-owned-copper-firm-119052101689_1.html,20190521,,live_ok_newspaper,0.99,0.99,0.85,"Social | Livelihoods & Economy | Unemployment risks post-closure -> ""tax proposals could trigger a mass withdrawal of investment and thousands of redundancies."" || Social | Livelihoods & Economy | Employment creation and job security -> ""KCM, which employs 13,000 people, said in a statement on Monday..."" || Governance | Regulation, Compliance & Institutions | Legislative and regulatory framework effectiveness -> ""President Edgar Lungu last week warned that international mining companies were free to leave the copper-rich country if they opposed the new tax regime."" | ""The government has targeted the mining sector to generate revenue as the country struggles under growing debt, but businesses have warned that the tax proposals could trigger a mass withdrawal of investment and thousands of redundancies."" || Governance | Reputation & Social License | Trust between mining companies, government, and communities -> """"Private property rights look increasingly vulnerable as the government grapples with a sovereign debt crisis,"" said Nick Branson, analyst with London-based Verisk Maplecroft.""",Konkola Copper Mines,,copper,Vedanta Resources,Social || Social || Governance || Governance,"Livelihoods & Economy || Livelihoods & Economy || Regulation, Compliance & Institutions || Reputation & Social License","Unemployment risks post-closure || Employment creation and job security || Legislative and regulatory framework effectiveness || Trust between mining companies, government, and communities"
https://www.business-standard.com/article/pti-stories/zambia-president-threatens-mining-companies-over-tax-119051701477_1.html,20190517,,live_ok_newspaper,0.99,0.96,0.85,"Social | Livelihoods & Economy | Unemployment risks post-closure -> """"businesses have warned that the tax proposals could trigger a mass withdrawal of investment and thousands of redundancies."""" || Governance | Regulation, Compliance & Institutions | Legislative and regulatory framework effectiveness -> """"Sales tax is here to stay... and those who don't want it, will leave,"" Lungu told cheering supporters in Ndola, ... as he started a tour of Zambia's mining belt."" | ""Lungu has targeted the mining sector to generate revenue as the country struggles under growing debt"" || Governance | Transparency & Accountability | Corporate transparency and reporting -> """"Piling on criticism of mining giants operating in Zambia such as Vedanta and Glencore, he added: 'I am saying this without fear or favour -- they have externalised a lot of money.'"""" || Governance | Reputation & Social License | Mining image and public perception -> """"Piling on criticism of mining giants operating in Zambia such as Vedanta and Glencore,"""" | """"Enough is enough, people are tired and we are not scaring investors because others will come.""""",,Copperbelt province,copper,"Vedanta, Glencore",Social || Governance || Governance || Governance,"Livelihoods & Economy || Regulation, Compliance & Institutions || Transparency & Accountability || Reputation & Social License",Unemployment risks post-closure || Legislative and regulatory framework effectiveness || Corporate transparency and reporting || Mining image and public perception
https://www.businesslive.co.za/bd/companies/mining/2019-05-29-news-analysis-zambian-leader-edgar-lungu-repeats-past-errors-with-attack-on-copper-miners/,20190529,NEWS ANALYSIS: Zambian leader Edgar Lungu repeats past errors with attack on copper miners,live_ok_trafilatura,0.99,0.99,0.9,"Social | Livelihoods & Economy | Unemployment risks post-closure -> ""The government's call for the operations to be passed to local contractors is aimed primarily at preventing job losses"" | ""Chambishi has been mothballed, while KCM's Nchanga smelter has reduced output"" || Governance | Regulation, Compliance & Institutions | Legislative and regulatory framework effectiveness -> ""It's an example of how an aggressive raft of tax changes by the Zambian government is pushing up operating costs for the country's miners."" || Social | Livelihoods & Economy | Equipment and materials availability affecting local labor markets -> ""A 5% import tax on raw materials has cut off the flow of concentrates from neighbouring Democratic Republic of Congo to both plants."" || Social | Livelihoods & Economy | Income generation and poverty reduction or exacerbation -> ""The Zambian Chamber of Mines has warned that the country's copper output could fall by as much as 100,000 tonnes this year because operators ""cannot afford to continue producing as before""."" || Governance | Regulation, Compliance & Institutions | Mining permitting and licensing practices -> ""The government accuses KCM of breaching its operating licence and is threatening to strip Vedanta of its stake and sell it to another investor."" || Governance | Transparency & Accountability | Accountability for accidents and environmental damage -> ""There is a running dispute about tax payments, while allegations of environmental damage are currently being heard by England's supreme court.""",Konkola Copper Mines,Kitwe,copper,Vedanta,Social || Governance || Social || Social || Governance || Governance,"Livelihoods & Economy || Regulation, Compliance & Institutions || Livelihoods & Economy || Livelihoods & Economy || Regulation, Compliance & Institutions || Transparency & Accountability",Unemployment risks post-closure || Legislative and regulatory framework effectiveness || Equipment and materials availability affecting local labor markets || Income generation and poverty reduction or exacerbation || Mining permitting and licensing practices || Accountability for accidents and environmental damage
https://www.businesslive.co.za/bd/opinion/2019-05-21-backlash-against-zambias-new-mining-tax-is-loud-but-baseless/,20190521,Backlash against Zambia's new mining tax is loud but baseless,live_ok_trafilatura,0.99,0.98,0.87,"Social | Livelihoods & Economy | Employment creation and job security -> ""Several companies claimed that they would be forced to lay off thousands of workers and halt new investments."" | ""First Quantum Minerals, accounting for more than half of Zambia's copper production, quietly announced this year that it would not move forward with its earlier threat to slash 2,500 jobs."" || Social | Livelihoods & Economy | Business opportunities (local supply chains, services) -> ""Several companies claimed that they would be forced to lay off thousands of workers and halt new investments."" || Governance | Transparency & Accountability | Corporate transparency and reporting -> ""when the government requested them to provide a transparent accounting breakdown of exactly how the new taxes would impact their business, they refused to answer."" | ""allegedly underreporting their earnings in official accounting all while threatening massive layoffs and unviability at any mention of a tax increase."" | ""these companies ... still chronically underreport their earnings."" || Social | Livelihoods & Economy | Income generation and poverty reduction or exacerbation -> ""Latest research by British NGO War on Want indicates that the Zambian public is losing out on a mind-boggling $3bn a year in tax revenue — equivalent to more than half the government budget in 2013"" | ""ensuring that the revenue from its extraction reaches the Zambian people is paramount."" || Governance | Reputation & Social License | Social license to operate -> ""Right now all the attention is focused on the confrontation with the multinational shareholders of Konkola Copper Mines (KCM), who have been steadfast in their rejection of co-operation and compliance with the new tax regime. This has forced the leadership to take legal steps to notify the investors that Zambia is willing to part ways and invite new partners to the country that respect our sovereignty.""",Konkola Copper Mines,Copperbelt,copper,Vedanta,Social || Social || Governance || Social || Governance,Livelihoods & Economy || Livelihoods & Economy || Transparency & Accountability || Livelihoods & Economy || Reputation & Social License,"Employment creation and job security || Business opportunities (local supply chains, services) || Corporate transparency and reporting || Income generation and poverty reduction or exacerbation || Social license to operate"
https://www.fastmarkets.com/article/3875249/focus-kcm-liquidation-order-what-is-at-stake-what-will-happen-to-zambian-copper-industry,20190522,"FOCUS: KCM liquidation order - what is at stake, what will happen to Zambian copper industry? - Fastmarkets",live_ok_trafilatura,0.99,0.99,0.9,"Environmental | Water Resources | Surface water pollution and quality degradation -> ""a group of Zambian villagers were granted permission to sue the company for alleged water pollution through courts in the United Kingdom"" || Social | Livelihoods & Economy | Unemployment risks post-closure -> ""The new tax regime came into effect despite causing capacity cuts and layoffs at major producers including KCM, First Quantum and China-owned Chambishi."" || Governance | Regulation, Compliance & Institutions | Legislative and regulatory framework effectiveness -> ""The relationship between the country's copper miners and the Zambian government has been heavily strained by disputes over the country's new tax regime."" || Governance | Transparency & Accountability | Accountability for accidents and environmental damage -> ""a group of Zambian villagers were granted permission to sue the company for alleged water pollution through courts in the United Kingdom"" || Governance | Reputation & Social License | Social license to operate -> ""who will have enough confidence to take over KCM's assets after the government tried to get rid of one of the country's largest private-sector employers?"" | ""also sent a chill down the spines of other Zambian copper producers""",Konkola and Nchanga mines; Nchanga smelter,,copper,Konkola Copper Mines,Environmental || Social || Governance || Governance || Governance,"Water Resources || Livelihoods & Economy || Regulation, Compliance & Institutions || Transparency & Accountability || Reputation & Social License",Surface water pollution and quality degradation || Unemployment risks post-closure || Legislative and regulatory framework effectiveness || Accountability for accidents and environmental damage || Social license to operate
https://www.jdsupra.com/legalnews/supreme-court-affirms-in-vedanta-a-43279/,20190524,Supreme Court affirms in Vedanta a general principles path to hear Zambian environmental claims | BCLP - JDSupra,live_ok_trafilatura,0.95,0.95,0.9,"Environmental | Water Resources | Surface water pollution and quality degradation -> ""alleged discharges of toxic matter from the Nchanga mine in Zambia, owned and operated by Konkola, into local watercourses that provides their sole source of drinking water."" || Environmental | Water Resources | Freshwater ecotoxicity (heavy metals, pH changes, sensitive species) -> ""alleged discharges of toxic matter from the Nchanga mine in Zambia, owned and operated by Konkola, into local watercourses that provides their sole source of drinking water."" || Social | Health, Safety & Well-being | Mental and physical health impacts on communities -> ""are suing Konkola Copper Mines plc ... and Vedanta Resources plc ... for damage to their health, property, livelihood and enjoyment /amenity in connection with alleged discharges of toxic matter..."" || Social | Livelihoods & Economy | Income generation and poverty reduction or exacerbation -> ""are suing Konkola Copper Mines plc ... and Vedanta Resources plc ... for damage to their health, property, livelihood and enjoyment /amenity in connection with alleged discharges of toxic matter...""",Nchanga mine,,copper,Konkola Copper Mines plc,Environmental || Environmental || Social || Social,"Water Resources || Water Resources || Health, Safety & Well-being || Livelihoods & Economy","Surface water pollution and quality degradation || Freshwater ecotoxicity (heavy metals, pH changes, sensitive species) || Mental and physical health impacts on communities || Income generation and poverty reduction or exacerbation"
https://www.lusakatimes.com/2019/05/17/president-lungu-expected-on-the-copperbelt-for-a-3-days-working-visit/,20190516,Zambia : President Lungu expected on the Copperbelt for a 3 days working visit,live_ok_trafilatura,1.0,1.0,0.9,"Social | Livelihoods & Economy | Employment creation and job security -> ""President Lungu's desire is to ensure that the jobs of all workers in the mining sector are protected"" | ""Workers from Mopani Copper Mine and Konkola Copper Mine appealed to President Lungu to intervene in the matter after the two mining giants threatened to scale down on employees as a means to cushion the impact of the new mining tax changes on their operations."" || Governance | Regulation, Compliance & Institutions | Mining permitting and licensing practices -> ""Mr Musukwa threatened that government would repossess the mining shafts from the two mining firms and engage local contractors to run them as a means to safeguard jobs."" || Governance | Stakeholder Engagement & Rights | Stakeholder inclusion in decision-making -> ""the President would soon meet the Chamber of Mines, an umbrella body of the mining houses and Mineworkers Union of Zambia, to discuss the matter."" | ""He said the Head of State wanted to hold a constructive dialogue with stakeholders to resolve the impasse with the mining houses.""",Mopani Copper Mine; Konkola Copper Mine,Copperbelt Province,copper,,Social || Governance || Governance,"Livelihoods & Economy || Regulation, Compliance & Institutions || Stakeholder Engagement & Rights",Employment creation and job security || Mining permitting and licensing practices || Stakeholder inclusion in decision-making
https://www.lusakatimes.com/2019/05/18/zacci-calls-for-consistent-policy-implementation/,20190518,Zambia : ZACCI calls for consistent policy implementation,live_ok_trafilatura,0.95,0.85,0.8,"Social | Livelihoods & Economy | Business opportunities (local supply chains, services) -> ""He states that other factors that contributed to the decrease include policy inconsistency, lost contracts to supply the mines, particularly on the Copperbelt Province and poor rainfall especially in Southern Province."" | ""ZACCI President Michael Nyirenda says government should consider timely payment to suppliers for goods and services in order to avoid shocking the businesses."" | ""Mr Nyirenda has since attributed the decrease in the depreciation of the kwacha, to low sales due to reduced demand, and delayed payments by government, poor liquidity and increase competition from foreign goods."" || Governance | Regulation, Compliance & Institutions | Legislative and regulatory framework effectiveness -> ""The Zambia Chamber of Commerce and Industry (ZACCI) has called on government to be consistent in the implementation of policies in order to ensure a predictable business environment as well as to allow for better planning."" | ""He states that other factors that contributed to the decrease include policy inconsistency, lost contracts to supply the mines, particularly on the Copperbelt Province and poor rainfall especially in Southern Province.""",,Copperbelt Province,,,Social || Governance,"Livelihoods & Economy || Regulation, Compliance & Institutions","Business opportunities (local supply chains, services) || Legislative and regulatory framework effectiveness"
https://www.lusakatimes.com/2019/05/20/mopani-has-assured-government-of-sound-investment-policies-in-its-operations-amos-chanda/,20190520,Zambia : Mopani has assured Government of sound investment policies in its operations-Amos Chanda,live_ok_trafilatura,0.95,0.95,0.8,"Social | Living Conditions & Social Fabric | Social infrastructure and amenities (education, healthcare, public services, leisure) -> ""the President had expressed displeasure on certain issues with Mopani including social services such as health and education."" | ""Mopani Chief Executive Officer, Chris Vermeulen, assured that his firm had not stopped offering medical services at Malcom Watson Hospital, but that it had transferred some of its operations to Wusakile Mine Hospital in Kitwe."" | ""Mr Vermeulen said Mopani would continue with corporate social responsibility programmes in areas where it operates"" || Social | Livelihoods & Economy | Employment creation and job security -> ""Government said no employer must lose jobs on the mines but with impunity, they went ahead and cuts jobs on flimsy grounds simply because of the Sales Tax regime and so, let them go,"" || Governance | Reputation & Social License | Social license to operate -> ""Government's strong stance on Konkola Copper Mines (KCM) is a strong signal to truant investors that Zambia is not a kangaroo nation where the rule of law is trampled upon with impunity thereby rendering citizens to be at the mercy of unscrupulous businesses"" || Governance | Regulation, Compliance & Institutions | Legislative and regulatory framework effectiveness -> ""The President assured that Government would follow the due process of the law in disengaging with the KCM investor, Vedanta Resources."" | ""Government said no employer must lose jobs on the mines but with impunity, they went ahead and cuts jobs on flimsy grounds simply because of the Sales Tax regime""",Mopani Copper Mine; Konkola Copper Mines,Ndola; Kitwe; Copperbelt Province,copper,Mopani Copper Mines; Vedanta Resources,Social || Social || Governance || Governance,"Living Conditions & Social Fabric || Livelihoods & Economy || Reputation & Social License || Regulation, Compliance & Institutions","Social infrastructure and amenities (education, healthcare, public services, leisure) || Employment creation and job security || Social license to operate || Legislative and regulatory framework effectiveness"
https://www.lusakatimes.com/2019/05/21/kcm-takeover-wolves-smell-blood/,20190521,Zambia : KCM takeover-Wolves smell blood,live_ok_trafilatura,0.99,0.99,0.9,"Social | Livelihoods & Economy | Income generation and poverty reduction or exacerbation -> ""So where does this leave the poor sub contractor and miner? In a liquidation, payments to employees and subcontractors will be among the last to be paid."" | ""employees and the business community will suffer as there is little or no hope for them to get their benefits and payments."" | ""How will this broke government look for money from the treasury to pay the miners and sub contractors when they are failing to pay salaries? How long will the miners and subcontractors have to wait now that the mine is in liquidation."" || Social | Livelihoods & Economy | Equipment and materials availability affecting local labor markets -> ""auctioning of the mining equipment to raise the needed funds will be impossible because most of the mining equipment is not owned by KCM but subcontractors who actually do the mining."" || Governance | Transparency & Accountability | Anti-corruption and bribery risks -> ""This is an opportunity to strip the mine by known friends of Mr Lungu who belong within the inner circle of state house."" | ""the wolves have smelt blood and they want to suck the mine assets dry and share proceeds."" | ""it is a deliberate move by those within state house to have control of the looting.""",KCM,"Chingola, Chililabombwe, Copperbelt Province",copper,Vedanta Resources,Social || Social || Governance,Livelihoods & Economy || Livelihoods & Economy || Transparency & Accountability,Income generation and poverty reduction or exacerbation || Equipment and materials availability affecting local labor markets || Anti-corruption and bribery risks
