sourceurl,sqldate,title,scrape_status,in_zambia_confidence,mining_related_confidence,impact_confidence,impact_evidence,mine_name,region,mineral_type,mining_company,impact_level1,impact_level2,impact_level3
http://venturesafrica.com/tanzania-announces-plan-to-build-pipeline-with-zambia-for-refined-petroleum/,20190530,,wayback_ok,0.95,0.7,0.7,"Social | Livelihoods & Economy | Business opportunities (local supply chains, services) -> ""The project will reduce challenges in transporting petroleum products in the countries that use our ports to import fuel and open up business opportunities … The project will be implemented jointly by Zambia and Tanzania,"" Kalemani said."" || Governance | Stakeholder Engagement & Rights | Stakeholder inclusion in decision-making -> ""The project will be implemented jointly by Zambia and Tanzania,"" Kalemani said.""",,Ndola,petroleum,,Social || Governance,Livelihoods & Economy || Stakeholder Engagement & Rights,"Business opportunities (local supply chains, services) || Stakeholder inclusion in decision-making"
http://www.china.org.cn/world/Off_the_Wire/2019-05/25/content_74822201.htm,20190524,Top news items in Zambia's major media outlets - China.org.cn,live_ok_trafilatura,0.95,0.95,0.9,"Social | Livelihoods & Economy | Income generation and poverty reduction or exacerbation -> ""Green Party leader Peter Sinkamba says his party finds government position on liquidation of Konkola Copper Mines (KCM) not only stunning and contradictory but also ill-disposed."" | ""Sinkamba has since advised government to rethink and abandon the strategy before it is too late as it will hurt the economy even more.""",Konkola Copper Mines,,copper,Konkola Copper Mines,Social,Livelihoods & Economy,Income generation and poverty reduction or exacerbation
http://www.globaltimes.cn/content/1151673.shtml,20180526,Chinese mining firm to support more small-holder farmers in Zambia - Global Times,live_ok_trafilatura,0.98,0.98,0.9,"Social | Livelihoods & Economy | Income generation and poverty reduction or exacerbation -> ""Meanwhile, one the beneficiaries of farm inputs from CLM Clement Nkweto said he was excited that the firm was helping vulnerable small-scale farmers with farming inputs."" | ""Chileya said CLM currently supports 100 vulnerable but viable scale farmers in Luanshya district in the Copperbelt Province."" | ""The move is a way of supplementing the government's efforts to diversify into the agricultural sector for increased food production, a spokesperson said on Saturday."" || Social | Living Conditions & Social Fabric | Livability (cost of living, food security, communication services) -> ""Nkweto said it was crucial to support small-scale farmers in the district with farming inputs such as fertilizer to promote household food security in the district and the country as a whole."" || Governance | Stakeholder Engagement & Rights | Stakeholder inclusion in decision-making -> """"As a company, we have a deliberate annual program to support vulnerable but viable small-scale farmers in the district. We are working in collaboration with the office of the Luanshya mayor, the office of the district commissioner, including that of the Member of Parliament, to carry out this program,"" Chileya said.""",Luanshya Copper Mine,"Luanshya district, Copperbelt Province",copper,China Non-ferrous Metal Company Luanshya Copper Mine (CLM),Social || Social || Governance,Livelihoods & Economy || Living Conditions & Social Fabric || Stakeholder Engagement & Rights,"Income generation and poverty reduction or exacerbation || Livability (cost of living, food security, communication services) || Stakeholder inclusion in decision-making"
http://www.mining.com/web/nothing-seems-matter-copper-markets-except-trade-war/,20190520,,live_ok_trafilatura,0.98,0.98,0.75,"Governance | Regulation, Compliance & Institutions | Mining permitting and licensing practices -> ""On Monday, the government filed notification of plans to take over Vedanta's domestic copper assets."" | ""Zambian President Edgar Lungu is escalating a spat with miners including Vedanta Resources Ltd. and Glencore Plc over the share of royalties the country collects from the extraction of its vast reserves of copper."" || Governance | Reputation & Social License | Trust between mining companies, government, and communities -> ""Zambian President Edgar Lungu is escalating a spat with miners including Vedanta Resources Ltd. and Glencore Plc over the share of royalties the country collects from the extraction of its vast reserves of copper."" | ""On Monday, the government filed notification of plans to take over Vedanta's domestic copper assets."" || Social | Living Conditions & Social Fabric | Livability (cost of living, food security, communication services) -> ""The lack of a reaction is even more surprising when compared with other market moves. Zambia's Eurobond yields surged to a record high and the currency hit a 3 1/2-year low."" | ""Copper is slumping toward a three-month low even after Zambia moved closer to nationalizing some of its mines.""",,,copper,Vedanta Resources Ltd.,Governance || Governance || Social,"Regulation, Compliance & Institutions || Reputation & Social License || Living Conditions & Social Fabric","Mining permitting and licensing practices || Trust between mining companies, government, and communities || Livability (cost of living, food security, communication services)"
http://www.mining.com/web/vedanta-kcm-seek-urgent-zambia-talks-court-appoints-liquidator/,20190521,,live_ok_trafilatura,0.98,0.98,0.9,"Social | Livelihoods & Economy | Employment creation and job security -> ""It said Vedanta had invested more than $3 billion since acquiring its stake in KCM in 2004 and employs nearly 13,000 people."" || Social | Livelihoods & Economy | Unemployment risks post-closure -> ""One of Zambia's biggest tax payers First Quantum had threatened to lay off workers because of the new taxes, but later said it had abandoned those plans and was talking to the government."" | ""Glencore has said it will close two mine shafts because they have reached the end of their economic life."" || Governance | Regulation, Compliance & Institutions | Legislative and regulatory framework effectiveness -> ""Zambia, Africa's second-biggest copper producer, has proposed tax changes the president says he will push through, despite opposition from international miners."" | ""They include a new royalty regime, which financial analysts say at the marginal rate would result in a more than 100 percent tax take, and a proposal to replace VAT with a non-refundable sales tax."" || Governance | Regulation, Compliance & Institutions | Mining permitting and licensing practices -> ""A day after President Edgar Lungu announced a plan to strip KCM of its mining licence and bring in new investors, a high court document seen by Reuters, named Zambian law firm Lungu Simwanza & Company to oversee KCM."" | ""According to the document, the firm is appointed to act ""as provisional liquidator"" until the conclusion of the hearing of a petition..."" || Governance | Reputation & Social License | Social license to operate -> ""The news has rattled foreign investors already nervous governments in central African countries are seeking a much bigger share of resource revenues, which they say will discourage investment the region desperately needs.""",Konkola Copper Mines,,copper,Vedanta,Social || Social || Governance || Governance || Governance,"Livelihoods & Economy || Livelihoods & Economy || Regulation, Compliance & Institutions || Regulation, Compliance & Institutions || Reputation & Social License",Employment creation and job security || Unemployment risks post-closure || Legislative and regulatory framework effectiveness || Mining permitting and licensing practices || Social license to operate
http://www.mining.com/web/vedantas-kcm-unit-said-attract-kazakh-chinese-interest/,20190529,,live_ok_trafilatura,0.98,0.99,0.82,"Environmental | Water Resources | High water consumption -> ""KCM's flagship operation is Konkola Deep, which extends almost a mile underground and is one of the world's wettest mines, with the equivalent of 140 Olympic-sized swimming pools' water pumped to the surface daily."" || Environmental | Water Resources | Water management challenges -> ""KCM's flagship operation is Konkola Deep, which extends almost a mile underground and is one of the world's wettest mines, with the equivalent of 140 Olympic-sized swimming pools' water pumped to the surface daily."" || Governance | Regulation, Compliance & Institutions | Mining permitting and licensing practices -> ""State-owned ZCCM Investments Holdings, which owns 20.6% of KCM, asked the Lusaka High Court on May 20 to liquidate the company because it hasn't met the conditions of its license."" || Governance | Reputation & Social License | Mining image and public perception -> ""the attempted liquidation of KCM ""can only hurt the country's hard-earned democracy and investor-friendly status.""""",Konkola Copper Mines (KCM),Copperbelt region,copper,Vedanta Resources,Environmental || Environmental || Governance || Governance,"Water Resources || Water Resources || Regulation, Compliance & Institutions || Reputation & Social License",High water consumption || Water management challenges || Mining permitting and licensing practices || Mining image and public perception
http://www.mining.com/zambias-just-deepened-worries-sinking-global-copper-output/,20190523,,live_ok_trafilatura,0.98,0.95,0.9,"Governance | Regulation, Compliance & Institutions | Legislative and regulatory framework effectiveness -> ""The industry lobby group attributed the expected drop in production to changes to mining taxes introduced in January, which is driving companies to cut output."" | """"The new tax regime forced miners to do the unthinkable – cut production – because many cannot afford to continue producing as before,"" it said in a statement.""",,,copper,,Governance,"Regulation, Compliance & Institutions",Legislative and regulatory framework effectiveness
http://www.xinhuanet.com/english/2019-05/17/c_138067090.htm,20190517,Chinese firms commended for job creation in Zambia - Xinhua | English.news.cn,live_ok_trafilatura,0.95,0.95,0.85,"Social | Livelihoods & Economy | Employment creation and job security -> ""Chinese enterprises in Zambia have been commended for their efforts in supplementing the Zambian government efforts in creating jobs, a civic leader said."" | ""Chinese nationals have created jobs for the locals in varied sectors in the town that is heavily reliant on mining."" || Social | Livelihoods & Economy | Income generation and poverty reduction or exacerbation -> ""According to Chisenga, a number of projects such mining and construction that the Chinese have embarked on have greatly benefited Zambians who are able to make their ends meets."" | ""Some Luanshya residents told Xinhua that they have benefited a lot from the Chinese presence."" || Social | Livelihoods & Economy | Business opportunities (local supply chains, services) -> ""Chinese nationals have created jobs for the locals in varied sectors in the town that is heavily reliant on mining."" | ""Chanda called on Zambians to be committed to work when employed by the Chinese-run enterprises in the town and the country as a whole.""",,"Luanshya, Copperbelt Province",,,Social || Social || Social,Livelihoods & Economy || Livelihoods & Economy || Livelihoods & Economy,"Employment creation and job security || Income generation and poverty reduction or exacerbation || Business opportunities (local supply chains, services)"
http://www.xinhuanet.com/english/2019-05/18/c_138067543.htm,20190517,Zambia business confidence declines in Q1 - Xinhua | English.news.cn,live_ok_trafilatura,1.0,0.9,0.8,"Social | Livelihoods & Economy | Business opportunities (local supply chains, services) -> ""lost contracts to supply the mining sector""",,,,,Social,Livelihoods & Economy,"Business opportunities (local supply chains, services)"
http://www.xinhuanet.com/english/2019-05/18/c_138069618.htm,20190518,Chinese enterprises urged to explore greenfield investments in northern Zambia - Xinhua | English.news.cn,live_ok_trafilatura,1.0,0.8,0.6,"Social | Livelihoods & Economy | Business opportunities (local supply chains, services) -> ""Our appeal to Chinese is to consider investing in Chililabombwe to establish new investments in agriculture, processing and manufacturing industries to help grow the Zambian economy,"" | ""the move will go a long way in helping Zambia diversify its economy from dependence on the mining industry.""",,"Chililabombwe, Copperbelt Province",,,Social,Livelihoods & Economy,"Business opportunities (local supply chains, services)"
http://www.xinhuanet.com/english/2019-05/21/c_138077892.htm,20190521,Zambian gov't wants to place Indian-run mining firm under receivership - Xinhua | English.news.cn,live_ok_trafilatura,0.99,0.99,0.9,"Governance | Regulation, Compliance & Institutions | Mining permitting and licensing practices -> ""the government will strip the mining firm of its mining license and bring a new investor following a number of breaches of the terms of the license."" || Social | Livelihoods & Economy | Business opportunities (local supply chains, services) -> ""the mining firm has come under attack for failure to run the Zambia operations, resulting in problems such as failure to pay suppliers and contractors."" || Social | Equity, Rights & Vulnerable Groups | Crime and social disorder (corruption, violence, substance abuse) -> ""The government has asked the police to station officers in all the mine's operations to avoid stripping of assets.""",Konkola Copper Mines,Lusaka,copper,Konkola Copper Mines,Governance || Social || Social,"Regulation, Compliance & Institutions || Livelihoods & Economy || Equity, Rights & Vulnerable Groups","Mining permitting and licensing practices || Business opportunities (local supply chains, services) || Crime and social disorder (corruption, violence, substance abuse)"
http://www.xinhuanet.com/english/2019-05/23/c_138083778.htm,20190523,Foreign mining firms say take-over of Indian-run mining firm may restrict all investors in Zambia - Xinhua | English.news.cn,live_ok_trafilatura,0.95,0.95,0.8,"Governance | Regulation, Compliance & Institutions | Legislative and regulatory framework effectiveness -> ""the legal action taken by the government to take over Konkola Copper Mines (KCM), a unit of India's Vedanta Resources Ltd, risks typecasting all investors and diverting attention from the issues hurting the industry."" | ""The government, through the Zambia Consolidated Copper Mines Investment Holdings, has placed KCM under receivership and appointed a liquidator due to alleged breach of contractual obligations by the Indian miner."" || Governance | Reputation & Social License | Mining image and public perception -> ""the legal action taken by the government to take over Konkola Copper Mines (KCM) ... risks typecasting all investors"" | """"The KCM story has created a social media frenzy"""" || Social | Livelihoods & Economy | Income generation and poverty reduction or exacerbation -> """"The KCM story has created a social media frenzy, but it is distracting us from the real issues at play here, which is the increasingly unbearable tax burden in a country where most mines are already regarded to be high-cost operations."""" | """"There is a shortage of capital in Zambia, so we must look elsewhere for this investment."""" || Governance | Stakeholder Engagement & Rights | Stakeholder inclusion in decision-making -> ""The investors need to see clear and consistent guidance from government on its intentions and actions it proposes to take""",Konkola Copper Mines (KCM),,copper,Vedanta Resources Ltd,Governance || Governance || Social || Governance,"Regulation, Compliance & Institutions || Reputation & Social License || Livelihoods & Economy || Stakeholder Engagement & Rights",Legislative and regulatory framework effectiveness || Mining image and public perception || Income generation and poverty reduction or exacerbation || Stakeholder inclusion in decision-making
http://www.xinhuanet.com/english/2019-05/25/c_138089155.htm,20180525,Chinese mining firm to support more small-holder farmers in Zambia - Xinhua | English.news.cn,live_ok_trafilatura,0.99,0.98,0.95,"Social | Livelihoods & Economy | Income generation and poverty reduction or exacerbation -> ""CLM currently supports 100 vulnerable but viable scale farmers in Luanshya district on the Copperbelt Province."" | ""the number of small-scale farmers to be supported is likely to increase to 200 next year from the current 100 beneficiaries."" | ""As along as government is in the forefront of this program we are ready to offer our support aimed at increasing food production in the district and the country as a whole,"" || Social | Living Conditions & Social Fabric | Livability (cost of living, food security, communication services) -> ""Nkweto said it was cardinal to support small-scale farmers in the district with farming inputs such as fertilizer to promote household food security in the district and the country as a whole."" | """"I have benefited seed and fertilizer from Chinese company for my small holding farm,"" Phiri said."" || Governance | Stakeholder Engagement & Rights | Stakeholder inclusion in decision-making -> """"As a company we have a deliberate annual program to support vulnerable but viable small scale farmers in the district, we are working in collaboration with the office of the Luanshya mayor, the office of the district commissioner including that of the Member of Parliament to carry out this program,"""" | ""According to Chileya, the support follows a plea from a lawmaker in the area to have the number of beneficiaries of farm inputs from the mining firm increased from 100 to 200.""",China Non-ferrous Metal Company Luanshya Copper Mine (CLM),"Luanshya, Copperbelt Province",copper,China Non-ferrous Metal Company,Social || Social || Governance,Livelihoods & Economy || Living Conditions & Social Fabric || Stakeholder Engagement & Rights,"Income generation and poverty reduction or exacerbation || Livability (cost of living, food security, communication services) || Stakeholder inclusion in decision-making"
https://af.reuters.com/article/commoditiesNews/idAFL8N2356Q9,20190529,,wayback_ok,1.0,1.0,0.9,"Governance | Regulation, Compliance & Institutions | Mining permitting and licensing practices -> ""It is fighting Zambia's decision this month to name a provisional liquidator to run KCM after the government accused KCM of breaching its operating licence."" | ""the government accused KCM of breaching its operating licence""",Konkola Copper Mines,,copper,Vedanta Resources,Governance,"Regulation, Compliance & Institutions",Mining permitting and licensing practices
https://af.reuters.com/article/idUSKCN1SY1PT,20190530,,wayback_ok,0.95,0.6,0.8,"Social | Livelihoods & Economy | Business opportunities (local supply chains, services) -> """"The project will reduce challenges in transporting petroleum products in the countries that use our ports to import fuel and open up business opportunities ...""""",,Ndola,copper,,Social,Livelihoods & Economy,"Business opportunities (local supply chains, services)"
https://af.reuters.com/article/investingNews/idAFKCN1SO067-OZABS,20190518,,wayback_ok,0.99,0.99,0.9,"Social | Livelihoods & Economy | Unemployment risks post-closure -> ""Mopani plans to close two shafts at its Nkana mine in Kitwe, the company said last week, a move that union sources said could affect more than 2,000 workers."" | ""He said companies such as Vedanta Resources' Konkola Copper Mines (KCM) and Glencore's Mopani Copper Mines (MCM) were laying off workers and blaming the tax changes."" || Social | Livelihoods & Economy | Business opportunities (local supply chains, services) -> ""Africa's second-biggest copper producer is introducing the tax change as part of a plan to keep a greater share of mineral resource profits for the country and tackle its debt despite criticism that it is deterring new investment."" || Governance | Regulation, Compliance & Institutions | Legislative and regulatory framework effectiveness -> ""Zambia's President Edgar Lungu said on Friday that he will go ahead with a new non-refundable sales tax in place of Value Added Tax (VAT), despite criticism from mining companies."" | ""The new sales tax was meant to have been introduced on April 1, but has been postponed until July to allow more consultation."" | ""Lungu said the government was consulting its lawyers to ensure that everything is done within the law in the event that Zambia decides to bring in new investors.""",Nkana,Kitwe,copper,Mopani Copper Mines,Social || Social || Governance,"Livelihoods & Economy || Livelihoods & Economy || Regulation, Compliance & Institutions","Unemployment risks post-closure || Business opportunities (local supply chains, services) || Legislative and regulatory framework effectiveness"
https://af.reuters.com/article/investingNews/idAFKCN1SU0U9-OZABS,20190524,,wayback_ok,0.99,0.98,0.9,"Social | Livelihoods & Economy | Employment creation and job security -> ""which is one of the biggest employers in Zambia"" || Social | Equity, Rights & Vulnerable Groups | Freedom and justice impacts in nearby communities -> ""a number of expatriate employees and contractors had been prevented from leaving the country."" || Governance | Regulation, Compliance & Institutions | Mining permitting and licensing practices -> ""It has cited breaches of KCM's licence to operate"" || Governance | Reputation & Social License | Social license to operate -> ""The case involving KCM has stirred up concerns in the mining industry about rising resource nationalism in Africa"" || Governance | Regulation, Compliance & Institutions | Legislative and regulatory framework effectiveness -> ""The Zambian government has said it is not seizing private assets or breaking any laws.""",Konkola Copper Mines,Lusaka,copper,Vedanta,Social || Social || Governance || Governance || Governance,"Livelihoods & Economy || Equity, Rights & Vulnerable Groups || Regulation, Compliance & Institutions || Reputation & Social License || Regulation, Compliance & Institutions",Employment creation and job security || Freedom and justice impacts in nearby communities || Mining permitting and licensing practices || Social license to operate || Legislative and regulatory framework effectiveness
https://inshorts.com/en/news/vedantas-agarwal-says-willing-to-invest-in-zambia-amid-dispute-1559147497865,20190529,Vedanta's Agarwal says willing to invest in Zambia amid dispute,live_ok_trafilatura,0.95,0.98,0.9,"Social | Livelihoods & Economy | Employment creation and job security -> ""creating another 10,000 jobs at Konkola Copper Mines (KCM)."" || Governance | Regulation, Compliance & Institutions | Mining permitting and licensing practices -> ""Zambia accused KCM of breaching its operating licence, and sought a provisional liquidator to run the company.""",Konkola Copper Mines,,copper,Konkola Copper Mines,Social || Governance,"Livelihoods & Economy || Regulation, Compliance & Institutions",Employment creation and job security || Mining permitting and licensing practices
https://m.miningweekly.com/article/zambias-mines-minister-orders-regular-audits-at-all-mines-2019-05-24,20190525,Zambia's mines minister orders regular audits at all mines,live_ok_newspaper,0.99,0.99,0.9,"Governance | Regulation, Compliance & Institutions | Mining permitting and licensing practices -> ""Zambian President Edgar Lungu said on Monday the government planned to strip KCM of its mining licence and bring in a new investor."" | ""KCM ... has breached the terms of its licence"" || Governance | Regulation, Compliance & Institutions | Enforcement of environmental and social regulations -> """"The government will be undertaking regular audits at all the mines to ensure compliance and avoid the recurrence of the situation at KCM,"" he said."" || Governance | Transparency & Accountability | Corporate transparency and reporting -> """"Vedanta has serious concerns about the intentions of the applicants and the procedures that were followed by ZCCM-IH as a representative of government to obtain a provisional liquidation order on an ex parte basis against KCM in an apparent misuse of the legal process to date,"" it said."" | ""Vedanta said among its concerns were that ZCCM-IH was not a major creditor of KCM and that since the order was granted ex-parte, the company was not able to present its case."" || Social | Livelihoods & Economy | Income generation and poverty reduction or exacerbation -> ""Zambia has already riled miners with tax changes that mining companies say will deter the investment Zambia desperately needs"" | ""Zambia's Chamber of Mines said on Thursday that the country, Africa's second largest copper producer, was at risk of a drastic fall in copper output because of the impact of the tax changes.""",Konkola Copper Mines,,copper,Vedanta,Governance || Governance || Governance || Social,"Regulation, Compliance & Institutions || Regulation, Compliance & Institutions || Transparency & Accountability || Livelihoods & Economy",Mining permitting and licensing practices || Enforcement of environmental and social regulations || Corporate transparency and reporting || Income generation and poverty reduction or exacerbation
