sourceurl,sqldate,title,scrape_status,in_zambia_confidence,mining_related_confidence,impact_confidence,impact_evidence,mine_name,region,mineral_type,mining_company,impact_level1,impact_level2,impact_level3
https://naija247news.com/africa-must-reclaim-sovereignty-over-its-natural-resources-or-stay-poor-on-rich-soil/,20250522,Africa Must Reclaim Sovereignty Over Its Natural Resources or Stay Poor on Rich Soil - Expert Analysis | Naija247news,live_ok_newspaper,0.95,0.95,0.9,"Social | Health, Safety & Well-being | Worker health and safety risks -> ""But Zambia, where the copper is dug and lives are risked daily in the pits, owns none of the equity."" || Social | Livelihoods & Economy | Employment creation and job security -> ""Though the mine operates on Zambian land, is powered by Zambian labor, and draws from Zambia's copper-rich soil, the profits belong elsewhere."" | ""Barrick Gold announced that Lumwana contributed $887 million to the Zambian economy — through taxes, royalties, wages, and procurement."" || Social | Livelihoods & Economy | Income generation and poverty reduction or exacerbation -> ""In 2024 alone, Barrick Gold announced that Lumwana contributed $887 million to the Zambian economy — through taxes, royalties, wages, and procurement."" | ""This is not development. This is depletion."" || Social | Livelihoods & Economy | Business opportunities (local supply chains, services) -> ""In 2024 alone, Barrick Gold announced that Lumwana contributed $887 million to the Zambian economy — through taxes, royalties, wages, and procurement."" || Social | Equity, Rights & Vulnerable Groups | Wealth distribution and inequality -> ""Though the mine operates on Zambian land, is powered by Zambian labor, and draws from Zambia's copper-rich soil, the profits belong elsewhere."" | ""It is 100% owned by Canadian mining giant Barrick Gold Corporation. Zambia owns 0%."" | ""It receives no dividends. It watches billions flow outward — while borrowing to fund its national budget."" | ""Zambia's Lumwana Mine tells a bigger story — one of a continent rich in resources but impoverished by structure."" || Social | Equity, Rights & Vulnerable Groups | Land ownership impacts and regional value changes -> ""In 2006, Zambia had a modest 2.2% stake in Lumwana through the state-run ZCCM-IH. But in 2011, even that was sold off, stripping the nation of any ownership in one of its most strategic assets."" || Governance | Transparency & Accountability | Corporate transparency and reporting -> ""Revenue transparency through the Extractive Industries Transparency Initiative (EITI)."" || Governance | Regulation, Compliance & Institutions | Legislative and regulatory framework effectiveness -> ""The solution is not to reject foreign investment but to renegotiate it — on fair and sovereign terms."" | ""Africa must legislate for: Mandatory local equity participation in all extractive projects — no exceptions."" || Governance | Stakeholder Engagement & Rights | Stakeholder inclusion in decision-making -> ""Renegotiation of existing contracts that offer little or no long-term national benefit.""",Lumwana Mine,,copper,Barrick Gold Corporation,Social || Social || Social || Social || Social || Social || Governance || Governance || Governance,"Health, Safety & Well-being || Livelihoods & Economy || Livelihoods & Economy || Livelihoods & Economy || Equity, Rights & Vulnerable Groups || Equity, Rights & Vulnerable Groups || Transparency & Accountability || Regulation, Compliance & Institutions || Stakeholder Engagement & Rights","Worker health and safety risks || Employment creation and job security || Income generation and poverty reduction or exacerbation || Business opportunities (local supply chains, services) || Wealth distribution and inequality || Land ownership impacts and regional value changes || Corporate transparency and reporting || Legislative and regulatory framework effectiveness || Stakeholder inclusion in decision-making"
https://newsghana.com.gh/ghanas-rti-law-emerges-as-vital-tool-in-curbing-illicit-financial-flows/,20250517,Ghana's RTI Law Emerges as Vital Tool in Curbing Illicit Financial Flows | NewsGhana,live_ok_trafilatura,1.0,0.9,0.8,"Governance | Transparency & Accountability | Corporate transparency and reporting -> ""it has empowered journalists, civil society, and citizens to demand accountability from public institutions"" | ""As Chair of Ghana's Public Accounts Committee, Osei-Asare emphasized the law's utility in probing mining licenses and tracking funds through the Financial Intelligence Centre."" || Governance | Stakeholder Engagement & Rights | Stakeholder inclusion in decision-making -> ""it has empowered journalists, civil society, and citizens to demand accountability from public institutions"" | ""urged legislators to leverage parliamentary tools, debates, hearings, and civil society collaboration to strengthen oversight.""",,Lusaka,,,Governance || Governance,Transparency & Accountability || Stakeholder Engagement & Rights,Corporate transparency and reporting || Stakeholder inclusion in decision-making
https://phys.org/news/2025-05-do-you-live-near-a.html,20250526,,live_ok_newspaper,0.98,0.96,0.9,"Water Resources | Surface water pollution and quality degradation | Surface water pollution and quality degradation -> ""Over 50 million liters of toxic waste flowed over the dam's wall into the Mwambashi River."" | ""The pollution traveled further than 100km from the dam, contaminating the river, and killing fish and livestock on nearby farms."" || Water Resources | Freshwater ecotoxicity (heavy metals, pH changes, sensitive species) | Freshwater ecotoxicity (heavy metals, pH changes, sensitive species) -> ""Over 50 million liters of toxic waste flowed over the dam's wall into the Mwambashi River."" | ""The pollution traveled further than 100km from the dam, contaminating the river, and killing fish and livestock on nearby farms."" || Biodiversity & Ecosystems | Impacts on aquatic ecosystems and life below water | Impacts on aquatic ecosystems and life below water -> ""The pollution traveled further than 100km from the dam, contaminating the river, and killing fish and livestock on nearby farms."" | ""killing fish"" || Social | Health, Safety & Well-being | Community exposure to dust, noise, pollution -> ""The Zambian government had to shut down municipal water to the city of Kitwe to protect residents from consuming the polluted water."" | ""The pollution traveled further than 100km from the dam, contaminating the river"" || Social | Livelihoods & Economy | Income generation and poverty reduction or exacerbation -> ""The pollution traveled further than 100km from the dam, contaminating the river, and killing fish and livestock on nearby farms."" | ""This can cause serious environmental, social and economic damage."" || Governance | Stakeholder Engagement & Rights | Stakeholder inclusion in decision-making -> ""Mines should have plans to reduce the impact that tailings dams have on the environment. These would have been informed by public participation."" | ""But other mines are not engaging with communities that might be affected by dams."" || Governance | Risk Management & Long-Term Stewardship | Closure planning and post-mining reclamation governance -> ""Closure plans should also be continuously communicated to mining-affected communities. This will assure the community that when the miners leave, they won't be left with a dangerous dam near their homes, with no one to look after it."" || Governance | Risk Management & Long-Term Stewardship | Tailings and waste governance -> ""In 2020, the Global Industry Standard on Tailings Management introduced a new set of safety measures and standards."" | ""Every mining operation produces tailings. ... Slurry is kept in specially designed tailings dams.""",Sino-Metals Leach Zambia copper mine,Kitwe,copper,Sino-Metals Leach Zambia,Water Resources || Water Resources || Biodiversity & Ecosystems || Social || Social || Governance || Governance || Governance,"Surface water pollution and quality degradation || Freshwater ecotoxicity (heavy metals, pH changes, sensitive species) || Impacts on aquatic ecosystems and life below water || Health, Safety & Well-being || Livelihoods & Economy || Stakeholder Engagement & Rights || Risk Management & Long-Term Stewardship || Risk Management & Long-Term Stewardship","Surface water pollution and quality degradation || Freshwater ecotoxicity (heavy metals, pH changes, sensitive species) || Impacts on aquatic ecosystems and life below water || Community exposure to dust, noise, pollution || Income generation and poverty reduction or exacerbation || Stakeholder inclusion in decision-making || Closure planning and post-mining reclamation governance || Tailings and waste governance"
https://www.cfr.org/article/china-africa-march-2025,20250528,China in Africa: March 2025 | Council on Foreign Relations,live_ok_trafilatura,0.99,0.99,0.9,"Environmental | Water Resources | Surface water pollution and quality degradation -> ""In Zambia, an acid spill from a Chinese-owned copper mine released fifty million liters of toxic material into a stream feeding the Kafue River, Zambia's most important waterway, threatening further damage to the environment and the lives of millions of people."" || Environmental | Water Resources | Freshwater ecotoxicity (heavy metals, pH changes, sensitive species) -> ""An Associated Press reporter stated that dead fish were visible in the Kafue River sixty miles downstream from a collapsed tailings dam, which was attached to the mine run by the Sino-Metals Leach Zambia facility"" || Environmental | Land, Soil & Geology | Tailings generation and management -> ""dead fish were visible in the Kafue River sixty miles downstream from a collapsed tailings dam, which was attached to the mine run by the Sino-Metals Leach Zambia facility"" || Social | Health, Safety & Well-being | Accidents and fatalities (including structural failures such as tailings dams) -> ""dead fish were visible in the Kafue River sixty miles downstream from a collapsed tailings dam, which was attached to the mine run by the Sino-Metals Leach Zambia facility"" | ""In Zambia, an acid spill from a Chinese-owned copper mine released fifty million liters of toxic material into a stream feeding the Kafue River, Zambia's most important waterway, threatening further damage to the environment and the lives of millions of people."" || Social | Health, Safety & Well-being | Mental and physical health impacts on communities -> ""In Zambia, an acid spill from a Chinese-owned copper mine released fifty million liters of toxic material into a stream feeding the Kafue River, Zambia's most important waterway, threatening further damage to the environment and the lives of millions of people."" || Governance | Risk Management & Long-Term Stewardship | Tailings and waste governance -> ""dead fish were visible in the Kafue River sixty miles downstream from a collapsed tailings dam, which was attached to the mine run by the Sino-Metals Leach Zambia facility""",Sino-Metals Leach Zambia facility,Kafue River,copper,"China Nonferrous Mining Corporation, Ltd.",Environmental || Environmental || Environmental || Social || Social || Governance,"Water Resources || Water Resources || Land, Soil & Geology || Health, Safety & Well-being || Health, Safety & Well-being || Risk Management & Long-Term Stewardship","Surface water pollution and quality degradation || Freshwater ecotoxicity (heavy metals, pH changes, sensitive species) || Tailings generation and management || Accidents and fatalities (including structural failures such as tailings dams) || Mental and physical health impacts on communities || Tailings and waste governance"
https://www.directorstalkinterviews.com/jubilee-metals-begins-copper-production-at-roan-after-successful-trials/4121198834,20250528,Jubilee Metals Begins Copper Production At Roan After Successful Trials,live_ok_newspaper,0.95,0.95,0.85,"Environmental | Land, Soil & Geology | Tailings generation and management -> ""Large Waste Project (estimated 260 million tonnes at surface) which contains vast quantities of similar transitional 'waste' copper ore."" | ""Remaining lower grade material (0.7% Cu) is stockpiled at surface for future processing at site."" | ""monetising certain assets within its surface tailings portfolio that do not form part of Jubilee's medium term operational focus."" || Governance | Risk Management & Long-Term Stewardship | Tailings and waste governance -> ""In the RNS dated 3 April 2025, the Company has executed a trade of 10Mt of the near 260Mt of resources at surface. The movement of the material has commenced, offering Jubilee the potential to improve the accuracy of its grade profiling."" | ""The trade of the material was valued at US$6.75 million which is to be paid in fortnightly tranches as the material is uplifted, with US$600 000 already received."" | ""monetising certain assets within its surface tailings portfolio that do not form part of Jubilee's medium term operational focus."" || Social | Livelihoods & Economy | Business opportunities (local supply chains, services) -> ""The Company has entered into a long-term feedstock supply agreement at Roan with production commencing this week."" | ""In this regard, Jubilee was successful in completing a transaction on one of its waste assets outside of its large copper tailings for a combined consideration of US$12.3 million, payable in tranches over the next 20 months, commencing with a US$1.3 million payment due in the first week of June 2025."" | ""The Company is in advanced discussions with a potential mining partner to form a collaborative agreement to combine their exploration and mining skills with Jubilee's processing expertise.""",Roan Concentrator; Munkoyo; Project G; Large Waste Project; Sable Refinery,,copper,Jubilee Metals Group,Environmental || Governance || Social,"Land, Soil & Geology || Risk Management & Long-Term Stewardship || Livelihoods & Economy","Tailings generation and management || Tailings and waste governance || Business opportunities (local supply chains, services)"
https://www.faceofmalawi.com/2025/05/23/zambia-police-launches-manhunt-after-fatal-shooting-at-gold-mine-camp/,20250523,Zambia Police Launches Manhunt After Fatal Shooting at Gold Mine Camp – Face of Malawi,live_ok_trafilatura,0.95,0.95,0.9,"Social | Health, Safety & Well-being | Worker health and safety risks -> ""Zambia Police in Chisamba District, have launched a manhunt following a deadly shooting incident that occurred in the early hours of May 23, 2025, at the Fish Pond Gold Mine Camps in the Chipembi area."" | ""The two victims were rushed to Chipembi Rural Health Centre, where Gift Mwandu was pronounced dead on arrival."" || Social | Equity, Rights & Vulnerable Groups | Crime and social disorder (corruption, violence, substance abuse) -> ""Zambia Police in Chisamba District, have launched a manhunt following a deadly shooting incident that occurred in the early hours of May 23, 2025, at the Fish Pond Gold Mine Camps in the Chipembi area."" | ""Police say the suspects fled the scene and remain at large.""",Fish Pond Gold Mine Camps,"Chipembi area, Chisamba District",gold,,Social || Social,"Health, Safety & Well-being || Equity, Rights & Vulnerable Groups","Worker health and safety risks || Crime and social disorder (corruption, violence, substance abuse)"
https://www.fool.ca/2025/05/28/where-will-first-quantum-minerals-stock-be-in-3-years/,20250528,Where Will First Quantum Minerals Stock Be in 3 Years? | The Motley Fool Canada,live_ok_trafilatura,0.98,0.98,0.8,"Environmental | Water Resources | Water management challenges -> ""Both mines faced seasonal challenges from Zambia's rainy season, though imported power contracts maintained steady operations."" || Environmental | Air & Climate | Energy demand and consumption -> ""Both mines faced seasonal challenges from Zambia's rainy season, though imported power contracts maintained steady operations."" | ""imported power contracts maintained steady operations""",Kansanshi; Sentinel,northwestern province of Zambia,copper,First Quantum Minerals,Environmental || Environmental,Water Resources || Air & Climate,Water management challenges || Energy demand and consumption
https://www.foxbusiness.com/fox-news-world/israel-backed-leading-global-investment-fund-despite-ongoing-war,20250525,Israel economy shows resilience as foreign investments recover amid ongoing war | Fox Business,live_ok_trafilatura,0.9,0.9,0.7,"Social | Livelihoods & Economy | Business opportunities (local supply chains, services) -> ""The project aims to transform Africa's Lobito Corridor—stretching from Angola's Port of Lobito through the Democratic Republic of Congo and into Zambia—into a critical trade route for minerals essential for global industries."" | ""Dr. Armando Manuel, Chairman of Angola's Sovereign Wealth Fund, stressed the corridor's critical role in reshaping global mineral supply chains. ""China currently dominates the supply of critical minerals,"" he noted. ""But the Lobito Corridor will offer an alternative route for supplying minerals to America and Europe.""""",,,,,Social,Livelihoods & Economy,"Business opportunities (local supply chains, services)"
https://www.ghanaweb.com/GhanaHomePage/NewsArchive/Let-s-get-to-work-Abena-Osei-Asare-champions-RTI-law-in-battle-against-IFFs-1984358,20250511,Challenge Validation,live_ok_newspaper,0.95,0.7,0.85,"Governance | Regulation, Compliance & Institutions | Mining permitting and licensing practices -> ""From demanding answers on mining licenses to tracking funds allocated to our Financial Intelligence Centre, we are seeing the law in action,"" || Governance | Transparency & Accountability | Anti-corruption and bribery risks -> ""I returned from Lusaka last week, where I had the honour of representing the African Organization of Public Accounts Committees (AFROPAC) at the 4th AU Specialized Technical Committee on Tax and Illicit Financial Flows (IFFs)."" | ""From demanding answers on mining licenses to tracking funds allocated to our Financial Intelligence Centre, we are seeing the law in action,"" || Governance | Stakeholder Engagement & Rights | Stakeholder inclusion in decision-making -> ""it has become a powerful weapon in empowering journalists, CSOs, and citizens to hold public institutions accountable.""",,Lusaka,,,Governance || Governance || Governance,"Regulation, Compliance & Institutions || Transparency & Accountability || Stakeholder Engagement & Rights",Mining permitting and licensing practices || Anti-corruption and bribery risks || Stakeholder inclusion in decision-making
https://www.globenewswire.com/news-release/2025/05/28/3089815/0/en/Terra-Metals-Inc-and-Metalex-Commodities-Seal-100M-Critical-Minerals-Deal-Lunda-Resources-to-Commission-240-TPH-Copper-Cobalt-Plant-by-September-2025.html,20250428,Terra Metals Inc. and Metalex Commodities Seal $100M,live_ok_trafilatura,0.95,0.95,0.7,"Governance | Stakeholder Engagement & Rights | Stakeholder inclusion in decision-making -> ""community inclusion programs and ESG compliance"" || Governance | Regulation, Compliance & Institutions | Compliance with national and international standards -> ""community inclusion programs and ESG compliance"" || Governance | Reputation & Social License | Mining image and public perception -> """"This partnership is a leap forward for Zambia's mining sector and a cornerstone of U.S.-Africa industrial alignment,"""" | ""underscoring the strategic alignment with U.S. government priorities on critical mineral security."" || Environmental | Land, Soil & Geology | Transport corridors and access road impacts -> ""the facility will process high-grade ores to supply strategic end-markets, including the United States, through the Lobito Railway Corridor, offering a direct logistics route to Atlantic ports."" | ""Metalex Commodities has pledged to raise $100 million ... which will be directed toward: ... Logistics and export infrastructure""",Lunda Resources,Lusaka,copper and cobalt,Lunda Resources,Governance || Governance || Governance || Environmental,"Stakeholder Engagement & Rights || Regulation, Compliance & Institutions || Reputation & Social License || Land, Soil & Geology",Stakeholder inclusion in decision-making || Compliance with national and international standards || Mining image and public perception || Transport corridors and access road impacts
https://www.graphic.com.gh/features/opinion/dead-aid-why-foreign-assistance-isnt-working-for-africa.html,20250522,Dead Aid: Why Foreign Assistance Isn't Working for Africa - Graphic Online,live_ok_trafilatura,0.9,0.9,0.9,"Social | Livelihoods & Economy | Human capital development (skills, training, workforce development) -> ""For instance, in Zambia, the mining industry's dependence on foreign aid and investment has hindered the development of local capacity and revenue generation."" || Social | Livelihoods & Economy | Income generation and poverty reduction or exacerbation -> ""For instance, in Zambia, the mining industry's dependence on foreign aid and investment has hindered the development of local capacity and revenue generation.""",,,,,Social || Social,Livelihoods & Economy || Livelihoods & Economy,"Human capital development (skills, training, workforce development) || Income generation and poverty reduction or exacerbation"
https://www.investegate.co.uk/announcement/rns/jubilee-metals-group--jlp/zambia-projects-update-issue-of-equity/8899483,20250528,Zambia Projects Update & Issue of equity | Company Announcement | Investegate,live_ok_trafilatura,0.99,0.99,0.9,"Environmental | Land, Soil & Geology | Tailings generation and management -> ""which is expected to replace the historical tailings over the medium term."" | ""monetising certain assets within its surface tailings portfolio"" | ""Large Waste Project (estimated 260 million tonnes at surface)"" | ""the trade of 10 million tonnes of the Large Waste project (260 million tonnes at surface) has commenced"" || Environmental | Land, Soil & Geology | Land disturbance and land-use change -> ""The Munkoyo mining operations are operating currently a single pit, where drilling to define a resource has commenced. Nine smaller pits have also exposed a shallow copper reef."" | ""available in vast quantities both at surface and in near surface mining operations"" || Governance | Risk Management & Long-Term Stewardship | Tailings and waste governance -> ""The trials have confirmed Roan's ability to adjust to an operational feedstock processing recipe targeting only ROM material, which is expected to replace the historical tailings over the medium term."" | ""The movement of the material has commenced, offering Jubilee the potential to improve the accuracy of its grade profiling."" | ""monetising certain assets within its surface tailings portfolio that do not form part of Jubilee's medium term operational focus.""",Roan Concentrator; Munkoyo; Project G; Large Waste Project; Sable Refinery,Munkoyo,copper,Jubilee Metals Group,Environmental || Environmental || Governance,"Land, Soil & Geology || Land, Soil & Geology || Risk Management & Long-Term Stewardship",Tailings generation and management || Land disturbance and land-use change || Tailings and waste governance
