sourceurl,sqldate,title,scrape_status,in_zambia_confidence,mining_related_confidence,impact_confidence,impact_evidence,mine_name,region,mineral_type,mining_company,impact_level1,impact_level2,impact_level3
https://www.mining.com/press-release?id=68d0675c4aabb68f793059c1,20250922,,live_ok_trafilatura,0.99,0.99,0.9,"Social | Livelihoods & Economy | Employment creation and job security -> ""ensuring that Zambia's copper and cobalt will not only contribute to job creation and GDP growth in both nations"" | ""unlock world-class copper and cobalt resources that will power industries, create jobs, and strengthen long- term economic cooperation between our two countries"" || Social | Livelihoods & Economy | Income generation and poverty reduction or exacerbation -> ""ensuring that Zambia's copper and cobalt will not only contribute to job creation and GDP growth in both nations"" || Governance | Stakeholder Engagement & Rights | Stakeholder inclusion in decision-making -> ""We are deeply grateful to Senior Chief Sailunga and Chief Ntambu, whose steadfast support and partnership have been instrumental in guiding Terra Metals' journey."" || Social | Livelihoods & Economy | Business opportunities (local supply chains, services) -> ""revive U.S. refineries with the much-needed supply of critical minerals for the global energy transition"" | ""unlock world-class copper and cobalt resources that will power industries, create jobs, and strengthen long- term economic cooperation between our two countries""",Kazozo Mine (formerly Kalaba Mine),Northwestern Zambia,copper; cobalt; nickel,Lunda Resources,Social || Social || Governance || Social,Livelihoods & Economy || Livelihoods & Economy || Stakeholder Engagement & Rights || Livelihoods & Economy,"Employment creation and job security || Income generation and poverty reduction or exacerbation || Stakeholder inclusion in decision-making || Business opportunities (local supply chains, services)"
https://www.proactiveinvestors.com/companies/news/1079161/tertiary-minerals-md-on-latest-drill-results-at-mushima-north-confirmation-of-wide-silver-zones-1079161.html,20250925,"Tertiary Minerals MD on latest drill results at Mushima North; confirmation of wide silver zones | AIM:TYM, OTC:TTIRF",live_ok_trafilatura,0.99,0.99,0.6,"Environmental | Land, Soil & Geology | Land disturbance and land-use change -> ""supports Tertiary's working model for an open-pit mining approach"" | ""Mineralisation has been identified within just two metres of the surface, further reinforcing the low-cost extraction potential.""",Mushima North,,silver,Tertiary Minerals PLC,Environmental,"Land, Soil & Geology",Land disturbance and land-use change
https://www.rttnews.com/3576456/gemfields-group-sees-net-loss-for-h1-as-revenue-drops.aspx,20250923,Gemfields Group Sees Net Loss For H1 As Revenue Drops,live_ok_trafilatura,0.95,0.99,0.85,"Governance | Regulation, Compliance & Institutions | Legislative and regulatory framework effectiveness -> ""implementation of the 15% export duty on emeralds in Zambia"" || Governance | Transparency & Accountability | Corporate transparency and reporting -> ""Gemfields Group will release its first-half earnings report on September 26.""",Kagem Mining,,emeralds,Gemfields Group Limited,Governance || Governance,"Regulation, Compliance & Institutions || Transparency & Accountability",Legislative and regulatory framework effectiveness || Corporate transparency and reporting
https://www.southernafricalitigationcentre.org/zambia-corporate-accountability-for-pollution-of-vital-water-resources-and-the-environment/,20250918,Zambia: Corporate accountability for pollution of vital water resources and the environment - Southern Africa Litigation Centre,live_ok_trafilatura,0.99,0.99,0.95,"Environmental | Water Resources | Acid mine drainage -> ""The collapse spilt highly acidic water into the Mwambashi River, with pH levels dropping to 1.91."" || Environmental | Water Resources | Surface water pollution and quality degradation -> ""On 18 February 2025, Tailing Dams owned by Sino Metals Leach Zambia Limited (Sino Metals) and located on NFC Africa Mining Limited's (NFC Mining) surface area collapsed, discharging an estimated 50 million to 900,000 million litres of highly acidic and toxic waste, including heavy metals, into the local environment and vital waterways."" || Environmental | Water Resources | Freshwater ecotoxicity (heavy metals, pH changes, sensitive species) -> ""Government ministries confirmed the heavy metals found to have been discharged into the Mwambashi Stream, which included iron, manganese, copper, and cobalt, as well as elevated levels of total dissolved solids and extremely low pH values."" | ""Later on 2 April 2025, the government further confirmed that the heavy metal contamination is far beyond the safe limits set by the World Health Organisation (WHO) and the Food and Agriculture Organisation (FAO)."" || Environmental | Land, Soil & Geology | Tailings generation and management -> ""On 18 February 2025, Sino Metals' Tailing Dams (TD 15F, TD15E, RD15C, and TD15B) located within the NFC Mining's Surface Area and plant boundary collapsed, releasing a massive amount of highly toxic waste, including elevated heavy metals, into their environment..."" || Environmental | Land, Soil & Geology | Topsoil degradation and loss of soil fertility -> ""The pollution has impacted the community in various ways. It has devastated crops, made soils unusable, harmed income and food security and resulted in livestock deaths."" || Environmental | Air & Climate | Dust generation -> ""Ongoing earth-moving activities are worsening health risks by generating contaminated dust."" || Environmental | Air & Climate | Air quality degradation (dust, diesel exhaust, blasting emissions) -> ""Ongoing earth-moving activities are worsening health risks by generating contaminated dust."" | ""Due to exposure to toxic waste, the Petitioners and their families have suffered health issues such as diarrhoea, respiratory problems, and skin irritations."" || Environmental | Biodiversity & Ecosystems | Impacts on aquatic ecosystems and life below water -> ""The Waterways, particularly the Kafue River, support communities beyond Kalusale with approximately 300,000 households reliant on a fisheries-based livelihood."" | ""15 March 2025 – A river 'died' overnight in Zambia after an acidic waste spill at a Chinese-owned mine (AP Newsroom)."" || Social | Health, Safety & Well-being | Community exposure to dust, noise, pollution -> ""Due to exposure to toxic waste, the Petitioners and their families have suffered health issues such as diarrhoea, respiratory problems, and skin irritations."" | ""Ongoing earth-moving activities are worsening health risks by generating contaminated dust."" || Social | Livelihoods & Economy | Income generation and poverty reduction or exacerbation -> ""The pollution has impacted the community in various ways. It has devastated crops, made soils unusable, harmed income and food security and resulted in livestock deaths."" | ""The community faces severe poverty, with some trying to leave their residences in search of alternative livelihoods."" || Social | Living Conditions & Social Fabric | Livability (cost of living, food security, communication services) -> ""The Petitioners seek declarations of constitutional rights violations, comprehensive environmental remediation, equitable compensation for extensive damages, and immediate provision of necessities such as clean water, food and access to healthcare."" | ""The pollution has impacted the community in various ways. It has devastated crops, made soils unusable, harmed income and food security and resulted in livestock deaths."" || Governance | Regulation, Compliance & Institutions | Enforcement of environmental and social regulations -> ""19 to 21 February 2025: The Zambia Environmental Management Agency (ZEMA) confirmed that approximately 75% of Leach Residue was discharged and issued an Environmental Restoration Order No. ZEMA/NRO/ERO/2002/2025 to Sino Metals for clean-up and monitoring."" || Governance | Risk Management & Long-Term Stewardship | Tailings and waste governance -> ""On 18 February 2025, Sino Metals' Tailing Dams (TD 15F, TD15E, RD15C, and TD15B) located within the NFC Mining's Surface Area and plant boundary collapsed, releasing a massive amount of highly toxic waste..."" | ""19 to 21 February 2025: ... ZEMA ... issued an Environmental Restoration Order ... to Sino Metals for clean-up and monitoring."" || Governance | Transparency & Accountability | Accountability for accidents and environmental damage -> ""31 July 2025: Sino Metals launched a limited compensation exercise through a 'Standard Deed of Settlement and Release' containing an unlawful liability clause. Many affected Petitioners received no assistance or compensation."" || Governance | Stakeholder Engagement & Rights | Stakeholder inclusion in decision-making -> ""An order to stop threatening and preventing the Petitioners from communicating with their lawyers and other Stakeholders, including NGO representatives."" | ""An order to allow access by independent experts, lawyers, stakeholders, NGO representatives, and others willing to help the affected communities""",,"Kalusale, Chambishi, Kalulushi District, Copperbelt Province",copper,Sino Metals Leach Zambia Limited,Environmental || Environmental || Environmental || Environmental || Environmental || Environmental || Environmental || Environmental || Social || Social || Social || Governance || Governance || Governance || Governance,"Water Resources || Water Resources || Water Resources || Land, Soil & Geology || Land, Soil & Geology || Air & Climate || Air & Climate || Biodiversity & Ecosystems || Health, Safety & Well-being || Livelihoods & Economy || Living Conditions & Social Fabric || Regulation, Compliance & Institutions || Risk Management & Long-Term Stewardship || Transparency & Accountability || Stakeholder Engagement & Rights","Acid mine drainage || Surface water pollution and quality degradation || Freshwater ecotoxicity (heavy metals, pH changes, sensitive species) || Tailings generation and management || Topsoil degradation and loss of soil fertility || Dust generation || Air quality degradation (dust, diesel exhaust, blasting emissions) || Impacts on aquatic ecosystems and life below water || Community exposure to dust, noise, pollution || Income generation and poverty reduction or exacerbation || Livability (cost of living, food security, communication services) || Enforcement of environmental and social regulations || Tailings and waste governance || Accountability for accidents and environmental damage || Stakeholder inclusion in decision-making"
https://www.southernafricalitigationcentre.org/zambian-communities-sue-mining-giants-over-spill-disaster/,20250918,Zambian communities sue mining giants over spill disaster - Southern Africa Litigation Centre,live_ok_trafilatura,0.99,0.99,0.9,"Environmental | Water Resources | Acid mine drainage -> ""releasing an estimated 50 to 900 million litres of acidic waste into the Mwambashi and Kafue river systems."" || Environmental | Water Resources | Surface water pollution and quality degradation -> ""releasing millions of litres of highly toxic waste into critical waterways."" || Environmental | Water Resources | Freshwater ecotoxicity (heavy metals, pH changes, sensitive species) -> ""Ministries and independent researchers confirm unsafe levels of heavy metals;"" || Environmental | Land, Soil & Geology | Tailings generation and management -> ""collapse of multiple tailings dams on 18 February 2025"" | ""tailings storage dams within the area controlled by NFC Africa mining have had a devastating impact on the land and water that the Kalusale community depends on."" || Environmental | Land, Soil & Geology | Land disturbance and land-use change -> ""devastated farmland"" | ""destruction of farmland, livelihoods, and health impacts."" || Environmental | Biodiversity & Ecosystems | Impacts on aquatic ecosystems and life below water -> ""releasing an estimated 50 to 900 million litres of acidic waste into the Mwambashi and Kafue river systems."" | ""releasing millions of litres of highly toxic waste into critical waterways."" || Social | Health, Safety & Well-being | Community exposure to dust, noise, pollution -> ""have been living with poisoned water, devastated farmland, and grave health risks."" | ""Ministries and independent researchers confirm unsafe levels of heavy metals;"" || Social | Livelihoods & Economy | Income generation and poverty reduction or exacerbation -> ""destruction of farmland, livelihoods, and health impacts."" | ""families rely on small-scale farming near local waterways—the Chambeshi stream, Mwambashi river, and Kafue river—for drinking water, cooking, irrigation, raising livestock, and fishing."" || Social | Living Conditions & Social Fabric | Social infrastructure and amenities (education, healthcare, public services, leisure) -> ""most victims have not received clean water, proper healthcare, or fair compensation."" || Social | Equity, Rights & Vulnerable Groups | Freedom and justice impacts in nearby communities -> ""the petitioners argue that the respondents violated their constitutional rights to life, dignity, property, a healthy environment, and access to justice."" || Governance | Regulation, Compliance & Institutions | Enforcement of environmental and social regulations -> ""This case is a test for Zambia's ability to enforce its own environmental laws, protect its citizens, and ensure that foreign-owned mining companies cannot operate with impunity."" || Governance | Transparency & Accountability | Accountability for accidents and environmental damage -> ""seeks accountability for one of Zambia's worst environmental disasters"" | ""holding powerful companies accountable."" || Governance | Risk Management & Long-Term Stewardship | Tailings and waste governance -> ""A comprehensive, independently monitored environmental remediation plan."" | ""Long-term mechanisms, including an escrow fund, to restore contaminated land and water.""",,"Kalusale, Chambishi, Copperbelt province",,Sino Metals Leach Zambia Limited; NFC Africa Mining Limited,Environmental || Environmental || Environmental || Environmental || Environmental || Environmental || Social || Social || Social || Social || Governance || Governance || Governance,"Water Resources || Water Resources || Water Resources || Land, Soil & Geology || Land, Soil & Geology || Biodiversity & Ecosystems || Health, Safety & Well-being || Livelihoods & Economy || Living Conditions & Social Fabric || Equity, Rights & Vulnerable Groups || Regulation, Compliance & Institutions || Transparency & Accountability || Risk Management & Long-Term Stewardship","Acid mine drainage || Surface water pollution and quality degradation || Freshwater ecotoxicity (heavy metals, pH changes, sensitive species) || Tailings generation and management || Land disturbance and land-use change || Impacts on aquatic ecosystems and life below water || Community exposure to dust, noise, pollution || Income generation and poverty reduction or exacerbation || Social infrastructure and amenities (education, healthcare, public services, leisure) || Freedom and justice impacts in nearby communities || Enforcement of environmental and social regulations || Accountability for accidents and environmental damage || Tailings and waste governance"
https://www.terradaily.com/afp/250925133556.sylyntp3.html,20250925,Dozens more Zambian farmers sue over toxic mining spill,live_ok_trafilatura,0.99,0.99,0.9,"Environmental | Water Resources | Acid mine drainage -> ""releasing millions of litres of acidic mining residue into the environment."" | ""According to SML, about 50 million litres of waste had been spilled at the site of the incident"" || Environmental | Land, Soil & Geology | Topsoil degradation and loss of soil fertility -> ""more than two million square metres of land was visibly contaminated with an average residue depth of 0.3 metres (1 foot)."" || Social | Health, Safety & Well-being | Community exposure to dust, noise, pollution -> ""exposure to the population had caused a range of health issues including abdominal pains to skin irritations, respiratory issues, vomiting and blood in urine."" || Social | Living Conditions & Social Fabric | Demographic changes (migration, influx of workers, displacement) -> ""They are seeking $220 million in damages to cover environmental and health impacts as well as relocation costs, the court documents said."" || Governance | Risk Management & Long-Term Stewardship | Tailings and waste governance -> ""a waste storage facility burst near the town of Kitwe, in the heart of Zambia's copper belt, releasing millions of litres of acidic mining residue into the environment."" | ""The company, Drizit, had been hired through a government tender to assess the damage and clean up the environment, but its contract was drawn up with Sino-Metals Leach. The contract was terminated a day before the final report was due."" || Governance | Stakeholder Engagement & Rights | Stakeholder inclusion in decision-making -> ""They also accuse the company of attaching liability waiver clauses to its compensation agreements, which they say effectively prevent affected residents -- most of whom are illiterate -- from seeking further legal recourse.""",,"Kitwe, Copperbelt",copper,Sino-Metals Leach,Environmental || Environmental || Social || Social || Governance || Governance,"Water Resources || Land, Soil & Geology || Health, Safety & Well-being || Living Conditions & Social Fabric || Risk Management & Long-Term Stewardship || Stakeholder Engagement & Rights","Acid mine drainage || Topsoil degradation and loss of soil fertility || Community exposure to dust, noise, pollution || Demographic changes (migration, influx of workers, displacement) || Tailings and waste governance || Stakeholder inclusion in decision-making"
https://www.terradaily.com/reports/Dozens_more_Zambian_farmers_sue_over_toxic_mining_spill_999.html,20250926,Dozens more Zambian farmers sue over toxic mining spill,live_ok_trafilatura,0.99,0.99,0.95,"Environmental | Land, Soil & Geology | Tailings generation and management -> ""The spill occurred in February when a waste storage facility burst near the town of Kitwe, in the heart of Zambia's copper belt, releasing millions of litres of acidic mining residue into the environment."" || Environmental | Land, Soil & Geology | Land disturbance and land-use change -> ""According to the applicants, citing ""results from independent studies"", more than two million square metres of land was visibly contaminated with an average residue depth of 0.3 metres (1 foot)."" || Social | Health, Safety & Well-being | Mental and physical health impacts on communities -> ""They said the exposure to the population had caused a range of health issues including abdominal pains to skin irritations, respiratory issues, vomiting and blood in urine."" || Social | Living Conditions & Social Fabric | Demographic changes (migration, influx of workers, displacement) -> ""They are seeking $220 million in damages to cover environmental and health impacts as well as relocation costs, the court documents said."" || Governance | Transparency & Accountability | Accountability for accidents and environmental damage -> ""They also accuse the company of attaching liability waiver clauses to its compensation agreements, which they say effectively prevent affected residents -- most of whom are illiterate -- from seeking further legal recourse.""",,Kitwe,copper,Sino-Metals Leach,Environmental || Environmental || Social || Social || Governance,"Land, Soil & Geology || Land, Soil & Geology || Health, Safety & Well-being || Living Conditions & Social Fabric || Transparency & Accountability","Tailings generation and management || Land disturbance and land-use change || Mental and physical health impacts on communities || Demographic changes (migration, influx of workers, displacement) || Accountability for accidents and environmental damage"
https://www.thecooldown.com/green-business/sino-metals-leach-zambia-impact-environment/,20250930,Chinese legal mastermind strategizes against giant threat hidden in plain sight: 'Under lock and key',live_ok_trafilatura,0.95,0.95,0.85,"Environmental | Water Resources | Surface water pollution and quality degradation -> ""waste from a copper mine owned by Sino-Metals Leach Zambia leaked into a river. People in Zambia lost their drinking water, fishing grounds, and crops."" || Environmental | Biodiversity & Ecosystems | Loss of ecosystem services -> ""waste from a copper mine owned by Sino-Metals Leach Zambia leaked into a river. People in Zambia lost their drinking water, fishing grounds, and crops."" || Social | Health, Safety & Well-being | Community exposure to dust, noise, pollution -> ""would be distributed to over 700 farmers affected by pollution."" | ""waste from a copper mine owned by Sino-Metals Leach Zambia leaked into a river. People in Zambia lost their drinking water, fishing grounds, and crops."" || Social | Equity, Rights & Vulnerable Groups | Wealth distribution and inequality -> ""The announcement didn't say anything about land or medical compensation. People who weren't farmers but were also affected by the pollution didn't receive any compensation either."" | ""Civil service workers reported to ICN that farmers received anywhere between $17 and $2,000 USD each. There wasn't any particular reason why anyone received the amounts they did."" || Governance | Transparency & Accountability | Monitoring and disclosure of environmental and social performance -> """"They are supposed to be public documents,"" Batakathi said, according to Inside Climate News. ""But they're under lock and key."""" | ""Inaccessible information wasn't a new problem to Zhang."" || Governance | Regulation, Compliance & Institutions | Enforcement of environmental and social regulations -> ""According to ICN, the Zambian government said Sino-Metals and Rongxing, a private Chinese mining company, would pay out 16.2 million kwacha in damages.""",Sino-Metals Leach Zambia,,copper,Sino-Metals Leach Zambia,Environmental || Environmental || Social || Social || Governance || Governance,"Water Resources || Biodiversity & Ecosystems || Health, Safety & Well-being || Equity, Rights & Vulnerable Groups || Transparency & Accountability || Regulation, Compliance & Institutions","Surface water pollution and quality degradation || Loss of ecosystem services || Community exposure to dust, noise, pollution || Wealth distribution and inequality || Monitoring and disclosure of environmental and social performance || Enforcement of environmental and social regulations"
