sourceurl,sqldate,title,scrape_status,in_zambia_confidence,mining_related_confidence,impact_confidence,impact_evidence,mine_name,region,mineral_type,mining_company,impact_level1,impact_level2,impact_level3
https://africa.com/zambia-acid-spill-jeopardizes-residents-health/,20250918,Zambia: Acid Spill Jeopardizes Residents' Health | Africa News | Africa.com,live_ok_trafilatura,0.99,0.99,0.9,"Environmental | Land, Soil & Geology | Tailings generation and management -> ""a dam in Chambishi, Copperbelt province, holding mining waste from Chinese mining company, Sino-Metals Leach Zambia, burst its walls and released acidic effluent into Kafue River's watershed."" | ""contaminants from the spilled mine tailings may also become airborne, posing a health threat if inhaled."" || Environmental | Water Resources | Surface water pollution and quality degradation -> ""released acidic effluent into Kafue River's watershed."" | ""polluted water and soil from an acid spill in Zambia's copper mining region pose a serious health risk"" || Environmental | Water Resources | Freshwater ecotoxicity (heavy metals, pH changes, sensitive species) -> ""The pollution killed fish, burned maize and groundnut crops, and led to the deaths of livestock"" | ""water samples from the area of the acid spill contained 24 different heavy metals, 16 of which, including nickel, lead, arsenic, zinc, and uranium, exceeded the threshold values set by the World Health Organization."" || Environmental | Land, Soil & Geology | Topsoil degradation and loss of soil fertility -> ""polluted water and soil from an acid spill in Zambia's copper mining region pose a serious health risk"" | ""burned maize and groundnut crops"" || Environmental | Air & Climate | Air quality degradation (dust, diesel exhaust, blasting emissions) -> ""contaminants from the spilled mine tailings may also become airborne, posing a health threat if inhaled."" || Environmental | Biodiversity & Ecosystems | Impacts on aquatic ecosystems and life below water -> ""The pollution killed fish"" || Environmental | Biodiversity & Ecosystems | Impacts on terrestrial ecotoxicity -> ""burned maize and groundnut crops, and led to the deaths of livestock, wiping out livelihoods of local farmers"" || Social | Health, Safety & Well-being | Mental and physical health impacts on communities -> ""people unknowingly drank contaminated water and ate affected maize. Now many are suffering from headaches, coughs, diarrhea, muscle cramps, and even sores on their legs."" | ""High exposure to these metals can pose serious health hazards, especially for children, older people, and pregnant women."" || Social | Livelihoods & Economy | Income generation and poverty reduction or exacerbation -> ""wiping out livelihoods of local farmers and posing harm to residents."" | ""the pollution ... led to the deaths of livestock, wiping out livelihoods of local farmers"" || Social | Health, Safety & Well-being | Community exposure to dust, noise, pollution -> ""people unknowingly drank contaminated water and ate affected maize."" | ""Beyond contaminated water and soil, contaminants from the spilled mine tailings may also become airborne, posing a health threat if inhaled."" || Governance | Transparency & Accountability | Accountability for accidents and environmental damage -> ""the Zambian government ordered Sino-Metals to restore the polluted river, rehabilitate the surrounding environment, and compensate over 500 affected farmers."" || Governance | Risk Management & Long-Term Stewardship | Tailings and waste governance -> ""a dam in Chambishi, Copperbelt province, holding mining waste ... burst its walls and released acidic effluent into Kafue River's watershed."" | ""contaminants from the spilled mine tailings may also become airborne"" || Governance | Stakeholder Engagement & Rights | Stakeholder inclusion in decision-making -> ""renegotiate all compensation agreements—ensuring the full involvement of affected communities—to promote intergenerational justice and restore livelihoods."" || Governance | Regulation, Compliance & Institutions | Enforcement of environmental and social regulations -> ""Civil society groups contended that the acid spill resulted from ""a broader pattern of gross corporate negligence and inadequacies in environmental compliance, oversight and enforcement."""" || Governance | Risk Management & Long-Term Stewardship | Long-term liability management (pollution, water treatment, land stability) -> ""In Kabwe, Central province, a lead and zinc mine, closed in 1994 but never cleaned up, has caused severe lead poisoning among residents. A civil society coalition has called a full clean-up and compensation for those affected by the pollution."" || Environmental | Water Resources | Water management challenges -> ""The Zambian government has undertaken some measures to mitigate the harm, including using lime to reduce acidity levels in the affected waterways."" || Governance | Reputation & Social License | Trust between mining companies, government, and communities -> ""Sino-Metals apologized for the environmental disaster and the harm caused to local communities, and promised to remedy the situation by cleaning up the river and to restore people's livelihoods ""to the best of our abilities.""""",,"Chambishi, Copperbelt province",copper,Sino-Metals Leach Zambia,Environmental || Environmental || Environmental || Environmental || Environmental || Environmental || Environmental || Social || Social || Social || Governance || Governance || Governance || Governance || Governance || Environmental || Governance,"Land, Soil & Geology || Water Resources || Water Resources || Land, Soil & Geology || Air & Climate || Biodiversity & Ecosystems || Biodiversity & Ecosystems || Health, Safety & Well-being || Livelihoods & Economy || Health, Safety & Well-being || Transparency & Accountability || Risk Management & Long-Term Stewardship || Stakeholder Engagement & Rights || Regulation, Compliance & Institutions || Risk Management & Long-Term Stewardship || Water Resources || Reputation & Social License","Tailings generation and management || Surface water pollution and quality degradation || Freshwater ecotoxicity (heavy metals, pH changes, sensitive species) || Topsoil degradation and loss of soil fertility || Air quality degradation (dust, diesel exhaust, blasting emissions) || Impacts on aquatic ecosystems and life below water || Impacts on terrestrial ecotoxicity || Mental and physical health impacts on communities || Income generation and poverty reduction or exacerbation || Community exposure to dust, noise, pollution || Accountability for accidents and environmental damage || Tailings and waste governance || Stakeholder inclusion in decision-making || Enforcement of environmental and social regulations || Long-term liability management (pollution, water treatment, land stability) || Water management challenges || Trust between mining companies, government, and communities"
https://allafrica.com/stories/202509290398.html,20250929,,wayback_ok,0.99,0.95,0.8,"Social | Livelihoods & Economy | Income generation and poverty reduction or exacerbation -> ""Zambia faces persistent economic challenges, including a high reliance on copper exports and vulnerability to fluctuations in global commodity prices (Saggese, Shawa, & Wani, 2025)."" | ""Although Zambia has attempted to diversify its economy beyond mining and agriculture, the country still faces significant hurdles on the path to long-term economic stability.""",,,copper,,Social,Livelihoods & Economy,Income generation and poverty reduction or exacerbation
https://allafrica.com/stories/202509290694.html,20250929,,wayback_ok,0.95,0.95,0.8,"Environmental | Water Resources | Surface water pollution and quality degradation -> ""recent reports have highlighted widespread water and soil contamination linked to a February mine spill in Zambia."" || Environmental | Land, Soil & Geology | Topsoil degradation and loss of soil fertility -> ""recent reports have highlighted widespread water and soil contamination linked to a February mine spill in Zambia.""",,,,,Environmental || Environmental,"Water Resources || Land, Soil & Geology",Surface water pollution and quality degradation || Topsoil degradation and loss of soil fertility
https://economictimes.indiatimes.com/news/international/business/a-trillion-ton-threat-hangs-over-critical-minerals/articleshow/124253611.cms,20250901,A trillion-ton threat hangs over critical minerals - The Economic Times,live_ok_trafilatura,0.98,0.99,0.92,"Environmental | Land, Soil & Geology | Tailings generation and management -> ""In Zambia, the US embassy ordered the evacuation of staff from the copper-mining city of Kitwe last month after a tailings dam being reprocessed by Sino-Metals Leach Zambia Ltd., a state-owned Chinese company, collapsed in February."" || Environmental | Water Resources | Surface water pollution and quality degradation -> ""The embassy described the disaster as the sixth-worst such accident in history, contaminating downstream communities with arsenic, cyanide and uranium."" || Environmental | Water Resources | Freshwater ecotoxicity (heavy metals, pH changes, sensitive species) -> ""The embassy described the disaster as the sixth-worst such accident in history, contaminating downstream communities with arsenic, cyanide and uranium."" || Social | Health, Safety & Well-being | Accidents and fatalities (including structural failures such as tailings dams) -> ""after a tailings dam being reprocessed by Sino-Metals Leach Zambia Ltd., a state-owned Chinese company, collapsed in February."" || Social | Health, Safety & Well-being | Community exposure to dust, noise, pollution -> ""contaminating downstream communities with arsenic, cyanide and uranium.""",,Kitwe,copper,Sino-Metals Leach Zambia Ltd.,Environmental || Environmental || Environmental || Social || Social,"Land, Soil & Geology || Water Resources || Water Resources || Health, Safety & Well-being || Health, Safety & Well-being","Tailings generation and management || Surface water pollution and quality degradation || Freshwater ecotoxicity (heavy metals, pH changes, sensitive species) || Accidents and fatalities (including structural failures such as tailings dams) || Community exposure to dust, noise, pollution"
https://insideclimatenews.org/news/22092025/chinese-mining-firm-downplays-toxic-waste-spill-in-zambia/,20250922,Chinese Mining Firm Downplays Toxic Waste Spill as Residents Reel From Impacts - Inside Climate News,live_ok_trafilatura,1.0,1.0,0.9,"Environmental | Land, Soil & Geology | Tailings generation and management -> ""the February collapse of its waste pit, known as a tailings dam, at a copper mine in Zambia resulted in only ""partial tailings leakage."""" || Environmental | Water Resources | Surface water pollution and quality degradation -> ""The highly acidic waste full of heavy metals surged into rivers and streams, killing aquatic life and leaving behind a layer of bloated, dead fish."" || Environmental | Water Resources | Freshwater ecotoxicity (heavy metals, pH changes, sensitive species) -> ""The highly acidic waste full of heavy metals surged into rivers and streams, killing aquatic life and leaving behind a layer of bloated, dead fish."" | ""two assessments, including the results of an earlier, independent study of the waste carried out on behalf of the Finnish embassy that found high levels of 16 heavy metals, including lead, arsenic and uranium."" || Environmental | Water Resources | Groundwater contamination -> ""Since the spill, residents living below the mine have not been able to safely use the groundwater they rely on for drinking, bathing, cooking and farming."" || Environmental | Air & Climate | Air quality degradation (dust, diesel exhaust, blasting emissions) -> """"Ongoing operations are generating untold dust, leading to the inhalation of hazardous and carcinogenic substances — including arsenic, cyanide, uranium, and other heavy metals,"" the complaint said, citing expert testimony."" || Environmental | Biodiversity & Ecosystems | Impacts on aquatic ecosystems and life below water -> ""The highly acidic waste full of heavy metals surged into rivers and streams, killing aquatic life and leaving behind a layer of bloated, dead fish."" || Social | Health, Safety & Well-being | Community exposure to dust, noise, pollution -> ""Some locals have also reported illnesses, including skin rashes, blood in urine, chest tightness, nose bleeds and blurred eyesight, after exposure to the waste."" || Social | Health, Safety & Well-being | Accidents and fatalities (including structural failures such as tailings dams) -> ""the February collapse of its waste pit, known as a tailings dam, at a copper mine in Zambia"" || Social | Livelihoods & Economy | Income generation and poverty reduction or exacerbation -> """"No assistance is being given or promised for the approximately 300,000 households that have lost their source of food and livelihoods and are living with uncertainty and fear,"" the complaint said."" || Social | Living Conditions & Social Fabric | Livability (cost of living, food security, communication services) -> """"They have continued to drink and use water from shallow wells and boreholes,"" the complaint said, and ""have no other option but to continue eating the contaminated crops."""" || Social | Equity, Rights & Vulnerable Groups | Freedom and justice impacts in nearby communities -> ""The company, the complaint said, ""has been detaining and arresting"" activists and other civil-society representatives who have visited impacted residents"" || Social | Equity, Rights & Vulnerable Groups | Stakeholder inclusion and community participation -> ""A lawsuit filed on behalf of affected residents in September accuses Sino-Metals of blocking lawyers and advocates from visiting impacted people"" || Governance | Regulation, Compliance & Institutions | Enforcement of environmental and social regulations -> ""In June, the Zambian government announced that Sino-Metals did not follow a government order to provide an assessment of its pollution, a first step for assessing damages and remediation. Since then, Zambia has taken over that process, which is not yet complete."" || Governance | Transparency & Accountability | Corporate transparency and reporting -> ""Sino-Metals then fired the consultant, alleging a contractual dispute."" || Governance | Risk Management & Long-Term Stewardship | Tailings and waste governance -> ""the Engineering Institution of Zambia, a professional regulatory body, alleged the tailings dam had operational and design flaws. The group said it was investigating the accident."" || Governance | Risk Management & Long-Term Stewardship | Closure planning and post-mining reclamation governance -> ""In June, the Zambian government announced that Sino-Metals did not follow a government order to provide an assessment of its pollution, a first step for assessing damages and remediation. Since then, Zambia has taken over that process, which is not yet complete."" || Governance | Risk Management & Long-Term Stewardship | Long-term liability management (pollution, water treatment, land stability) -> ""The lawsuit seeks immediate payment of $200 million as an emergency fund and $80 billion for a government-managed reparation and remediation fund.""",,,copper,Sino-Metals Leach Zambia,Environmental || Environmental || Environmental || Environmental || Environmental || Environmental || Social || Social || Social || Social || Social || Social || Governance || Governance || Governance || Governance || Governance,"Land, Soil & Geology || Water Resources || Water Resources || Water Resources || Air & Climate || Biodiversity & Ecosystems || Health, Safety & Well-being || Health, Safety & Well-being || Livelihoods & Economy || Living Conditions & Social Fabric || Equity, Rights & Vulnerable Groups || Equity, Rights & Vulnerable Groups || Regulation, Compliance & Institutions || Transparency & Accountability || Risk Management & Long-Term Stewardship || Risk Management & Long-Term Stewardship || Risk Management & Long-Term Stewardship","Tailings generation and management || Surface water pollution and quality degradation || Freshwater ecotoxicity (heavy metals, pH changes, sensitive species) || Groundwater contamination || Air quality degradation (dust, diesel exhaust, blasting emissions) || Impacts on aquatic ecosystems and life below water || Community exposure to dust, noise, pollution || Accidents and fatalities (including structural failures such as tailings dams) || Income generation and poverty reduction or exacerbation || Livability (cost of living, food security, communication services) || Freedom and justice impacts in nearby communities || Stakeholder inclusion and community participation || Enforcement of environmental and social regulations || Corporate transparency and reporting || Tailings and waste governance || Closure planning and post-mining reclamation governance || Long-term liability management (pollution, water treatment, land stability)"
https://misa.org/blog/access-to-information-central-for-good-governance-and-climate-resilience/,20250928,Access to information central for good governance and climate resilience | MISA Regional,live_ok_trafilatura,1.0,0.95,0.8,"Environmental | Water Resources | Surface water pollution and quality degradation -> ""widespread water and soil contamination linked to a February mine spill in Zambia."" || Environmental | Land, Soil & Geology | Topsoil degradation and loss of soil fertility -> ""widespread water and soil contamination linked to a February mine spill in Zambia."" || Governance | Stakeholder Engagement & Rights | Stakeholder inclusion in decision-making -> ""the lack of access to information deprives citizens of their right to participate in the decision-making process and hold elected representatives accountable for their acts or omissions and creates an environment in which corruption, maladministration and mismanagement of national resources may thrive"" || Governance | Transparency & Accountability | Anti-corruption and bribery risks -> ""the lack of access to information deprives citizens of their right to participate in the decision-making process and hold elected representatives accountable for their acts or omissions and creates an environment in which corruption, maladministration and mismanagement of national resources may thrive"" || Governance | Transparency & Accountability | Monitoring and disclosure of environmental and social performance -> ""access to information holds the promise of fostering good governance by improving information management, and by enhancing transparency, accountability and greater participation of the populace in public affairs"" | ""This year's theme, Ensuring Access to Environmental Information in the Digital Age, is especially crucial for Southern Africa, a region highly vulnerable to climate shocks.""",,,,,Environmental || Environmental || Governance || Governance || Governance,"Water Resources || Land, Soil & Geology || Stakeholder Engagement & Rights || Transparency & Accountability || Transparency & Accountability",Surface water pollution and quality degradation || Topsoil degradation and loss of soil fertility || Stakeholder inclusion in decision-making || Anti-corruption and bribery risks || Monitoring and disclosure of environmental and social performance
https://sl.china-embassy.gov.cn/eng/fyrth/202509/t20250918_11711074.htm,20250918,"Foreign Ministry Spokesperson Lin Jian's Regular Press Conference on September 18, 2025",live_ok_trafilatura,0.98,0.98,0.8,"Social | Health, Safety & Well-being | Community exposure to dust, noise, pollution -> ""Almost 200 people in northern Zambia affected by a major toxic spill at a copper mine"" || Social | Livelihoods & Economy | Income generation and poverty reduction or exacerbation -> ""voluntarily cooperated with the Zambian government in handling the incident, and compensated affected local residents"" || Governance | Transparency & Accountability | Accountability for accidents and environmental damage -> ""the companies concerned actively stepped up to their responsibilities, voluntarily cooperated with the Zambian government in handling the incident"" || Governance | Regulation, Compliance & Institutions | Compliance with national and international standards -> ""We have and will continue to request Chinese companies overseas to abide by local laws and regulations in their operation, pay special attention to their corporate responsibilities and strictly protect the environment.""",,northern Zambia,copper,Sino Metals Leach; NFC Africa Mining,Social || Social || Governance || Governance,"Health, Safety & Well-being || Livelihoods & Economy || Transparency & Accountability || Regulation, Compliance & Institutions","Community exposure to dust, noise, pollution || Income generation and poverty reduction or exacerbation || Accountability for accidents and environmental damage || Compliance with national and international standards"
https://www.ecofinagency.com/news-infrastructures/3009-49126-zambia-by-force-of-geography-is-becoming-an-africa-s-logistics-hub,20250930,"Zambia By Force of Geography, is Becoming an Africa's Logistics Hub - Ecofin Agency",live_ok_trafilatura,0.99,0.99,0.85,"Social | Livelihoods & Economy | Business opportunities (local supply chains, services) -> ""a domestic cobalt sulphate refinery scheduled for commissioning in late 2025 marks an important shift toward local beneficiation."" | ""Chinese freight forwarders have set up a consolidation hub at the border with the DRC, capitalising on copper and cobalt flows."" | ""DP World has invested in a $300 million dry port outside Lusaka, with warehouse capacity and a container depot already in operation."" || Governance | Regulation, Compliance & Institutions | Legislative and regulatory framework effectiveness -> """"Land-linked"" is now the official doctrine, embedded in the government's Vision 2030 and its 8th National Development Plan."" | ""Rail upgrades, biometric border systems, and digital freight tracking are all budgeted priorities."" || Environmental | Land, Soil & Geology | Transport corridors and access road impacts -> ""Three major trade corridors now connect Zambia to both the Atlantic and Indian Oceans."" | ""The Lobito Corridor, rehabilitated at a cost of roughly $455 million by a private consortium, has already begun moving long trains from the Copperbelt to Angola's Atlantic coast in just three days, compared to the two weeks required via Durban."" | ""the nearly complete Lusaka–Ndola dual carriageway, combined with one-stop border posts at key crossings, has reduced truck clearance times dramatically, reinforcing Zambia's role as a regional transit state.""",,Copperbelt,copper,,Social || Governance || Environmental,"Livelihoods & Economy || Regulation, Compliance & Institutions || Land, Soil & Geology","Business opportunities (local supply chains, services) || Legislative and regulatory framework effectiveness || Transport corridors and access road impacts"
https://www.ecofinagency.com/news-services/1809-48791-as-zambia-aims-to-triple-copper-output-a-skills-deficit-puts-jobs-at-risk,20250918,"As Zambia Aims to Triple Copper Output, a Skills Deficit Puts Jobs at Risk - Ecofin Agency",live_ok_trafilatura,0.95,0.95,0.9,"Social | Livelihoods & Economy | Employment creation and job security -> ""Zambia plans to triple its copper production by 2031 to meet growing global demand for green technologies and electric vehicles."" | ""According to the World Bank, this expansion could generate 200,000 direct jobs and nearly 300,000 indirect jobs."" || Social | Livelihoods & Economy | Human capital development (skills, training, workforce development) -> ""A national survey in 2020 revealed that Zambia's technical training is inadequate and poorly aligned with market needs."" | ""An August 2025 study from the International Journal for Multidisciplinary Research found the skills gap exceeds 60% in critical technical areas, limiting productivity and industrial growth."" | ""The World Bank recommends modernizing university curricula and strengthening technical training to meet the needs of the mining sector."" || Social | Livelihoods & Economy | Income generation and poverty reduction or exacerbation -> ""Without rapid upskilling of local workers, many new jobs could be filled by foreign labor, suppressing wages and limiting the transfer of knowledge to young Zambians."" || Social | Equity, Rights & Vulnerable Groups | Wealth distribution and inequality -> ""As a result, the benefits of the mining expansion may bypass local communities and exacerbate regional inequality.""",,,copper,,Social || Social || Social || Social,"Livelihoods & Economy || Livelihoods & Economy || Livelihoods & Economy || Equity, Rights & Vulnerable Groups","Employment creation and job security || Human capital development (skills, training, workforce development) || Income generation and poverty reduction or exacerbation || Wealth distribution and inequality"
